id,name,address,phone_number,fio_representative
c02a1d46-605b-4d74-a31e-6c6b2ec9b515,НПО «Белоусова»,"клх Грозный, наб. Школьная, д. 54 к. 657, 910491",8 256 534 6727,Ефим Артёмович Ковалев
86ca668c-c450-40f1-8efe-b870bd53b7eb,НПО «Симонов-Суворова»,"п. Сортавала, пер. Народный, д. 614 к. 66, 714840",8 773 710 03 99,Алексей Филиппович Данилов
e424a081-f422-45e3-bbab-4332d007cf54,Кока-Кола Эйчбиси Евразия (Coca-Cola),"клх Шаховская, бул. Полярный, д. 8 стр. 1, 791601",8 808 571 26 86,Вера Ивановна Дмитриева
ae74d304-3d08-4f05-926f-eb255eba8261,Логинов Лимитед,"с. Верещагино (Перм.), ул. Виноградная, д. 56, 306223",+7 584 861 09 70,Антонина Степановна Громова
f22a87af-a641-449d-94f6-7f324f7502c4,НПО «Шестаков Фролова»,"д. Серов, алл. Пирогова, д. 95 стр. 583, 608095",8 (535) 434-81-22,Будимир Георгиевич Агафонов
2a78da60-69d4-49b6-9484-591690601bf1,ОАО «Сазонов»,"клх Онега, алл. Ленинградская, д. 595 к. 403, 574683",+7 (976) 841-62-07,Архип Владленович Козлов
115a5fb4-b841-42c9-a435-bd1a6888eb83,Юг-Нефтепродукт,"ст. Ялуторовск, пр. Уральский, д. 4/3, 804113",8 (656) 509-69-03,Леон Валерианович Шаров
c74114ee-d12d-4e02-b7c1-3c7327577fed,Ширяева Лтд,"с. Шереметьево, алл. Инженерная, д. 6, 687155",+7 716 410 7236,Фомин Антонин Артемьевич
ca45f630-3517-48a5-b248-aea6cbbc67c1,ЗАО «Бирюков Кабанов»,"ст. Сунтар, пр. Розы Люксембург, д. 7/4 к. 7/3, 843703",+7 001 310 69 43,Авдеева Лариса Михайловна
c2e26d8f-d4be-41a9-bceb-e75032f6f7d0,АО «Васильев»,"д. Ангарск, пер. Р.Люксембург, д. 595 стр. 3/2, 283874",8 077 365 03 60,Василиса Матвеевна Аксенова
b2022fa5-8467-4dd8-8a09-05ac36644c06,Фортум (Fortum),"к. Апатиты, пр. Трудовой, д. 4/3, 846340",+79687259479,Наина Дмитриевна Смирнова
95de7cb8-c540-4822-8477-b90e295399cd,Потапов Инк,"д. Бирск, бул. Просвещения, д. 75 к. 4, 394223",8 (278) 336-04-53,Мечислав Валерьянович Захаров
35dd32b8-c0b2-44bf-817a-99d7de8853f5,ЗАО «Суханова Петухова»,"п. Ивдель, пр. Фабричный, д. 3 к. 3, 110980",8 167 180 5228,Соколов Натан Августович
4d9569e9-ccff-4691-8159-1dad3772c551,"ЗАО «Никонова, Никитина и Захаров»","п. Руза, ул. Камская, д. 409 к. 8/5, 724230",+72066686287,Филипп Артурович Лебедев
5c9bfedc-a3d4-4693-bae6-08fd7cd34ca0,ОАО «Ситников»,"г. Мезень, пр. Мельничный, д. 909 к. 8, 618410",+75925222272,Анжела Рудольфовна Крылова
8bb3c109-8ae4-4a7e-bcb4-575009aded5f,ИП «Кириллова»,"г. Октябрьское (Хант.), ш. Боровое, д. 537 к. 86, 674851",8 224 246 3723,Варфоломей Григорьевич Третьяков
cf5cf2ec-2a21-4e7e-a988-2eda83738f35,НПО «Логинова-Пахомова»,"д. Жуковский, наб. Демьяна Бедного, д. 248 к. 3/4, 506261",+7 (880) 493-56-00,Николай Матвеевич Цветков
3c687b39-3a82-4fc3-b6b9-cab96e208627,ОАО «Голубев-Кулагина»,"д. Минеральные Воды, ул. Правды, д. 17 к. 1, 593156",8 571 813 50 35,Дарья Геннадьевна Лобанова
84305cca-f339-46b9-b361-12bb11de9ea2,ООО «Лебедева Гурьева»,"к. Чебаркуль, пер. Высоцкого, д. 4 к. 6, 161063",+7 396 170 33 49,Селезнев Лаврентий Георгиевич
8b778180-07ae-42b7-9869-8355209f5536,ИП «Соболев Афанасьева»,"клх Белокуриха, бул. Свердлова, д. 81, 841287",8 928 545 8518,Екатерина Никифоровна Ларионова
b6f81747-5cb1-4237-baab-d287dcd627ed,ОАО «Лихачева Давыдова»,"п. Баргузин, наб. Малая, д. 4/7 стр. 20, 919361",+7 590 811 4990,Горшкова Тамара Натановна
8ba1df5c-0fd0-49fb-a1e8-c110194eac3d,ТМК,"п. Чусовой, ш. Пирогова, д. 5/6 стр. 62, 263217",8 (746) 364-79-60,Колесникова Вероника Петровна
0b826bb5-5455-49aa-8cb8-f326e5fc26d1,ИП «Горбунов-Евдокимова»,"п. Курумкан, пер. Безымянный, д. 896, 361695",8 (552) 694-63-68,Давыдов Будимир Ерофеевич
a2a8d697-f261-4f1e-b160-2346b731fe49,ООО «Иванов»,"г. Слюдянка, пер. Новгородский, д. 2/8, 629302",8 (952) 633-5679,тов. Селезнев Ладислав Чеславович
d42e98cb-9368-46b3-8724-3fc40e571016,Водоканал Санкт-Петербурга,"с. Белореченск, пер. Дорожный, д. 7 стр. 30, 797899",8 745 809 89 70,Анастасия Артемовна Рябова
6314c50a-3d7d-4714-aa2b-cd2d7a669984,ЗАО «Лаврентьева-Муравьев»,"с. Неплюевка, алл. Блюхера, д. 726 к. 484, 709533",+7 (254) 999-4332,Соболев Мирослав Иосифович
085ee18e-4b3f-43d6-9725-0214f9c748fd,Щербакова Лтд,"г. Верещагино (Перм.), пер. Безымянный, д. 7/4, 477081",8 (180) 165-8736,Дроздова Нина Эльдаровна
5e560282-632d-4e83-a326-81234f50926a,НПО «Рогов»,"ст. Назрань, ул. Ручейная, д. 6/9, 930754",+7 568 061 68 33,Лукия Валериевна Крылова
44c76d7e-b2e1-4d0e-91e8-a4c2463e63b0,Крок инкорпорейтед,"к. Катав-Ивановск, бул. Энтузиастов, д. 73 стр. 778, 887644",8 504 106 48 97,Дементьева Евдокия Даниловна
20da8d52-4599-4fb1-abb3-55d17a34267e,"АО «Орлов, Сазонов и Беляков»","к. Калуга, пер. Каштановый, д. 3/4 стр. 77, 666398",+77883465209,Никитина Милица Кузьминична
290a4961-4fca-4456-b456-5fa83e851272,НПО «Романова Орлова»,"п. Моздок, ул. Парковая, д. 589 стр. 349, 150491",8 134 630 9363,Вероника Тарасовна Шилова
eb75e07c-5530-4571-a4fd-b130d43272a7,ЗАО «Овчинников-Цветков»,"п. Новый Уренгой, пер. Майский, д. 588 к. 75, 933955",84041183868,Елена Эдуардовна Рыбакова
6678b548-eab8-4c44-b2f0-189fa01cf782,АО «Носков»,"с. Жигулевск, пер. Заозерный, д. 4/9 стр. 8/2, 299442",+7 012 801 3779,Григорий Евсеевич Потапов
564c484f-914d-41a9-829b-fd576869204f,АО «Веселова»,"с. Александровск, пер. Панфилова, д. 993 к. 35, 554815",8 279 506 82 21,Андреева Людмила Васильевна
e25a2494-81f5-4403-abde-7c3c6ee7186a,ОАО «Степанова-Харитонов»,"г. Камень-на-Оби, пр. Мичурина, д. 5 стр. 8, 902681",8 698 115 52 48,Зимин Мирон Тарасович
18002e80-375a-4491-9bb5-33985c80b44f,РАО «Шестакова-Кулагина»,"к. Верхний Уфалей, пер. Некрасова, д. 247 стр. 6, 619024",8 204 146 72 30,Ирина Альбертовна Ефимова
78a4fcef-4be7-4634-9765-94bf80833e36,Нефтехимсервис,"п. Усть-Кулом, ш. Островского, д. 24 стр. 257, 464648",+7 364 137 80 43,Мельникова Василиса Борисовна
f4553cf7-a2b8-489a-8f26-4180540341e3,Турова Инкорпорэйтед,"ст. Назрань, ул. Ленинградская, д. 865 стр. 4, 257824",+7 084 124 30 68,Ермакова Валентина Леонидовна
b3fae079-0c1f-40c5-8a5d-ccd94857ce9a,ИП «Бирюкова Ларионов»,"п. Рязань, бул. 9 мая, д. 5/7 стр. 3/4, 305933",+7 (508) 373-9035,Федот Яковлевич Веселов
c7171b23-f8ad-4597-ab38-21a949f238fe,ОАО «Миронова»,"ст. Черняховск, ул. Воронежская, д. 4 к. 5/1, 963530",+7 (562) 133-0777,Иванов Сильвестр Иосипович
c4a9f138-3e89-40c6-96b8-c96ba2c2ac62,ГКНПЦ им. М.В.Хруничева,"д. Муром, бул. Каштановый, д. 3/9 стр. 169, 753794",8 (821) 710-58-50,Гедеон Федосьевич Баранов
8d682fd5-0173-47ae-8a03-d216651c1cd9,ИП «Шилов Волков»,"клх Петропавловск-Камчатский, алл. Мичурина, д. 5 стр. 5, 577985",8 (874) 643-9487,Шарапов Дмитрий Бориславович
aebdfecf-b1b0-4f1d-93e3-11387c83e1da,ООО «Одинцов Ларионов»,"клх Юрьев-Польский, пр. Ленинградский, д. 98, 737173",8 585 209 12 62,Юрий Харламович Титов
702b6d26-b192-4bd9-a910-90ecd7275f86,РАО «Лобанов»,"ст. Нарьян-Мар, бул. Чайкиной, д. 17, 862448",8 (563) 372-47-97,Агафонова Надежда Вадимовна
c4f563d1-daad-42f6-8267-276a38cca46d,"ОАО «Филатов, Денисова и Наумова»","г. Уварово, ш. Герцена, д. 36 стр. 47, 556510",+7 838 844 36 41,Гаврилова Клавдия Антоновна
9f86483e-56c5-44dc-81a1-4d3b20f3e882,"ООО «Якушев, Князева и Ситников»","ст. Салават, пр. Папанина, д. 8/1, 849433",8 (088) 848-2097,Поляков Анатолий Ильич
b4f31a8a-44c2-4e92-a34f-b5f9dd28b60a,РАО «Кириллов Белоусов»,"г. Котельнич, наб. Трудовая, д. 2/5 к. 486, 566833",8 (486) 871-17-59,Тарасов Иларион Ермолаевич
2bb321f5-275e-404a-a712-7300b586dd01,ОАО «Авдеев Блинова»,"п. Кизляр, бул. Крымский, д. 2/1, 586219",+75089810220,Наталья Петровна Громова
06331944-317b-4c30-9a78-9e8b1b953d56,Мясникова Инкорпорэйтед,"д. Плесецк, ш. Металлургов, д. 759 стр. 9, 872922",+78988980859,Селезнева Анжелика Кузьминична
b17a57d8-d231-4da6-90d5-ca2696e0d397,ОАО «Соловьев Зиновьев»,"п. Крымск, ш. Серова, д. 36, 491347",+7 (206) 668-1467,Денисов Ян Демьянович
470b1659-b708-48d6-9fa8-bd93082cb026,РАО «Уваров»,"г. Белый Яр (Томск.), алл. Тихая, д. 1/1, 017789",80099052204,Евдокия Леонидовна Цветкова
a99fc271-cb5d-451e-9be6-1182a20a2297,Командор-Холдинг,"клх Мостовской, алл. Прохладная, д. 3/5 к. 286, 046544",+71000824011,Анисимова Оксана Васильевна
d542d156-90ea-4e84-bcef-ab77b5626b28,НПО «Семенова»,"с. Адыгейск, пер. Жуковского, д. 4, 835894",8 249 921 3346,Елена Вячеславовна Жданова
1c14e85f-8ace-4a11-853d-a1d280b11837,"ЗАО «Ситникова, Дроздов и Анисимов»","г. Ростов, ш. Крестьянское, д. 50 к. 864, 464544",8 021 430 68 70,Вероника Анатольевна Сорокина
cbb6b651-b7e1-4433-85d1-71ae6cea6465,"АО «Смирнов, Жданова и Уваров»","г. Белгород, пер. Красноярский, д. 7/3, 435524",8 (748) 120-27-76,Нонна Игоревна Кононова
52290b33-87ec-429e-a529-f83ca5307f7a,ИП «Павлов Кузнецова»,"к. Углегорск, алл. Сплавная, д. 218 к. 5, 874259",+78188894095,Буров Любим Адамович
1a70c994-06a2-4fda-855d-36ffe5f1d2e4,"НПО «Некрасова, Дорофеева и Терентьев»","с. Игарка, ул. Иванова, д. 7/6, 296589",8 730 270 40 84,Никифоров Стоян Феофанович
ad6cf63d-9b29-4635-bb81-e513a1c0654d,Группа Волга-Днепр,"г. Курчатов, ул. Достоевского, д. 601, 899716",80021747753,тов. Евсеева Валентина Кирилловна
a6316751-8879-4aec-a360-ec943dd1997b,НПО «Лобанова»,"п. Ноглики, ш. Базарное, д. 8/1 стр. 84, 727040",+7 (373) 548-6815,Лобанова Ольга Матвеевна
41175cb5-6895-4e35-b74d-b720551342fa,ООО «Мясникова»,"г. Териберка, наб. Ореховая, д. 709 стр. 32, 546422",+7 (898) 894-4828,Щербакова Лидия Григорьевна
0b16c26f-0a96-46b1-9a08-22546f79374b,ОАО «Евдокимов Логинов»,"ст. Тамбей, ул. Омская, д. 4/9 к. 115, 020473",+7 (442) 001-8053,Зоя Александровна Романова
f01a8f9e-1b6e-4ede-a9f0-a2a6d7f8cee8,РАО «Данилов-Евсеев»,"к. Кириши, ш. Урицкого, д. 5 к. 970, 645545",8 (736) 866-23-01,Василиса Владиславовна Пахомова
19eaff7b-4ffb-4210-98db-a90271850292,ИП «Воронов-Кузнецова»,"ст. Александровск, ш. Краснопартизанское, д. 8/2 к. 6/4, 014566",8 (084) 545-56-26,Терентьев Сигизмунд Фадеевич
d0fd0f21-f9c5-4ec1-bc10-c538651b31bb,АО «Чернов»,"п. Кырен, ул. Коммунаров, д. 6/1, 356726",+76056097526,Богданова Эмилия Рудольфовна
d69e2862-caf5-4f75-b018-935b13056a7c,"ООО «Рожков, Егорова и Лобанов»","с. Поронайск, пр. Олега Кошевого, д. 1/3, 902056",8 135 080 4177,Кабанова Полина Ефимовна
c76015ff-8b14-41c7-a398-7d91fb4223af,ООО «Аксенов»,"ст. Таганрог, бул. Иванова, д. 471 к. 305, 720985",+7 000 743 9920,Аксенов Иларион Евстигнеевич
fd827dd2-f2c5-4fd4-b494-9117b67545c1,"ОАО «Пахомова, Журавлев и Дементьев»","г. Новокузнецк, бул. Волкова, д. 47 к. 67, 149737",8 (567) 800-63-07,Молчанов Олег Ермилович
8e0eb6ca-3b49-4752-b41e-51b4239a5d77,"НПО «Русакова, Ермаков и Поляков»","к. Волхов, алл. Смирнова, д. 9 стр. 76, 622837",+7 506 347 02 87,Ларионова Дарья Максимовна
102428ff-ef6a-4c75-a9ce-e46be4460419,ИП «Шарова-Третьякова»,"с. Череповец, ш. Весеннее, д. 4 стр. 5, 385552",8 322 769 1978,Меркушева Александра Викторовна
f2e2338b-c86f-4d08-a4b9-1af3c4ff53ca,"АО «Фокина, Игнатьев и Муравьев»","к. Новый Оскол, ш. Котовского, д. 847, 051518",+7 968 647 3940,Ольга Валериевна Евсеева
64f82285-10e6-463f-8f1e-acd67934d135,"РАО «Волкова, Фомин и Орлов»","г. Байкальск, ш. Вахитова, д. 7/6, 435494",+7 981 151 1225,Большакова Феврония Артемовна
debeb135-f404-4e20-b0c5-5b45423ab01c,"ЗАО «Блинов, Мишина и Мартынова»","г. Урус-Мартан, бул. Проточный, д. 803 стр. 2/1, 122329",8 (090) 336-72-99,Маркова Анжела Макаровна
4f3d0e6e-6417-40b8-a63f-6d366ffe6727,ОАО «Смирнов Филиппов»,"п. Пинега, ул. Калинина, д. 1, 761548",+7 (341) 657-25-62,тов. Щукина Вера Альбертовна
c7566e70-78cb-48ad-84ae-a184c031c8be,Андреев Лимитед,"п. Воткинск, ш. Береговое, д. 232 к. 9, 074464",+7 102 770 92 68,Авксентий Бенедиктович Фомин
d47482f5-e97b-4a0d-a6e0-f53d0c8b26d7,ООО «Цветков»,"с. Минусинск, пр. Пушкинский, д. 495 стр. 77, 006004",8 (433) 686-00-76,Осипов Ратмир Арсеньевич
73fa1f6e-658f-41d2-a10a-822c4f23e4f2,Фролов Лтд,"к. Валаам, пер. Тамбовский, д. 633, 467920",8 401 932 0106,Белякова Василиса Геннадиевна
e6f2f526-1d95-493b-98db-d784ad2f56dc,АО «Тихонов Моисеев»,"с. Верхоянск, наб. 9 Января, д. 8 стр. 7, 484127",+7 907 510 04 47,Орехов Нестор Фомич
37aae714-1beb-4bb9-b336-c832ba58e843,Национальная медиа группа,"д. Воркута, алл. Добролюбова, д. 647 стр. 679, 590296",+7 603 580 40 59,Костин Всеслав Терентьевич
7392c535-88bf-4216-a223-8e8e55fb24f9,ЗАО «Моисеев-Елисеева»,"с. Северо-Курильск, ул. Саратовская, д. 14 стр. 229, 037554",+7 779 566 6123,Измаил Валерьянович Григорьев
5328fb18-60ec-44dd-a0b1-c0c1eba6ebe6,"ЗАО «Маркова, Шарапова и Медведева»","клх Белогорск (Амур.), пр. Пархоменко, д. 2 к. 6/3, 778204",8 657 425 85 09,Евгения Болеславовна Устинова
846783bc-1d86-47b1-ac89-e7fec100d2bb,ООО «Зиновьев Белозерова»,"клх Сосновый Бор, бул. Котовского, д. 6 к. 6, 002894",8 (092) 756-22-38,Макар Эдуардович Ершов
89830346-475e-4c4f-bc0e-7ccf277a1f3c,АО «Ситников-Власов»,"к. Воскресенск, ул. Солнечная, д. 863 стр. 7/9, 075757",+7 115 400 2428,Наина Леоновна Борисова
40bef856-9385-4eec-9abd-991074fa5e7c,Елисеева Инк,"д. Усть-Калманка, бул. Вокзальный, д. 982 к. 45, 816478",8 201 095 44 96,Александра Архиповна Агафонова
f52036a9-8016-4f03-afde-2b7254b84a1e,"АО «Бобылев, Павлова и Мартынов»","д. Любань, бул. Тракторный, д. 3 стр. 65, 958361",8 (262) 730-6161,Юлия Львовна Гуляева
e4195e7b-869f-4b59-912d-e796604fa2a0,ИП «Крылова»,"ст. Кызыл, алл. 50 лет Победы, д. 86, 772597",+7 (564) 919-6584,Субботина София Геннадиевна
e31d25bf-06ed-460a-a8a3-e95596d0915b,Беляева Групп,"п. Пушкин, пр. Тихий, д. 5, 278043",8 (982) 801-07-54,Лидия Эльдаровна Щукина
7859e638-f432-40ed-bad1-0bdfa8be55c0,Приосколье,"клх Малая Вишера, ул. Мелиораторов, д. 6 стр. 4, 739785",+7 461 990 2505,Селезнева Клавдия Ефимовна
34d913f3-9c8f-483c-91e7-bac806878048,Некрасова и партнеры,"клх Тимашевск, алл. Специалистов, д. 64, 845771",8 (673) 436-40-13,Антонов Селиверст Васильевич
f3c42e03-7840-4af4-a794-1d6b471ac86f,ОАО «Авдеева-Некрасов»,"п. Балашов, наб. Глинки, д. 4/5 стр. 72, 066476",+77186881159,Митофан Глебович Матвеев
fd075dc5-b587-418e-8bcf-708fcedd567b,ИП «Жданова»,"к. Соликамск, бул. Базарный, д. 1 к. 76, 899926",+7 445 441 4151,Богданова Олимпиада Натановна
4ef030bd-248e-4b6e-bc64-baf1573d10dd,ЗАО «Кононова»,"к. Середниково, пер. Братский, д. 7, 239208",8 760 787 5917,Богданов Трифон Елизарович
5959ee98-9089-4feb-a457-2d5fd58bcd79,ЗАО «Лыткин Горбачева»,"клх Ялуторовск, бул. Прохладный, д. 4, 227962",8 485 276 2277,Сазонова Евдокия Ефимовна
6ac28859-1114-4846-aaf7-fc56541c57cb,"НПО «Захаров, Давыдова и Никитин»","п. Плесецк, бул. Торговый, д. 8/4, 304743",+7 (515) 265-93-69,Екатерина Болеславовна Носова
7515689d-47ff-4005-8641-d281ac5546a0,"НПО «Кошелева, Дмитриев и Рожкова»","д. Нижнеудинск, пр. Промышленный, д. 79, 885757",+7 350 035 49 39,Козлов Радим Изотович
4a1b78b0-da0d-4e58-b94d-e42af67e96d8,Соколова Инк,"к. Асбест, ш. Мелиоративное, д. 21, 791680",+7 640 028 44 35,Любомир Артемьевич Дорофеев
1f3bf0d3-0c03-4a81-84c5-6148b8070c3e,ОАО «Афанасьев»,"д. Смирных, наб. 9 мая, д. 98 к. 9, 287752",+7 062 009 60 61,Евграф Андреевич Гордеев
6bcd0896-f05b-42b1-9731-a7b78d217271,ОАО «Гришина»,"д. Малгобек, ш. Краснопартизанское, д. 2, 322242",+71654506561,Тимофеева Ия Сергеевна
50e0d358-59d0-4e2d-add0-cc85f01483c6,ТЭК Мосэнерго,"к. Троицк (Челяб.), наб. Песочная, д. 28 к. 51, 082888",+7 (459) 859-0909,Самсонова Ия Вениаминовна
f99919b1-5ab2-4803-ba93-3f69eff99ed7,Метафракс,"д. Барнаул, алл. Максима Горького, д. 71, 837334",+7 (422) 007-14-09,Константинова Лидия Захаровна
7577cea4-17bb-4569-8d51-a82ed0bc9029,Фомин Групп,"ст. Красновишерск, пр. Парижской Коммуны, д. 7/2, 315642",+7 806 371 53 99,Валерия Макаровна Сысоева
c01e8bcd-9e6d-4dd5-b6e9-b69f95df47fd,"РАО «Никифорова, Медведев и Вишняков»","к. Алдан, ул. Весенняя, д. 9/8, 009674",+7 (099) 124-3218,Котов Валентин Феодосьевич
20037820-180d-4d75-a791-1978141b5cfa,Блохин и партнеры,"к. Сосновый Бор, ш. Курганное, д. 42 к. 7, 368872",8 (697) 318-36-07,Федор Чеславович Абрамов
3fd5b5fd-6091-437e-986f-be9d1b18c3a5,ИП «Русакова Носков»,"клх Псебай, ш. Ворошилова, д. 62 к. 5, 611241",+7 940 319 7787,Евдоким Ефремович Доронин
75fd9f1a-15a2-4576-a484-e09fa8a85a90,ООО «Капустина Гурьев»,"г. Можайск, бул. Островского, д. 152 стр. 432, 557456",+77553937040,Ефремов Павел Власович
94596b45-ebbb-49f6-bc93-49bdb8c53ca8,ЗАО «Медведев-Казаков»,"д. Нарым, ул. Буденного, д. 145, 219893",8 641 716 03 68,Гуляев Харитон Венедиктович
1dafdb85-c918-481a-b48b-8792a17bb522,ИП «Некрасов-Овчинников»,"ст. Алагир, наб. Каштановая, д. 31 к. 8, 906470",+7 (732) 542-42-49,Игорь Гаврилович Стрелков
68bc7f37-9c4d-4762-bad0-dc9d8922ba26,ИП «Игнатьева»,"клх Забайкальск, алл. Казачья, д. 3 стр. 489, 773552",+75928306095,Ефремова Любовь Ивановна
771ff3f8-5b88-47f4-9a4f-267ffecfe9d7,Интернешнл Пейпер (International Paper),"г. Токма, алл. Дзержинского, д. 6, 046464",+7 (227) 223-38-98,Леонтий Филатович Муравьев
98984ea8-1d60-4e8e-9516-d99da63f0038,Гленкор Агро Мзк (Firada),"д. Волоколамск, ул. Кирпичная, д. 6/9 к. 9/6, 273479",+73309754285,Якушева Пелагея Георгиевна
3a3d7542-cdf2-4049-82a6-bbe81c8d0207,САФМАР,"к. Боровск, пр. Угловой, д. 57, 334391",+7 655 447 0403,Шубина Ираида Ильинична
614b0078-225e-401b-b6e8-52eeafe4869a,ООО «Калинина Афанасьев»,"ст. Шадринск, наб. Заречная, д. 356 к. 4/9, 532440",+7 243 060 41 61,Силина Ираида Рубеновна
a228442c-b1f5-4bfc-ae10-7e6790a10d37,Шашкова Инк,"к. Приозерск, ул. Виноградная, д. 4, 835691",+7 (052) 102-7259,Александра Кузьминична Авдеева
962ec33d-ae41-4fa5-8633-b98b2695ca3d,Emex,"к. Ревда (Сверд.), пр. Советов, д. 77 к. 19, 310805",8 159 355 2809,Киселева Клавдия Васильевна
8b37f080-98b8-4ec1-bf8b-21afefcecc2e,ЮниКредит Банк (UniCredit),"г. Кузнецк, ул. Юности, д. 1/4 стр. 869, 618463",8 (290) 696-11-78,Анна Робертовна Веселова
e00dd8c8-1f7c-48d9-a1d6-89261b2e65d6,ОАО «Петухов»,"с. Приозерск, бул. Воронежский, д. 5 к. 4, 604724",8 (019) 828-64-48,Борис Давыдович Ширяев
51e4cfeb-2037-43ad-b7d5-2c952da937a6,Сингента (Chemchina),"д. Сеймчан, пр. 9 Января, д. 4 к. 246, 673846",86771438932,Светлана Валентиновна Ефимова
5d12ec85-9ce8-4465-8fb6-ffb33ecfcd25,ИП «Ковалев-Павлов»,"ст. Махачкала, пр. Снежный, д. 30, 944900",+7 906 744 4657,Миронов Наркис Ефремович
ce25391c-4e1a-412e-be74-2b18b5f774ba,НПО «Колесников-Копылов»,"г. Сергиев Посад, алл. Амурская, д. 3/8 стр. 69, 317610",8 491 564 5240,Туров Осип Артёмович
7ab66f03-052e-4381-b2a0-ee915c720e6c,"ООО «Мельников, Петров и Пономарева»","с. Чебоксары, пр. Васильковый, д. 638 к. 3/5, 038396",+7 (693) 091-4903,Русаков Самсон Игнатьевич
