id,name,address,phone_number,fio_representative
685e57a8-20fe-4324-bcfc-b625aa74a952,Субботина Лтд,"с. Александровск-Сахалинский, наб. Привольная, д. 7 стр. 319, 858100",8 (014) 074-39-13,Ипатий Теймуразович Воробьев
731463bd-73cb-4c90-a63e-0ece89caddf7,Ермакова Лимитед,"ст. Серафимович, пер. Мая 1, д. 2, 966597",8 906 561 84 22,Бажен Якубович Шаров
fe20cded-8b8c-4914-93c0-0a40529af00d,ИП «Юдин»,"клх Чокурдах, ул. Репина, д. 1 стр. 8/2, 201398",+7 645 507 8004,Шилова Лукия Ниловна
0d75d94e-321d-4c39-aba9-07cfbe3aa3a0,"ЗАО «Казакова, Гришин и Родионов»","с. Нарткала, пр. Путейский, д. 261, 343666",+7 (499) 416-01-42,Дорофеева Маргарита Архиповна
44537137-b7cb-4856-b9ff-fbc49ddf7f6b,ООО «Галкина-Беляев»,"д. Черемхово, бул. 60 лет СССР, д. 6/3 к. 462, 972790",8 (425) 580-04-18,Василиса Константиновна Дроздова
b05bc894-9d0f-4b32-b446-1e0449a4ab84,Промышленно-металлургический холдинг,"д. Смоленск, пер. Гайдара, д. 23, 158162",8 618 672 35 74,Автоном Егорович Иванов
41b021a2-597d-4ae8-8f69-3eb60af300d3,"АО «Соболева, Филиппова и Русакова»","г. Бугуруслан, пер. Космонавтов, д. 2 стр. 2, 314447",8 659 012 9778,Нестор Давыдович Жданов
f266549d-71d0-43c4-b374-c1a29f3b4991,ЗАО «Блинов-Шестакова»,"с. Владикавказ, пер. Набережный, д. 6 к. 93, 038246",+7 (456) 315-1867,Костина Дарья Вячеславовна
625c0c12-93c6-44c9-9e62-dd390bf3242b,Сидоров Лимитед,"ст. Иркутск, пер. Лесозаводский, д. 61 стр. 869, 619197",86922594049,Гаврилов Гостомысл Адрианович
652d39c5-9fb5-4c2a-9f41-efbb555af31c,РАО «Филатова»,"д. Каменск-Шахтинский, бул. Проточный, д. 13 стр. 34, 490034",+7 410 763 46 77,Аксенова Вера Макаровна
79707c44-1c91-4fc9-ba41-533269e93806,"ОАО «Дроздова, Федосеева и Молчанов»","п. Лабытнанги, наб. Смоленская, д. 41 стр. 6, 223646",+79340648797,Мухин Ким Германович
4b2aad7f-75ef-4001-ad3c-16e4ec709cb5,Россельхозбанк,"клх Анива, пр. Глинки, д. 7, 272142",+78889872116,Лев Жанович Колобов
35476e42-545f-4bfb-ad98-21f874ab2804,"ООО «Мясникова, Морозова и Щукин»","к. Шамары, алл. Серова, д. 8 к. 43, 444860",8 111 514 8486,Колесников Ермил Фадеевич
9eb0b216-9456-4aa9-9564-2d39a8672643,РАО «Некрасов»,"г. Борзя, бул. Юбилейный, д. 2/8, 562933",89567307082,Зиновьев Любомир Игнатьевич
5e891585-ca2b-445a-b1a6-08949b3a7b16,ЗАО «Сорокина Исаев»,"клх Яхрома, алл. 40 лет Октября, д. 1/4 стр. 370, 089092",+75202465344,Селиверст Глебович Александров
699fb1cd-1543-4644-80f6-8d9a3e8472aa,ИП «Карпова»,"клх Каменномостский, наб. Володарского, д. 279 стр. 119, 351831",+73318347973,Логинова Маргарита Рудольфовна
ecaa2166-36cb-4f17-bfca-6df41ec884ab,Буров Инкорпорэйтед,"д. Урус-Мартан, бул. Ореховый, д. 4 стр. 7, 819087",+7 460 838 3374,Субботин Пахом Демьянович
441dcff5-6c62-4401-bf4e-8745cc96f1c5,"ЗАО «Селезнева, Самсонова и Муравьева»","д. Тарко-Сале, наб. Никитина, д. 1/9 к. 84, 371794",8 (554) 453-32-47,Осипов Владлен Димитриевич
2de66dbf-d6e9-4b6b-aefa-b621770f4a49,Мухина Лтд,"д. Объячево, пр. Полярный, д. 8 стр. 6, 832441",+7 (463) 104-78-32,Христофор Ермилович Абрамов
f3bec4b3-86fc-43e3-a7b8-a79d35b84740,Тимофеев Лтд,"п. Усть-Баргузин, ул. Юности, д. 335, 089706",8 757 573 95 29,Марина Святославовна Зуева
e53c162a-6d1c-402e-99fc-860770005eb4,ЗАО «Авдеев-Горбунова»,"к. Зеленоград, ул. Калужская, д. 21 стр. 1, 435126",8 (380) 981-53-60,Виноградов Рюрик Васильевич
056c9073-58e8-4f3a-8e9c-d8f9e5acf9a7,"НПО «Сергеева, Лыткин и Вишнякова»","с. Переславль-Залесский, пер. Клары Цеткин, д. 1/9 к. 8/3, 082686",+71972550739,Клавдия Робертовна Киселева
a1254d4d-44dc-45bb-83b9-d9679a26dce8,Элко Рус (Elko),"г. Объячево, бул. Курганный, д. 819 стр. 21, 924554",+73871990298,Ситникова Пелагея Константиновна
4c7d6c1c-97e0-47a5-9896-db202efc1da6,РАО «Жданова»,"д. Рубцовск, пр. Демьяна Бедного, д. 6 к. 451, 408486",+74432782306,Клавдия Максимовна Козлова
d8de869e-960b-43d2-afa3-a773da07575a,Кузнецов Групп,"с. Курильск, ул. Заовражная, д. 75 стр. 63, 037007",8 698 358 7754,Казаков Адриан Григорьевич
e9c2309a-dc1d-47f9-acfc-d7c73d727f31,НПО «Ширяева-Федосеев»,"п. Невинномысск, пер. Сплавный, д. 34 к. 883, 285485",+76521601577,Фролов Феофан Герасимович
d8f6e750-99cf-44a4-a3f1-2bd7e612e7e8,НПО «Лазарев»,"клх Рыбинск, ш. Полевое, д. 627 к. 1/2, 713064",+7 444 948 52 05,Субботин Орест Витальевич
cb16713b-4706-4e7f-aafb-209a2a3fafaa,РАО «Матвеева»,"ст. Апрелевка, пер. Рабочий, д. 8/5 к. 37, 010985",+7 364 434 9867,Феврония Эдуардовна Пестова
6da5364a-317a-4a03-802d-baf5331b2d88,ООО «Сидорова»,"клх Кош-Агач, ул. Победы, д. 50 стр. 814, 091035",8 (459) 167-5885,Романов Аркадий Богданович
14ed492e-f436-498a-b2b1-81dc35496a9a,Волгоградэнергосбыт,"к. Долинск, ш. Космическое, д. 60, 097268",8 211 100 97 72,Панфилов Максимильян Гертрудович
5ddc862e-a30c-4618-9d6f-a6fd352504f6,ООО «Кабанов»,"с. Сеймчан, наб. Февральская, д. 7, 399483",+76311263413,Маслов Лукьян Давыдович
63ee93ca-40f2-4f96-8fb8-a67bb2dd1a10,"АО «Андреева, Фомина и Третьякова»","ст. Армавир, пер. Заречный, д. 4 стр. 2/9, 873454",8 (368) 611-5953,Олимпиада Алексеевна Дорофеева
cc47cfd7-a996-4a6c-bae6-1298f5ca7638,ЗАО «Максимова-Брагина»,"к. Усолье Сибирское, бул. Вокзальный, д. 80, 856978",+7 345 957 9262,Калашникова Октябрина Семеновна
8db9f442-31a6-4adb-a425-37b7f9d37082,Нефтехимремстрой,"с. Чокурдах, ш. Титова, д. 3, 595068",+7 (496) 302-26-50,Тимур Тихонович Кузнецов
df79e40a-2168-4649-8e74-44a4ac0dbb71,Маслов Инк,"клх Невинномысск, пр. Гагарина, д. 4/9 стр. 36, 033179",+7 768 633 34 77,Калинина Зоя Дмитриевна
e063cb85-8154-4141-a162-cd31a252138d,ОАО «Аксенов»,"клх Балашов, алл. Коминтерна, д. 924 к. 122, 320312",8 (098) 889-1106,Авксентий Егорович Лапин
7f1e0c2f-4232-493c-9d23-f6dd9e6d7106,РАО «Исакова»,"к. Норильск, ш. Украинское, д. 840 к. 2/4, 510723",8 (607) 173-7961,Федор Тимурович Субботин
be9d2ea1-8e3a-4ac8-9aaf-5a18851ecb30,РАО «Степанова Соколова»,"к. Арзамас, наб. Специалистов, д. 701 стр. 101, 316667",+7 (648) 183-21-49,Никонова Анжелика Эльдаровна
caad65a4-3e48-4756-811d-7c336fff867f,Бобылев Лтд,"д. Архыз, бул. Сосновый, д. 9, 890458",+7 350 305 47 85,Клавдия Федоровна Никонова
578890a4-004d-4f7d-93ee-708f33172953,ИП «Исакова Сафонова»,"ст. Тында, ул. Поселковая, д. 7 к. 9/7, 111646",+7 (298) 431-7233,Евпраксия Матвеевна Доронина
f4bc9b89-cc62-43e1-b090-6e6b6b982cf1,АО «Капустина»,"д. Плес, наб. Полевая, д. 657 стр. 4, 984447",81091211955,Быков Евсей Арсеньевич
87572a48-81ee-4a12-87c2-1f03ba289f8a,Дроздов Лтд,"к. Луховицы, ш. Павлика Морозова, д. 2/9, 575671",8 (029) 475-0291,Феофан Адрианович Шашков
5bea99b2-7d56-4274-b188-7c59c538ce46,ЕвроСибЭнерго,"г. Каменск-Шахтинский, пер. Ленинградский, д. 198 к. 12, 294713",8 (502) 302-66-80,Радован Фёдорович Котов
3d88ca8e-0c1f-4bb5-be87-c5f9fdff751f,ЗАО «Журавлева Ермакова»,"с. Улан-Удэ, пр. Мостовой, д. 7 стр. 6, 640151",8 948 045 09 76,Богдан Филиппович Гордеев
7db51a32-711c-4123-b3dd-1dc27e3a3ddc,ООО «Красильников»,"клх Урус-Мартан, бул. Шмидта, д. 5 к. 2, 189013",8 (917) 472-9511,Влас Эдгардович Королев
5be270d8-e391-483a-ada8-5674bb8f6e78,"ООО «Гущин, Попова и Дементьев»","клх Одинцово, бул. Азовский, д. 1 к. 9/1, 554080",87243265738,Волкова Евдокия Филипповна
2086d6f3-3ff7-45b0-a914-1115cc3a9d23,"ООО «Петухова, Крылов и Голубева»","г. Бузулук, пер. Шолохова, д. 39 стр. 5, 762923",8 (784) 905-54-18,Ратибор Владиленович Беляков
828d41b0-08c8-4017-8a68-1b936a591040,"АО «Никитин, Соколов и Сидорова»","клх Неплюевка, ш. Лазо, д. 307, 504789",86121053325,Дарья Дмитриевна Голубева
cf1b1ac1-d8c0-43bf-b723-e0e6f6e6bb24,НПО «Симонов-Меркушева»,"п. Кош-Агач, ш. Культуры, д. 4/6 стр. 3/6, 257322",8 (943) 113-00-17,Алевтина Валериевна Артемьева
7816085a-39e5-4e5b-a781-6d0724274738,Роскосмос,"п. Руза, алл. Родниковая, д. 1/2 стр. 79, 724528",8 404 196 31 87,Мясникова Евпраксия Геннадьевна
39f4ca93-f350-4cb4-8a78-048f80f08a53,"ОАО «Аксенов, Владимирова и Кабанов»","г. Воркута, пер. Заречный, д. 737, 462420",+7 (767) 808-2175,Игнатьев Савватий Виленович
625e707f-c7af-413a-a95b-39a7bdf1fa70,Колобов Групп,"ст. Троицк (Моск.), наб. Петровская, д. 6 к. 2/8, 601186",+7 (149) 560-9762,Бобров Анатолий Ефимович
442487ab-89f4-4f7e-84af-029ee749d925,АО «Казаков Кудряшов»,"д. Шумиха, пр. Дорожный, д. 92 стр. 9, 251485",85629621361,Нонна Матвеевна Рожкова
742b7b71-a0dd-408c-94ea-94e827c0a2a3,ЗАО «Новиков-Агафонова»,"п. Дно, пр. Урожайный, д. 29 к. 3, 508271",8 (773) 023-7062,Фокина Нонна Афанасьевна
cf65887e-cf8e-4406-af0c-47de29fb86fd,ЗАО «Ефремов Гусева»,"к. Кирово-Чепецк, пр. Хвойный, д. 632, 852354",89097305322,Никитин Селиверст Ильич
8bc1a207-dd14-40b6-96ad-b6c36fcb734a,РАО «Николаева Гришина»,"к. Каргасок, ш. Космическое, д. 26 стр. 8/7, 574630",8 (735) 047-83-96,Изяслав Аксёнович Галкин
65cb04da-3820-4f91-a651-e953359fb905,"ИП «Мамонтов, Буров и Рогова»","клх Верхний Уфалей, ш. Логовое, д. 228 стр. 927, 889196",8 064 082 4852,г-н Симонов Марк Харлампьевич
a4e622cc-0ccd-437d-ba76-bad75490cd7c,ЗАО «Наумов-Карпова»,"п. Муравленко, пр. Ясный, д. 61, 877035",+7 021 338 25 29,Мартынов Антип Адрианович
d552ac29-a65c-4886-aa0f-38fdfbe91708,ИП «Кудрявцева-Колесников»,"клх Новосибирск, пер. Светлый, д. 5/8 к. 44, 022128",+7 (634) 596-9989,Павлов Мечислав Изотович
d26a4d1a-3e4e-4096-9a2a-e0f69d2a424b,Сибирская сервисная компания,"д. Соль-Илецк, бул. Коммунистический, д. 380 стр. 6, 992774",+7 175 582 1225,Валентина Валериевна Дроздова
b67a8a66-25b5-4f8b-8746-8bfa30f6a7f0,Никифорова Инк,"д. Люберцы, бул. Победа, д. 9/2, 572969",+7 329 358 9373,Акулина Святославовна Щербакова
e3e60ae6-81ac-4d72-aa89-d3221d110695,АО «Семенов»,"г. Шадринск, пер. Крестьянский, д. 94 к. 1, 982219",+7 599 715 5120,Сергеева Акулина Валентиновна
46d85a39-959c-47c8-96be-78e0f0e95bff,ИП «Лебедева-Егорова»,"г. Ноябрьск, ул. Пограничная, д. 3 стр. 6, 855374",8 (171) 658-74-23,Вадим Трофимович Кононов
0ecb5429-2217-41a2-9946-17225acb7fe6,"ОАО «Лазарева, Фомичев и Петрова»","с. Лагань, алл. Омская, д. 68, 299130",8 042 832 77 45,Андрей Демьянович Гаврилов
3306c9b7-188f-4082-bba2-a4b8d37c211b,Дорофеева Групп,"клх Усть-Кулом, алл. Высоцкого, д. 6 стр. 3, 785150",+7 (642) 463-84-31,Савин Ростислав Терентьевич
170f6303-6ab4-4e33-a678-53bd073bff97,ЗАО «Никифоров»,"г. Туапсе, наб. Фрунзе, д. 10 стр. 4, 346342",+7 (305) 994-2384,Остромир Филиппович Виноградов
0b5f0868-ea42-4ef9-a2dc-8b362a676bd5,Мухина Лтд,"д. Волхов, наб. Вавилова, д. 694 к. 746, 690709",+7 395 099 0885,Маслова Фаина Наумовна
44779f36-fdd8-4c08-9be6-c38e3b70b1d8,Вита Лайн,"ст. Сосногорск, бул. Крымский, д. 99 к. 535, 900869",+7 (395) 628-3481,Никодим Юльевич Моисеев
5e40639f-88dd-4350-bcac-752992874b5a,АО «Егоров»,"клх Соловки, пер. 50 лет Победы, д. 3 стр. 641, 348154",+7 (403) 573-88-80,Евгения Валентиновна Мартынова
011d1ee6-2be7-4ff1-bc79-d658829f113b,Воронцов Инк,"д. Тында, ш. Шоссейное, д. 5 к. 3, 481486",8 480 202 24 86,Сорокина Пелагея Геннадиевна
72225aa9-9f3c-4f49-8ed5-d3418f23d2e8,ООО «Алексеева Николаева»,"ст. Тарко-Сале, ул. Цветочная, д. 2 стр. 3, 647392",+7 (380) 392-84-41,Радим Харлампович Тихонов
2974b743-accc-4f96-9ff2-bbcc4d08fca7,ЗАО «Волкова»,"п. Усть-Баргузин, пр. Ворошилова, д. 12, 118831",8 (719) 130-64-67,Соколова Регина Викторовна
451ccfc1-057d-4c06-9c2f-2bba2beff57a,Нестерова Инкорпорэйтед,"п. Братск, ул. Горняцкая, д. 90 стр. 5, 809201",8 (547) 481-8355,Виктория Леоновна Тихонова
579888d9-8611-4edb-9eb4-82854d41cee5,"АО «Воронцова, Самойлов и Павлова»","д. Кострома, бул. Ульяновский, д. 54 стр. 718, 979486",86883982466,Муравьева Лора Степановна
576b92e9-213c-49e8-bf00-17bd016c46bc,"ОАО «Петров, Максимова и Игнатьев»","с. Нурлат, алл. Логовая, д. 5 стр. 242, 644720",+7 (382) 094-6578,Наталья Аркадьевна Михайлова
8bc0c4b7-a9b3-4929-a711-d47dc5a65d5f,РАО «Мясникова Семенова»,"п. Егорьевск, бул. Войкова, д. 7/3 стр. 988, 223420",8 (718) 938-87-85,Полина Вячеславовна Федотова
765b2227-2399-4654-96c1-43cf37bbef14,РАО «Суворова Суворова»,"г. Благовещенск (Амур.), наб. Геологов, д. 351, 164178",+7 (806) 545-0533,Панфилов Борис Викторович
a29787e5-896c-4a6b-9774-651c7e8fab91,ЗАО «Федосеев»,"с. Буденновск, ул. Специалистов, д. 670, 193794",+7 (439) 889-9636,Евдокимов Мартын Якубович
a4da7bbd-3e6f-4fe1-9a62-b953d9136c5c,РАО «Егоров Поляков»,"с. Кострома, пер. Каштановый, д. 57, 481374",8 025 985 1631,Маргарита Вадимовна Медведева
7ff5f08d-2932-415f-b6cc-67ce4294132f,ЗАО «Логинов Трофимов»,"к. Ербогачен, алл. Инженерная, д. 794, 632297",8 (005) 516-42-84,Ангелина Тимуровна Тарасова
87651f96-db8b-460d-8498-0ea06b243577,РАО «Гуляева Тетерина»,"к. Каневская, пер. Отрадный, д. 20 стр. 6, 201399",8 (785) 227-28-29,Митофан Анатольевич Михайлов
2c40eee1-cd60-4f7f-9732-a591b7336256,"ООО «Воробьева, Громов и Нестерова»","клх Семлячики, бул. Подлесный, д. 50 к. 1, 007022",+7 (969) 792-3013,Фомин Мартын Эдгардович
0fa77d23-2bed-415a-83a6-078913f6b5ec,НПО «Лобанова Самсонова»,"г. Владимир, алл. Подстанция, д. 2 к. 53, 587631",+7 (314) 764-98-50,Александра Никифоровна Некрасова
69614ec1-ab9e-473f-95d6-4681f0a1a649,АСЦ-Холдинг,"клх Бийск, пер. Главный, д. 1, 481154",+7 501 360 1589,Зоя Никифоровна Евсеева
c1b1050a-3734-4238-8ecb-646bb784bf01,АО «Данилова»,"к. Углегорск, пр. Специалистов, д. 7/2 к. 8/4, 097553",+7 (664) 973-00-18,Никонова Тамара Владимировна
24556a40-1d23-4658-be50-a32a0875a7a1,ООО «Филиппов Дмитриева»,"п. Дудинка, бул. Путевой, д. 70 к. 9/3, 107355",8 (530) 134-43-09,Анна Петровна Трофимова
7a894e2b-327d-45f8-9936-ab2610fdce05,"ИП «Мишин, Колобов и Исаев»","д. Великие Луки, пр. Степной, д. 43, 188852",8 (819) 514-11-94,Ия Тарасовна Власова
74b4b677-6ea8-4f6b-815e-cc68027e62be,Волгоградэнергосбыт,"п. Нижнекамск, пер. Загородный, д. 48, 029456",8 (599) 100-04-76,Давыд Ермилович Коновалов
3cae0fd7-b38c-4811-af20-83ea73af8109,"ИП «Панфилова, Мясникова и Лукин»","п. Сургут (Хант.), пр. Одесский, д. 22, 940753",+7 506 243 2345,Елена Ефимовна Зимина
1f420ebf-fa4a-43ec-90b5-ed6cb5617b9a,ОАО «Якушева-Гаврилов»,"к. Долинск, пер. Ручейный, д. 320 стр. 16, 221696",8 (549) 987-9006,Лобанова Елена Юрьевна
6030286d-d678-4f30-99fb-beef6e3156a7,ООО «Панов Комиссарова»,"г. Котельнич, ш. Станционное, д. 47, 208705",+7 (557) 376-18-43,Кузнецов Давыд Тимурович
7727d6b7-b24c-470f-ad66-59eefd12ba8e,ЗАО «Евсеев»,"с. Пышма, ш. Рязанское, д. 2/7 стр. 4, 878583",+7 130 151 0714,Никитина Олимпиада Натановна
014909b7-890e-4ce9-967f-69af934d277a,"ИП «Евдокимов, Самойлова и Шестакова»","к. Кропоткин (Краснод.), бул. Набережный, д. 1/4 к. 5/1, 076669",+7 337 154 8126,Лидия Григорьевна Рожкова
d09047a4-bbaa-4f25-b99b-8b2a68f48999,Волков Лтд,"п. Зеленоград, ул. Максима Горького, д. 44, 275696",+7 795 939 0506,Зоя Викторовна Гришина
9ab41dc6-c201-4612-aceb-f59b77f216ed,Воронцова Групп,"ст. Мыс Шмидта, пер. Киевский, д. 587 к. 573, 896398",+7 (053) 237-5598,Елисеев Феоктист Дорофеевич
71f7c130-4da6-49c3-8ca1-3c7032a16049,РАО «Константинова Молчанова»,"ст. Усмань, бул. Попова, д. 7/3 стр. 3/8, 175056",8 587 048 35 24,Рогов Юлиан Алексеевич
ecce7655-55d6-496e-9233-9dd16e6c2c5b,Попова Инк,"к. Новый Уренгой, ш. Новгородское, д. 7, 144289",8 345 548 7699,Ширяев Амвросий Владиславович
1e84a35a-c7da-4c12-891f-f440142444d6,ИП «Игнатьев»,"г. Астрахань, наб. Менделеева, д. 176 стр. 4, 302777",+7 (319) 275-08-12,Селезнева Агафья Семеновна
feb78afd-73b6-49b5-95f7-22b96d3261dc,АО «Алексеев»,"д. Верхний Уфалей, ш. Городское, д. 8 к. 452, 808247",+7 (824) 144-43-09,Суворов Митофан Феофанович
f2c1113c-70e1-4db7-8eeb-52f8325ef014,ЗАО «Ковалев»,"с. Старый Оскол, ул. Снежная, д. 8/1 стр. 743, 627120",8 (025) 337-4117,Полина Геннадьевна Шестакова
1abc48f7-bb30-4bda-a642-50b5f1dd16ba,АО «Попова-Борисова»,"клх Когалым, пер. Шоссейный, д. 301 стр. 2/4, 412570",8 (982) 623-2070,Суворова Алевтина Натановна
926eb077-57db-4b78-98b4-6f76e2febdcd,Европа,"клх Ярославль, бул. Некрасова, д. 7, 319852",+7 050 264 3291,Ия Семеновна Гаврилова
51bd26b7-ae75-4e82-b669-f0918cc72551,НПО «Носкова»,"д. Смирных, бул. Луговой, д. 5 стр. 50, 512487",+7 (114) 006-99-46,Пестова Ия Яковлевна
89847178-52bb-49e8-b056-e61bcea12036,"АО «Комаров, Соколова и Гаврилова»","д. Жигулевск, пер. Сосновый, д. 4/6 стр. 50, 165590",8 162 783 45 23,Евлампий Александрович Голубев
af55e06e-cd9c-4fb5-a901-7f2287954e4d,X5 Retail Group,"клх Одинцово, ул. Олега Кошевого, д. 817 стр. 965, 812981",+7 (351) 212-36-84,Костина Нина Болеславовна
3a5e04c4-b947-4e84-80db-012831a598ff,"ИП «Ларионов, Хохлова и Петухова»","клх Белореченск, пр. Деповский, д. 7, 210920",8 (250) 710-2062,Наумова Ксения Феликсовна
db910b39-36e6-4f17-83ec-e14854e8c82c,ООО «Комарова»,"г. Радужный, бул. Почтовый, д. 76, 544342",+7 276 054 97 34,Юлия Святославовна Доронина
9cf9501b-1e78-4b01-a4a7-1d4e1961dd9a,Лыткина и партнеры,"г. Черняховск, алл. Дачная, д. 25 к. 6/9, 268224",8 (742) 795-3390,Гремислав Венедиктович Красильников
8d16d5b3-5d59-4307-9158-618175fe8db7,ЗАО «Лазарева-Харитонов»,"г. Морозовск, наб. Спартака, д. 4, 838181",+7 (519) 621-32-04,Зуева Марфа Владимировна
b3d1b403-4283-4a2f-91c6-001e39bf204f,ИП «Беспалова-Колесникова»,"к. Кизел, пер. Авиационный, д. 4/8 стр. 443, 060218",80304978186,Третьяков Юрий Викторович
b15bbf22-7e78-4d8b-84ef-7d5100a6b4d3,Владимирова Групп,"г. Курчатов, пр. Овражный, д. 6, 715949",+7 148 463 6293,Вадим Августович Григорьев
6475c61a-6581-4d60-aa4c-ca5877bdd127,ООО «Харитонова-Денисов»,"с. Владикавказ, бул. Покровский, д. 5, 304146",+7 (579) 608-4963,Шилова Ольга Кирилловна
c3977b5c-8bba-4b56-8312-54b6b078a094,ИП «Колобова-Фомина»,"г. Томпа, пр. Космодемьянской, д. 80, 561784",84082176740,Максим Даниилович Громов
b5deb664-ee8a-45b7-a8bd-b5a4ad026de7,Дикси Групп,"ст. Калач-на-Дону, пр. Киевский, д. 8, 096569",8 (261) 761-4604,Егор Антонович Романов
8a28f5d1-6e46-4446-8b39-dffa493c0b1e,ТД БелАЗ,"г. Бугуруслан, пер. Инженерный, д. 9, 379185",+7 (288) 480-2476,тов. Исаева Майя Александровна
e5f42462-62ee-4147-b60d-a24ad4bead58,Красцветмет,"ст. Каспийск, бул. Деповский, д. 446 стр. 1/9, 100431",+7 (930) 074-6479,Адам Данилович Цветков
9524a5a6-0917-4d47-9822-8370fd904425,РАО «Логинов»,"п. Джейрах, пр. Гражданский, д. 39, 136875",+7 786 064 5863,Тарас Федотович Терентьев
3d75aa71-8674-423b-bd2f-3ed049280b15,Вертолеты России,"п. Шелехов, ш. К.Маркса, д. 2 стр. 21, 990610",81705607798,Варлаам Юльевич Кулагин
