id,name,address,phone_number,fio_representative
e5c8789a-8703-48fe-9312-835c2228998c,НПО «Гурьева-Блохин»,"ст. Яр-Сале, ш. Бабушкина, д. 933 стр. 154, 999634",+7 (753) 616-6172,Конон Богданович Константинов
c148e465-06ee-479f-bd5c-198249a7f95e,"ООО «Жданова, Архипова и Родионова»","с. Шумиха, ш. Партизанское, д. 849, 621907",8 051 899 26 39,Максим Андреевич Александров
087857a3-efb5-4b24-8571-5dba89eebf24,Сандоз (Sandoz),"к. Сыктывкар, пр. Моховой, д. 8/6 к. 503, 156100",8 (925) 860-7404,Фадей Феликсович Крылов
8876ac24-06db-4b9c-811d-4a6aeb8b130c,Кулагин Групп,"ст. Гремячинск (Бурят.), наб. Калужская, д. 682 к. 7, 193526",8 168 947 04 93,Илья Ефимьевич Молчанов
49e3fcd2-9d72-45da-8f90-0d4f0493bbc0,ЗАО «Кириллов-Абрамова»,"ст. Томск, ул. Советов, д. 2/8, 644940",8 (663) 188-73-86,Суханов Эдуард Матвеевич
720144b8-0365-4e12-861e-f6454ad554f5,Новиков Инкорпорэйтед,"клх Белореченск, пер. Первомайский, д. 167 стр. 5/8, 015497",8 584 703 19 32,Лукьян Теймуразович Артемьев
9ace028e-77c3-40ed-8cea-c8abee750af6,АО «Шаров»,"клх Хабаровск, наб. Горная, д. 4/2 к. 177, 140285",8 744 686 0179,Александра Львовна Кудряшова
7add7292-0e6f-45f3-a72a-b882c08770b8,Гусева Инкорпорэйтед,"к. Диксон, пер. Сельский, д. 718 к. 3, 705994",83084229546,Синклитикия Святославовна Борисова
e29daf57-bd7f-4078-92f4-75476910c36e,"РАО «Фокина, Герасимов и Самойлова»","клх Шатки, пер. Казачий, д. 7/3, 793717",+73059967783,Силина Глафира Игоревна
26ff220f-0095-4fe2-a449-b8cccb6b4b26,Кузнецова Инкорпорэйтед,"клх Сусуман, алл. Громова, д. 6 стр. 292, 408796",8 (304) 588-50-27,Прохорова Вера Геннадиевна
6570a147-b5ae-46b1-8450-3aa222c34a2c,Горбачев Инкорпорэйтед,"к. Мелеуз, пр. Свободы, д. 24 к. 5/4, 680162",+7 479 095 61 20,Потапов Варлаам Валерьянович
8a23604b-e32a-4635-a0f0-ee5f87a4e51f,"ООО «Рябов, Аксенова и Сергеев»","с. Черский, ш. Нахимова, д. 17 стр. 29, 896102",+7 (064) 164-54-10,Кузьма Фадеевич Кошелев
05f23c22-b470-47f4-b6b3-044553b509b9,НПО «Гуляева»,"д. Темрюк, алл. Ульяновская, д. 2 стр. 621, 123985",+7 (290) 869-17-92,Мир Борисович Колесников
4f4a153d-6093-455d-a1ad-24a0ae4391aa,Нестерова и партнеры,"с. Калининград, алл. Тихая, д. 1 к. 78, 306693",8 518 601 0727,Майя Викторовна Уварова
52693879-23cd-43a4-83c1-937aaff510c8,"НПО «Блинова, Самсонова и Артемьев»","к. Хасан, наб. Весенняя, д. 109, 616233",+7 389 913 8550,Иванна Георгиевна Макарова
6bc22909-9ff5-4879-bd90-34d81fefc685,Титан,"клх Кировск (Мурм.), бул. Некрасова, д. 9, 953871",+7 894 216 1267,Карпова Феврония Даниловна
a833009e-e91f-40d4-a45a-0cbcb9aba5c9,Л'Ореаль (L'Oreal),"с. Медногорск, бул. Гастелло, д. 821 к. 92, 654658",88584607555,Борислав Архипович Яковлев
18ef732c-6d78-4692-92c0-e6a0c68a4b0f,АО «Воронцова Кабанов»,"п. Бреды, пр. Коммунаров, д. 54, 595790",+7 670 127 4985,Данилова Синклитикия Тарасовна
ab452a8e-7e25-4de1-86ab-e76e545e16c0,РАО «Смирнов»,"с. Ряжск, бул. 1 Мая, д. 9/2 стр. 67, 730849",+7 (778) 914-42-57,Варлаам Тимурович Ефремов
25df78b1-e8cf-4100-95d5-d4392c63959e,ООО «Королев-Филатов»,"ст. Братск, алл. Амурская, д. 441 к. 601, 708338",+79914365497,Исидор Валерьевич Лукин
90ab0b14-0de6-45f2-8f88-52745c897e66,Тарасов Инкорпорэйтед,"д. Раменское, бул. Красноармейский, д. 5/1 к. 5, 943144",8 (272) 111-80-28,Нинель Федоровна Хохлова
e660ef2b-ad27-4738-b3b9-3b6da004565e,НПО «Антонов»,"ст. Красноселькуп, пр. 70 лет Октября, д. 46 к. 778, 673249",8 508 276 5484,Сидор Антипович Шарапов
d159a71e-b86b-407e-a797-8cc4730fb41f,Арконик СМЗ,"п. Гремячинск (Перм.), ул. Восточная, д. 1 стр. 4, 673242",+7 (494) 222-62-02,Галина Вячеславовна Пестова
3e614523-ec7b-47f6-833f-cafde794d7dd,НПО «Борисов-Егоров»,"к. Зеленогорск (Ленин.), пер. Новый, д. 3/5, 980969",8 (386) 812-97-69,Азарий Ефимьевич Елисеев
38ad004a-5384-410d-ac23-fa0700a82b49,"ОАО «Федосеева, Дорофеев и Ковалева»","с. Иваново, алл. Есенина, д. 585 к. 975, 267027",+7 057 527 81 41,Голубев Твердислав Глебович
ffe77939-c833-4927-8856-b0ba1db673df,НПО «Абрамова»,"клх Тутончаны, ш. Социалистическое, д. 2, 551582",8 (917) 723-85-30,Алла Егоровна Потапова
bdd48b86-c13c-4d21-9539-31faf4c9e86d,"ЗАО «Уваров, Носков и Кононов»","клх Яхрома, пер. Механический, д. 2/9 к. 364, 121207",+77214538019,Полина Михайловна Дорофеева
1967e507-cc18-4224-aa10-0dd436b56441,ООО «Кудрявцева»,"с. Курск, алл. Фестивальная, д. 94, 216074",+7 841 773 4818,Ратибор Антонович Калинин
5257e9b3-c819-44eb-b720-7abf34a707ef,НПО «Блохин»,"к. Невинномысск, бул. Малый, д. 6/3, 964844",+7 (466) 961-99-64,София Ивановна Рожкова
2bc1f903-213c-4fa5-9a63-d1d2014a2864,НПО «Волков-Блинова»,"клх Юрьевец (Иван.), пер. Иванова, д. 3/6 к. 4, 747943",8 (359) 984-97-64,Доброслав Фролович Новиков
e5c1a97c-9bc4-4e1f-ba90-6b54cdbe6b79,ОАО «Маркова-Морозова»,"ст. Миасс, пер. Металлистов, д. 6/8 к. 1/2, 179452",+7 758 900 6778,Афанасьев Кондрат Валерьевич
0504f85d-cada-4071-bd7b-d0e26d0962d8,"ООО «Селиверстова, Тихонов и Шаров»","к. Кинешма, наб. Хуторская, д. 56 к. 52, 047637",8 (617) 784-0273,Игнатьева Наталья Ждановна
d77ad972-2f73-4b02-991e-2b7d074aa884,ИП «Николаев»,"с. Адлер, алл. Коммунаров, д. 4/7, 700300",8 (840) 060-89-27,Жанна Натановна Федорова
dea59f54-2338-4939-b1e3-f9ef17b3b75a,Российская телевизионная и радиовещательная сеть,"п. Волгодонск, ул. Таманская, д. 5/7 стр. 358, 969037",8 (263) 773-7549,Юлиан Глебович Савин
d58db966-1584-4e5f-8dc1-d973146f7514,Никитин Инкорпорэйтед,"г. Тверь, алл. Мелиораторов, д. 189, 098516",+7 250 712 50 21,Сигизмунд Ануфриевич Беляков
8d7728c2-749c-44a5-a24b-003b0ff10794,Сафонова и партнеры,"г. Балашиха, пр. Спортивный, д. 5/9 стр. 2, 021711",+7 134 109 49 17,Назаров Бажен Ааронович
f79e6fd9-0324-4c6a-9daa-5acdb05af9cd,ЗАО «Третьяков-Евдокимова»,"г. Владивосток, ш. Северное, д. 1 к. 860, 997417",+74304998033,Вадим Иларионович Михеев
57ce1d9b-1579-44d1-9626-72f03a9044b4,"ЗАО «Зыков, Мельникова и Афанасьев»","д. Шамары, пер. Белорусский, д. 2 к. 7/3, 226105",+7 039 893 9542,Лидия Васильевна Киселева
a2431bf5-de27-4f95-8c1d-835a76db01eb,ООО «Афанасьев»,"п. Углич, пр. Дальневосточный, д. 361 стр. 4/3, 479846",8 376 710 14 45,Синклитикия Семеновна Крылова
3ed0f684-661a-47a4-8832-6cd9a559285a,"ЗАО «Блохин, Коновалов и Никифорова»","с. Горно-Алтайск, бул. Нижний, д. 3/7 стр. 13, 390721",+7 (245) 342-8605,Кириллов Эраст Валерьянович
f0e30c3e-75e6-41cd-9cd3-9cda313af959,Фомин Лтд,"к. Усть-Камчатск, ш. Советское, д. 1, 354852",8 (168) 006-6483,Лариса Леонидовна Александрова
72fe3e69-2d1c-4ac0-aef7-2f0a1666a884,АО «Быкова»,"с. Новочеркасск, наб. Заречная, д. 25 стр. 467, 399112",+7 (603) 374-5772,Гаврилов Доброслав Владленович
6c3b9d41-1fc4-4297-9da1-4f6bbced5792,Инвестнефтетрейд,"п. Владикавказ, наб. Осенняя, д. 74 стр. 568, 437946",+7 866 659 08 39,Сорокина Олимпиада Дмитриевна
85c4db93-eb78-42f5-b595-bcaf683b4c95,НПО «Агафонов-Шубина»,"клх Куртамыш, пер. Р.Люксембург, д. 698, 144982",+70816507696,Мстислав Еремеевич Капустин
4e343508-a34e-437a-aa41-4b1c3e57f6f2,ИП «Одинцова Селезнева»,"к. Чебаркуль, пр. Свердлова, д. 5/2 стр. 6, 038143",8 (766) 491-9417,Влас Изотович Фадеев
c55df687-ff0f-48c1-9c93-cccc6ad08e54,Субботин Лимитед,"д. Старый Оскол, бул. Кошевого, д. 6 стр. 7/9, 606217",8 (083) 263-11-45,Ангелина Владиславовна Чернова
0b5ccbc3-ad67-465d-9b52-ca6908a4cef3,Славнефть,"ст. Советский, наб. Кооперативная, д. 30, 883682",8 (147) 319-7908,Рыбаков Пантелеймон Жоресович
4e9554a8-3315-4796-95d1-af81e968a3f3,ЗАО «Кириллов-Бобров»,"п. Дмитров, ул. Садовая, д. 1/3 к. 9, 402654",89006899340,Дорофеева Зинаида Рудольфовна
2931c489-078e-4c3d-8044-e0c8db90519f,РАО «Константинова Кулакова»,"к. Арзамас, бул. 50 лет Победы, д. 50, 818506",8 (487) 504-01-72,Крюкова Вероника Эльдаровна
84aa13da-aca7-4f21-9c01-3ac0197ac544,Независимая нефтегазовая компания,"п. Воскресенск, пер. Проезжий, д. 685 к. 389, 132412",8 220 368 9378,Комарова Нонна Ниловна
eb7e8a22-050e-4907-b614-8706d6868fd8,АО «Симонова-Громова»,"д. Лабинск, пр. Лесхозный, д. 111 к. 29, 908690",+74188327517,Светлана Викторовна Смирнова
74736430-36b0-4473-ae24-9e734d192d76,"ООО «Журавлев, Воронцова и Лобанова»","г. Усть-Ордынский, бул. Кирпичный, д. 613, 299459",8 (586) 572-3910,Лазарев Чеслав Иосипович
52396c54-2a27-45ea-8f91-b28949a0bfa1,Транслом,"г. Дагомыс, бул. Маркса Карла, д. 5 к. 2, 098858",+7 089 781 54 59,Ерофей Ермилович Дроздов
8bea954f-ef4d-44e8-81e4-d9daa6f8ecf3,ТД Агроторг,"д. Якутск, ш. Монтажников, д. 3, 781651",+78245780970,Филарет Ануфриевич Колобов
372a23ac-7c14-4142-b852-d9fb203ab162,РАО «Гуляев Степанов»,"д. Кизилюрт, наб. Водопроводная, д. 8 стр. 4/4, 272471",+7 (879) 193-40-98,Артемьев Валерий Чеславович
1b55cefd-db54-4e5b-ab81-84c4db315c9b,ООО «Данилова-Лаврентьева»,"с. Клин, пер. Шолохова, д. 60 к. 718, 770964",8 666 011 86 82,Некрасов Семен Гурьевич
cdc118cf-d825-4fca-956e-0e6d028d0971,"ЗАО «Воробьев, Горбачева и Блохин»","ст. Кызыл, бул. Больничный, д. 391 стр. 24, 165497",+79517498779,Лора Евгеньевна Соболева
d0d20bef-86ea-4660-9309-86cb9a4af7b6,НПО «Архипова»,"к. Элиста, пр. Шмидта, д. 74 стр. 748, 994695",+7 (588) 440-71-85,Орехова Светлана Олеговна
731758de-69ec-48cc-9f97-23f201879480,Сингента (Chemchina),"п. Кулу, бул. Рыбацкий, д. 50, 831589",+78754725592,Меркушев Гордей Валерьянович
794cc541-4dc2-4d17-8fff-56dbd6e3fd3b,Тойота Мотор (Toyota),"с. Батайск, пр. Громова, д. 264, 224036",+7 254 450 4989,Тарасов Самсон Гавриилович
226b5c94-4f6c-4123-9c41-df73a30d91f2,"ЗАО «Коновалова, Капустина и Буров»","к. Междуреченский, бул. Ломоносова, д. 96 стр. 218, 523116",+7 455 012 7783,Галактион Юльевич Филатов
7a64075a-3fad-49d8-bbaf-82fda1bb8446,ЗАО «Самсонова Родионов»,"клх Катайск, алл. 8 Марта, д. 7/9 стр. 1/7, 863583",+7 570 987 3443,Викторин Ермилович Ковалев
f9d743c0-66db-433d-ba9d-538e6516e6b4,НПО «Воробьев Герасимова»,"г. Двинской, пер. Геологов, д. 95 стр. 2/7, 879497",+7 (589) 893-4575,Дорофеева Антонина Эльдаровна
6525495b-4f8f-486b-abfa-102c0434e70a,"ООО «Гусев, Владимирова и Вишняков»","клх Анапа, бул. Кошевого, д. 264 стр. 27, 914136",8 (284) 273-27-98,Тимофеева Анастасия Федоровна
f468f00e-f140-4016-af80-efbdefa421bd,РАО «Осипов»,"г. Глазов, наб. Нижняя, д. 2, 314201",86858250577,Семен Арсеньевич Агафонов
fbd258ff-f068-4088-8177-39b14abc6de9,Сидоров Инк,"п. Тулпан, алл. 60 лет СССР, д. 994 к. 580, 770933",8 834 240 2493,Филатова Октябрина Ефимовна
87403356-474f-4d4c-8a65-475a7144b87e,Метро Кэш энд Керри (Metro Cash & Carry),"ст. Южно-Сахалинск, алл. Заливная, д. 4, 660419",+7 (050) 783-85-10,Софрон Глебович Артемьев
b56b3855-d81c-45a0-a513-84ee47341480,РАО «Королева»,"с. Игарка, ул. Астраханская, д. 7/7 стр. 45, 692715",+7 090 460 77 26,Баранов Сигизмунд Ануфриевич
5694ac3e-a078-44e8-a466-f0cf1d1bfaa4,"ООО «Рожкова, Шубин и Борисова»","д. Мыс Шмидта, бул. Гаражный, д. 1/7 стр. 126, 459741",+79352076969,Рогов Остромир Изотович
aa25c7a3-5334-43f1-b631-897ff81920fc,Громова Инк,"г. Ковров, ш. Крестьянское, д. 6 к. 3, 057628",+7 (057) 707-65-22,Мясников Бронислав Филиппович
ff1a862b-efcb-40c7-89ff-68ecaf5e81aa,ОАО «Жукова»,"клх Юрьев-Польский, бул. Ульяновский, д. 25 стр. 1, 261058",85930935206,Иванна Рудольфовна Корнилова
00989c1b-ec4b-4a7f-a326-1434869d3928,"АО «Рогова, Панова и Калашникова»","к. Кимры, ш. Депутатское, д. 3/9 к. 28, 462119",8 (263) 959-09-00,Ипатий Ефстафьевич Щукин
878c474c-540d-49f4-a88a-43f42f2a17e0,Панфилова Лимитед,"д. Невинномысск, наб. Кирова, д. 95, 793193",+7 590 979 7000,Никитин Илья Денисович
a1cdb507-7ba6-4c74-befd-60ba094a07c1,РАО «Виноградова»,"к. Ейск, наб. Камская, д. 3/5, 967081",+7 510 341 1526,Федотова Агата Владимировна
74d556f7-3869-48a1-9619-020ecfa45b51,Одинцова Инкорпорэйтед,"клх Наро-Фоминск, наб. Вокзальная, д. 24 стр. 98, 696115",8 (942) 487-7648,Ермолай Бенедиктович Ефремов
69aba8f5-b3ca-4e7f-846a-f7c1a6ddb69c,ИП «Меркушева Жуков»,"клх Владимир, пр. Калужский, д. 5/6 к. 5, 102120",+7 (931) 577-9693,Максимов Святослав Александрович
69016f5a-8e03-4771-9fea-6a055f8704e7,Юдина Инк,"д. Алексин, ш. Весеннее, д. 7/1, 034232",8 933 214 88 99,Вера Ниловна Петухова
be3a2ea9-45f0-4b96-a347-04f6140222e4,ЗАО «Николаев-Пахомов»,"ст. Кулунда, ш. Горняцкое, д. 2/4 к. 3, 827043",85539044133,Всемил Всеволодович Захаров
2debc646-9cb4-4515-a34f-e4bda9d2f54b,ИП «Гаврилов Дьячков»,"с. Амдерма, ш. Фурманова, д. 3/3, 060817",89128332558,Ангелина Алексеевна Крюкова
ac482189-a4ea-4901-9a37-46d4c0745a44,ЗАО «Громова Корнилова»,"к. Аргаяш, алл. Щетинкина, д. 517 к. 5/3, 125525",8 715 803 28 98,Юлия Вячеславовна Пахомова
505eb324-8e10-4749-ad26-27034afc019a,Компания Газ-Альянс,"г. Учалы, алл. Некрасова, д. 899 стр. 6, 777296",8 (103) 860-1592,Всеволод Евсеевич Корнилов
c967b577-fa8f-49ab-b1ae-5b0532ea2659,ОАО «Якушева Денисова»,"ст. Павловская, ул. Спортивная, д. 5/2 стр. 8/7, 257897",+7 208 530 5947,тов. Рожкова Нонна Наумовна
97d8b793-5d72-4905-b03a-d00e77d4c38c,Беляев и партнеры,"ст. Елатьма, алл. Почтовая, д. 44, 286819",+7 (471) 473-3420,Октябрина Петровна Сафонова
ded7b553-9098-49cf-96db-ff280821cade,Энергосбытовая компания Восток,"г. Элиста, пр. Покровский, д. 9/7 стр. 47, 436835",+7 814 908 4109,Симонов Игорь Евстигнеевич
f61db3ed-ee5c-4e69-9445-54d1a60daee0,ООО «Виноградов-Семенов»,"п. Ряжск, бул. Ангарский, д. 9/6, 910635",82590374460,Матвей Архипович Копылов
89877668-8107-493f-9ef8-49885578a62e,РАО «Шубина»,"г. Череповец, ул. Казанская, д. 79 к. 987, 610607",+7 224 997 02 86,Сергей Валерианович Власов
9d6e44e1-86a8-42f6-bfca-4b78a6f1b221,АББ (ABB),"клх Абинск, бул. Слободской, д. 2/6, 804137",+7 (999) 620-8393,Тарасов Исай Даниилович
e1749974-bc5b-4b0e-be8a-f1fc78812134,Молчанов Лтд,"д. Геленджик, пр. Никитина, д. 93 стр. 9/7, 576229",8 590 209 36 43,Роман Давидович Лапин
7d4f34c6-11f9-4837-a3b8-a0228223036f,ЗАО «Ефремов-Галкин»,"ст. Смоленск, пр. Радищева, д. 57 к. 297, 139022",+7 (327) 560-61-95,Молчанова Александра Геннадьевна
a468dd56-28b6-4d2f-a90d-bf87a3f0c179,"НПО «Прохорова, Герасимов и Гордеев»","ст. Усть-Катав, наб. Менделеева, д. 180, 264600",+7 447 985 3813,Евсеев Петр Фомич
045d09d2-1709-4cb7-8c54-f76da3d6d024,АСЦ-Холдинг,"п. Морозовск, алл. Верхняя, д. 1 к. 7/6, 997925",+7 784 138 05 42,Мария Богдановна Владимирова
d09a2d36-d6ad-422d-97de-729cd8a4eb47,ОАО «Крюков Большаков»,"д. Сосьва (Хант.), наб. Литейная, д. 722 к. 9, 539487",8 407 759 8670,Яковлев Агафон Федосеевич
d0f84365-e5e3-40ef-b9d1-03ebd1651f52,АО «Блохин Пахомов»,"п. Краснокамск, наб. Широкая, д. 229 к. 349, 615423",+78142486486,Панов Парамон Ильясович
65b0dc2f-15bc-4298-9bc6-c719b0b0411e,Спортмастер,"д. Горно-Алтайск, алл. 50 лет Октября, д. 15, 044022",83289774912,Нестерова Нина Эльдаровна
56c47c88-dcbd-4ff0-981a-83f0f9cae423,ООО «Федорова-Алексеева»,"с. Плес, наб. Фадеева, д. 691, 871752",82743102490,Валерия Степановна Гуляева
33dccde4-371c-43c3-8065-d541b3149bec,Системный оператор Единой энергетической системы,"с. Алексин, ул. Саратовская, д. 40, 489304",+7 293 487 7403,Таисия Макаровна Щербакова
2d76fecf-955a-4cbf-93ad-070039aae90b,"АО «Белоусова, Лапин и Денисов»","г. Гремячинск (Бурят.), алл. Болотная, д. 4 стр. 8/3, 550004",8 (522) 870-72-43,Фадеева Марина Мироновна
ad965855-b21b-4828-a1a6-df2fc566601d,ИП «Соболева-Котова»,"г. Каспийск, ул. Лунная, д. 245 к. 68, 697815",8 722 601 4950,Феврония Кузьминична Логинова
e6258c1f-4580-491c-8bed-a9104ce8cbda,ООО «Брагина»,"г. Усть-Ордынский, ул. Окружная, д. 663 стр. 3, 713602",8 (425) 300-8002,Иванна Кузьминична Ситникова
45676a0e-f593-4557-b837-15bacc122662,АО «Бобылев Третьякова»,"клх Усть-Баргузин, ул. Снежная, д. 5/4, 312601",+7 388 982 33 57,Ларионова Анастасия Игоревна
56e64d87-b960-4be5-bac0-d9a66a858115,ООО «Сорокина-Соколова»,"ст. Благовещенск (Амур.), пер. Коллективный, д. 7 стр. 2, 709584",8 (646) 055-0842,Кирилл Фёдорович Киселев
fbaa3ecc-8996-4fcf-8b17-4a56937efbf4,Спортмастер,"г. Зеленогорск (Ленин.), бул. Мелиоративный, д. 605 к. 9/5, 642047",+7 874 163 7554,тов. Кошелева Маргарита Борисовна
e56ce67f-05a2-4677-992d-46e7c56c2b5d,ООО «Пахомов Носков»,"к. Казань, пер. Бажова, д. 81 к. 83, 671680",+7 364 420 11 64,Архипов Родион Зиновьевич
a4a76a9a-b4fe-44d8-a77f-6f66bfab9c02,ЗАО «Кулагина-Нестеров»,"д. Брянск, пер. Харьковский, д. 80, 448547",+7 513 099 3679,Раиса Эльдаровна Зиновьева
fa495c6a-27c0-49ca-b334-753f7f841470,НПО «Тетерин Сорокин»,"клх Минусинск, наб. Космонавтов, д. 27 стр. 9, 452389",8 (682) 593-20-00,Евдокия Харитоновна Колесникова
232bcc5e-9af6-423b-81fd-fc8ca798e058,РАО «Юдин»,"г. Верещагино (Перм.), алл. Островского, д. 736 стр. 62, 922630",+7 225 968 3994,Игнатий Жоресович Волков
72bc7a8e-0172-4e9f-b493-099f080ec74b,ИП «Копылов-Козлов»,"клх Калачинск, ул. Есенина, д. 49, 752253",8 003 646 3107,Лапин Чеслав Федосьевич
1df38d79-3552-4d0a-b443-dbf2a9e1113f,ОАО «Лихачева Зыков»,"г. Далматово, наб. Рыбацкая, д. 11 стр. 8, 463128",87969117111,Автоном Борисович Капустин
1a632558-2ae5-4e79-ab7c-33a47c47ece1,Емельянов Инкорпорэйтед,"п. Воркута, наб. Окружная, д. 718 к. 278, 707343",8 482 418 2900,Елизавета Леонидовна Шарова
8577c7f7-73e4-476e-b5ec-cd4e6af1ea39,ЗАО «Морозова Игнатьев»,"д. Энгельс, алл. Казачья, д. 4, 533436",8 (502) 207-9704,Ширяева Глафира Болеславовна
96e0aa97-3216-4094-b021-0f02d92d87b8,ОАО «Одинцова-Новикова»,"г. Шумиха, ш. Глинки, д. 643, 132770",80000641529,Нинель Ивановна Стрелкова
452e1668-e4bf-40ed-b7b4-43c6cda8a345,"НПО «Уварова, Белоусов и Власова»","клх Серафимович, алл. Ильича, д. 75 к. 6, 042305",8 (111) 864-83-94,Леонид Августович Данилов
b74b6381-0d4f-4514-b502-493daf49ea21,НПО «Логинова»,"клх Кажим, алл. Каштановая, д. 6/9, 110907",+7 (329) 837-31-61,Таисия Борисовна Ильина
cb4286bc-3406-443d-858f-84fb23e3f348,ИП «Макаров Воронцов»,"клх Анива, ул. Водопроводная, д. 373 стр. 536, 330353",+7 (371) 941-5311,Марфа Леоновна Терентьева
4e0ca34e-8cbd-4079-9314-f772a655a1ab,ИП «Емельянов Авдеев»,"ст. Пенза, пер. Станиславского, д. 5/5 к. 5, 379987",8 735 051 44 50,Рогова Мария Александровна
fcdc9f61-66d4-4f8a-bd0d-bc7902ef488b,"ИП «Белова, Силина и Кузнецов»","г. Дербент, ул. Ручейная, д. 70, 607132",+74759014195,Фролов Милен Аверьянович
371abc97-dcf1-4bb2-ba51-86e1ad04f3e6,АО «Осипова»,"ст. Яр-Сале, пер. Полтавский, д. 37 к. 12, 880427",+74464103577,Оксана Богдановна Евдокимова
3057092e-1acf-4032-abdc-b921ba46ced2,ЗАО «Панфилов Тарасов»,"п. Ачхой Мартан, наб. Войкова, д. 371, 380336",+7 136 308 8612,Надежда Никифоровна Никифорова
