id,name,address,phone_number,fio_representative
6c37e734-6842-42ee-a726-faf6cf014355,Концерн Титан-2,"г. Междуреченский, ул. Донская, д. 1 к. 408, 309337",89663366259,Михаил Тимурович Веселов
a1402ec0-4c6b-4bc4-a17f-e044198a72f4,"НПО «Королев, Вишнякова и Игнатова»","ст. Верхний Уфалей, наб. Восьмого Марта, д. 5/5 к. 77, 918522",8 (701) 485-59-77,Евдокия Эдуардовна Ширяева
21e3b3c5-7731-4f9c-a1a9-d674ac7b1702,Крюков Лтд,"клх Новый Оскол, ул. Чкалова, д. 83 стр. 468, 218432",+7 813 475 7523,Крюков Амос Герасимович
e84c7e8b-0f9f-4ff5-ace6-173b88165418,Лихачев Инк,"ст. Урюпинск, ш. Чернышевского, д. 6, 010606",8 952 900 7091,Ангелина Андреевна Кондратьева
0aa48dc5-df52-4f13-9032-a3f49c9e8290,ЗАО «Горбачев-Симонов»,"клх Аргаяш, наб. Терешковой, д. 48 стр. 52, 777317",+76078523801,Ситникова Елизавета Вячеславовна
51aa1026-e2e3-4d46-8793-0fe0391a47b2,РАО «Кулагин Нестеров»,"п. Старая Русса, наб. Хвойная, д. 8, 500108",8 (502) 209-7682,Олимпиада Валентиновна Николаева
28aff99f-a3c8-41d0-a69e-0e2516f1c6aa,Гурьева и партнеры,"ст. Благовещенск (Амур.), ул. Льва Толстого, д. 75 стр. 610, 362617",+7 864 127 5647,Анжела Юрьевна Мухина
f8e102de-76d2-470d-993c-d761141844be,"ОАО «Королев, Федосеева и Рыбаков»","г. Тутончаны, ш. Фадеева, д. 26 к. 421, 775257",+7 449 159 5184,Алексеев Григорий Ануфриевич
08e3a3e8-3d4c-4070-8317-c17c352c9046,ОАО «Петрова Прохоров»,"п. Плесецк, бул. Российский, д. 328 к. 52, 043728",8 551 414 3990,Сергеева Вера Григорьевна
1cd58e0f-10f8-4aad-8c4e-a88cde870991,ООО «Пестов»,"с. Обоянь, пер. Менделеева, д. 5, 503897",8 354 784 70 41,Мартынов Терентий Игнатович
8bd1c529-3829-4f0d-a83c-f07e3d4b092e,"ООО «Виноградов, Ларионов и Кононова»","ст. Саров (Морд.), наб. Коммунаров, д. 101 стр. 1, 700300",8 (867) 646-71-21,Ефремов Тарас Фёдорович
40045b47-7793-40cd-bfe6-4ebd4c4a77ed,НПФ Газфонд пенсионные накопления,"д. Азов (Рост.), ул. Торговая, д. 25 стр. 1/7, 009415",+7 (502) 589-2837,Спиридон Вячеславович Бобылев
895ae26c-e8c0-4328-95c6-b85e5072a46b,Норникель,"ст. Миллерово, ул. Смирнова, д. 4, 285346",8 197 056 02 90,Гремислав Тимурович Артемьев
c4ccdf0d-219a-4112-abe1-5c7e307814a4,ОАО «Дроздов»,"ст. Воронеж, алл. Флотская, д. 2/2 к. 69, 635564",+7 (291) 912-1802,Варфоломей Даниилович Шубин
4225d08d-89be-42a4-8a36-c50a5dbfc087,ИП «Федотов Логинова»,"п. Пушкинские Горы, ш. Фестивальное, д. 987, 712797",8 768 943 08 07,Алевтина Валериевна Рябова
82fce55d-8ad3-4b3e-bbaa-35d8aac021d5,ОАО «Пономарев»,"с. Нижневартовск, алл. Клары Цеткин, д. 7/1 стр. 9, 170448",+78445847800,Антонина Робертовна Бобылева
c478a686-6ddf-4ac3-a8de-d2b5d77d876c,ООО «Емельянова Щербакова»,"п. Долинск, наб. Боровая, д. 30 стр. 836, 250637",8 (952) 636-2046,Нинель Ниловна Муравьева
589b1996-5561-45c0-a589-5abef08258a2,АО «Шаров-Капустина»,"ст. Кызыл, пер. Семашко, д. 618, 306172",+7 896 896 5678,Васильева София Тимофеевна
6ebee014-9640-4eaa-b485-4bf3bdfdba39,ООО «Никитин Игнатов»,"клх Дудинка, пр. Олимпийский, д. 1/2 к. 766, 197417",+72455775700,Гурий Августович Силин
0b72e795-93be-4928-9244-2802d01e57dc,ЗАО «Ефимов»,"клх Кунгур, бул. Кузнецова, д. 574 к. 3, 369820",8 (979) 081-0933,Хохлов Афанасий Жоресович
c91737f9-0a3d-4a1e-b214-b69825c75a27,"ОАО «Дорофеев, Бобров и Цветков»","г. Печенга, алл. Дарвина, д. 9/5 к. 696, 563092",+7 (448) 227-2112,Семенов Леонид Богданович
7886ad6b-a16e-4276-b477-ac053f2a4244,"ООО «Афанасьев, Веселова и Гришина»","г. Кош-Агач, ш. Крылова, д. 31 к. 8, 490002",+7 796 266 9249,Никандр Евсеевич Попов
68daad8d-90fc-4635-9da3-8ecc62547a1a,Гаврилова Лтд,"с. Раменское, алл. Рыбацкая, д. 4/1 стр. 88, 681314",+7 417 330 7070,Анжела Павловна Медведева
8856bc13-07dc-4069-a3e0-b631e2863017,"ООО «Мишина, Зимин и Кононова»","клх Елатьма, наб. Ульяновская, д. 6/3 к. 39, 403577",+7 (436) 065-11-88,Захаров Боян Владиленович
e321209f-d395-4232-a602-d7aae534799e,ОАО «Беляева»,"к. Ахтубинск, наб. Волжская, д. 8/6 стр. 9, 739379",8 (216) 498-77-82,Мария Вадимовна Калинина
fdc9f542-9984-4eb6-b6f4-0031c50e22ec,"АО «Лукин, Соколов и Щербакова»","д. Минеральные Воды, ш. Магистральное, д. 42 стр. 50, 800986",+76219917362,Доронина Пелагея Евгеньевна
fe673d1a-2fcf-473d-8014-3b3674c9283c,"ООО «Родионов, Баранова и Зимин»","ст. Тулпан, алл. Котовского, д. 53 к. 925, 114689",8 (733) 594-5028,тов. Бобылев Варлаам Гертрудович
53f6472d-561b-4d85-a0ac-a37174f84e46,ООО «Игнатьев»,"с. Рубцовск, алл. Щербакова, д. 8 к. 9/1, 692321",8 (972) 600-7817,тов. Гусев Станимир Ярославович
7e7cbc0d-478f-4a3d-8d9d-c8de8f3c7121,"ИП «Антонов, Григорьева и Тихонова»","клх Кабанск, пер. Маяковского, д. 3/1 стр. 1/4, 778797",+7 901 355 13 47,Наина Ильинична Пестова
93ac36f8-f177-4d6d-97f9-c2979ef7bd16,"ОАО «Фомичев, Калинин и Гусева»","п. Новороссийск, пер. Таманский, д. 1/8 стр. 1, 755455",+7 (252) 153-7119,Аксенова Екатерина Степановна
bacd7d6e-203f-40c7-a8b5-0f67ea1552c6,"ОАО «Горшкова, Игнатьева и Лобанова»","к. Нефтекамск, алл. Октябрьская, д. 851 стр. 2/5, 181764",8 459 793 38 48,Конон Тихонович Голубев
b34218e6-aaf9-4bfc-996c-6b30be4bb0c3,Кириллова Лимитед,"д. Сыктывкар, наб. Набережная, д. 402 к. 700, 119989",+7 (741) 751-56-76,Николай Валентинович Шилов
f7c4c4d8-4878-4783-930d-8e32bac6748f,ООО «Рожкова Громов»,"клх Тольятти, ул. Снежная, д. 5/4, 573376",+74449217627,Яков Валерьянович Евдокимов
2bed4569-baac-4326-825f-9a66879f2421,ЗАО «Архипова»,"д. Невьянск, пр. Горный, д. 57 стр. 979, 114333",+7 (034) 449-7034,Евдокия Максимовна Русакова
3b406e46-72d3-4906-b287-2537c37f58e2,ЗАО «Яковлева Гурьев»,"ст. Кырен, бул. Одесский, д. 6 к. 1/5, 743242",+76313286067,Орехов Ярополк Ермилович
230c023d-ab47-42b3-add8-88535530cef7,АО «Макаров-Максимов»,"ст. Воткинск, пр. Новоселов, д. 1/1 стр. 720, 940022",+72303931969,Артемьева Тамара Васильевна
7eb0be50-9acd-4cca-a0ca-54a4ba5dfc15,ЗАО «Мамонтов»,"с. Шатура, пр. Черноморский, д. 58 к. 1/3, 504188",+7 (248) 059-1225,Анжела Эльдаровна Иванова
f172f716-d2a1-49c6-9478-aa99a0b04642,РАО «Титова Горшков»,"ст. Армавир, наб. Глинки, д. 79, 747511",+79894258234,Алексей Бориславович Уваров
d50ef791-d9d6-43b8-95f7-3f6e2def461a,НПО «Никонова Копылов»,"д. Дагомыс, ул. Заозерная, д. 8/3 к. 80, 083607",86311471834,София Андреевна Муравьева
708ff956-c7c3-4673-9f13-a78b72a52625,ИП «Рыбаков Галкина»,"клх Партизанск, пр. Ворошилова, д. 1 к. 480, 900998",8 114 717 59 80,Касьян Ерофеевич Иванов
ce250afe-71a3-4afa-929d-11cae687483c,ЗАО «Комиссаров-Сазонова»,"к. Одинцово, пр. Толстого, д. 480, 856769",84778734719,Никодим Антонович Пахомов
9a10f28d-171a-4c1e-9700-669476964bf6,"ЗАО «Петухов, Ковалева и Жуков»","к. Эльбрус, ш. Прохладное, д. 27 стр. 678, 391842",8 171 300 59 31,Одинцов Никон Адрианович
e11e2d2a-793c-4782-b9a8-ddd46ce80388,"ЗАО «Русакова, Медведева и Кириллова»","к. Алагир, бул. Балтийский, д. 9/6 к. 959, 794456",+7 (751) 638-32-31,Ираида Максимовна Фомичева
cd539787-7308-448e-a3ec-9f5bf0ce734b,ОАО «Рожкова Соловьева»,"г. Люберцы, ш. Вольное, д. 734 стр. 4/9, 583788",8 (179) 204-73-72,Колесникова Елена Артемовна
ce7c6dbc-9e93-4a75-aa01-0ed041092ab2,ЗАО «Крюков»,"д. Лянтор, наб. Минская, д. 35 к. 5/5, 801787",+7 268 504 72 27,Надежда Георгиевна Котова
d330b7aa-0cb0-4622-8458-775a68403be6,Абрамова Групп,"клх Волгоград, алл. Инженерная, д. 5/2, 435045",8 306 875 35 88,Крюкова Валентина Матвеевна
faeb7e5c-6532-45ac-8ca5-5823bdcdd47b,ОАО «Павлова Шаров»,"д. Мокшан, алл. Горная, д. 7/9, 615370",+7 841 796 7892,Калинин Стоян Егорович
1aef30ca-b069-4347-abde-165aa1ab799c,Сибирский антрацит,"с. Корсаков, ул. Декабристов, д. 6, 520948",8 168 802 0220,Ларионов Леонид Феликсович
67b93a3a-0abe-4480-a737-2ab9c1cb7176,РЕ Трэйдинг (LPP),"п. Темрюк, алл. Вольная, д. 54, 175547",8 347 833 06 25,Кира Богдановна Денисова
d8300455-bab5-4ee9-bc51-2315587065c0,НПО «Емельянова Юдина»,"п. Уэлен, ш. Прохладное, д. 8/3, 748088",8 (697) 648-1018,Титов Мефодий Димитриевич
583cce55-8339-4737-925a-fbf43e6d6f46,ООО «Петухов Белоусова»,"д. Калуга, пр. З.Космодемьянской, д. 74 к. 693, 623449",8 319 836 8951,Олимпиада Вениаминовна Колесникова
5a31290a-d1e6-40b4-8441-bc433a8dbb7e,"ООО «Гусева, Пахомов и Уваров»","к. Черемхово, ул. Горняцкая, д. 566, 286717",88323368575,Капитон Ярославович Пахомов
d6730407-a01f-47aa-9243-d991cc5ca2c9,ЗАО «Панфилов Некрасова»,"г. Краснотурьинск, ш. Титова, д. 7/8 к. 3/4, 801983",8 133 451 05 55,Юдина Галина Игоревна
ff453e4c-f5af-4067-92cd-4a1786e0f56e,"РАО «Князев, Русакова и Николаева»","ст. Усть-Ордынский, наб. Шахтерская, д. 62, 893808",8 (225) 894-84-65,Турова Евфросиния Максимовна
90a4b8ec-3988-41c9-b0b5-b410b8823ffe,"ЗАО «Кудряшов, Кузьмина и Беляков»","клх Ангарск, пер. Авиационный, д. 1/9 к. 70, 260619",89050955476,Евграф Елисеевич Трофимов
064bf7a7-b8ba-4128-b4f1-6997b5ba9728,ЗАО «Большакова Федоров»,"г. Королев, пер. Бабушкина, д. 1, 049496",87954229570,Зайцев Вячеслав Тимурович
a33235d2-e2a3-4f7f-874f-7d8e75cc3eff,РАО «Калашникова-Самсонова»,"к. Избербаш, алл. Вокзальная, д. 6/7 стр. 82, 963858",+7 635 346 5120,Эраст Елисеевич Кулагин
9ab6962d-3882-4026-a6fe-eaecfc2f8a4e,Логинов Лтд,"д. Тобольск, ш. Челюскинцев, д. 8/6 к. 796, 100684",+7 (877) 044-0608,Устинов Всемил Фёдорович
bb50518e-dfdb-4a3d-b786-836404f7d65c,ЗАО «Шилова»,"ст. Невьянск, ул. Шевченко, д. 7/5 стр. 669, 500377",+7 017 822 03 69,Терентьев Филарет Тарасович
787cd432-1c1e-4753-91f4-0a832d1f588d,НПО «Алексеева»,"ст. Верхнее Пенжино, наб. Коммунальная, д. 155, 831335",+7 (408) 514-9799,Романова Анастасия Натановна
c2a5a96a-0467-4e69-a1ea-0a4bf6a47350,РАО «Голубева»,"клх Елец, ул. Макаренко, д. 452 к. 42, 227216",+7 715 594 45 18,Семенов Казимир Федосьевич
b62a6f81-9e7e-4710-81a5-8b39024790ab,"ЗАО «Лаврентьева, Власова и Жданов»","г. Муром, алл. Энергетиков, д. 1/9 стр. 2/1, 627646",+7 302 557 4699,Валентина Харитоновна Филатова
8d4ce41b-10b7-42fe-a4cf-388b9fa3755a,Максидом,"п. Середниково, ш. Тихое, д. 519 стр. 8, 702820",8 (611) 325-02-07,Панов Кирилл Тихонович
f41cb153-49b4-4341-94aa-3e011259fd89,ТД БелАЗ,"к. Видное, ш. Троицкое, д. 44, 887665",8 (466) 931-03-60,Ксения Рудольфовна Шашкова
e3f97c2b-610d-4967-a813-59c28b1f55d9,"ООО «Антонова, Кононов и Калинин»","п. Москва, МГУ, наб. Чехова, д. 971 стр. 81, 922874",+7 (501) 771-02-30,Пров Егорович Семенов
1d88708b-5358-450c-a9e7-52a677a0a980,Славнефть,"с. Губкинский, наб. Киевская, д. 9/8 стр. 4, 260710",8 132 535 6320,Олимпиада Матвеевна Горбачева
b230cdc2-cc47-4bc8-abbf-034c3e5935af,ООО «Иванова»,"с. Великий Устюг, бул. Макарова, д. 35 стр. 289, 999170",8 508 678 73 95,Януарий Фёдорович Михеев
11ed5d93-e008-47c1-8071-187018951025,ЗАО «Осипов Устинова»,"д. Внуково (метеост.), наб. Николаева, д. 3, 276245",+7 406 216 08 20,Всеволод Владиславович Зимин
2aa10379-0162-4a53-9056-4620495f04b0,"НПО «Никитина, Лыткина и Стрелкова»","клх Лесной (Сверд.), пер. Средний, д. 616, 172747",+7 (077) 714-4233,Герасим Феофанович Соловьев
9e66bab6-98dc-496b-961c-2011f2dcfb5f,Тетра Пак (Tetra Pak),"к. Ясный (Оренб.), бул. Транспортный, д. 5 к. 4, 941660",8 (294) 795-4082,Зоя Михайловна Карпова
a0531265-03eb-47d9-8642-ec1fcd7d697d,"ИП «Бурова, Тарасов и Пестова»","клх Новомосковск, алл. Крымская, д. 7, 740366",8 (631) 070-6077,Мартьян Аксёнович Уваров
b0cf5ec5-94bc-4399-aee7-2819ad8e9015,"ЗАО «Субботина, Рогова и Казакова»","с. Малоярославец, пр. Микрорайон, д. 86 к. 263, 009340",+7 358 140 27 28,Ладислав Абрамович Блинов
1691b135-d673-4d8d-9b94-5b23b45f8daa,Металлстандарт,"ст. Гагарин, алл. Седова, д. 613 к. 5/9, 847471",8 867 782 66 48,Тамара Максимовна Белова
0c6e2a6b-352f-49aa-955d-5144f1e0c5b8,РАО «Сидоров-Третьякова»,"д. Елец, пр. К.Маркса, д. 6, 394085",8 (511) 775-1620,Медведева Акулина Васильевна
28194485-76e1-41c4-8969-63fdfa571c1a,Морозова Лтд,"с. Батайск, пр. Космодемьянской, д. 3 к. 327, 687576",+7 956 688 06 39,Ефрем Ярославович Чернов
5c03cb72-8cff-498e-9f08-4e70b07e4b0d,ЗАО «Мартынов»,"клх Учалы, алл. Трактовая, д. 864, 655689",+76089369255,Денисов Евстафий Терентьевич
0866acfc-529d-4af3-9bc5-28d89f702351,РАО «Елисеева-Матвеева»,"к. Нефтеюганск, наб. 50 лет Октября, д. 3/2 к. 78, 737748",+72264655834,Ершова Нина Павловна
f2cfb8c0-3f76-4f4f-a284-9ffede347a61,Группа РЕСО,"с. Братск, пер. Авиационный, д. 51 стр. 3, 288284",+73693196475,Волкова Октябрина Мироновна
b9edfdef-e03b-4683-913a-20d48909bd56,РАО «Степанов-Носов»,"клх Александров, пер. Прудный, д. 3, 574933",+72713776162,Евграф Богданович Киселев
9fdbbf91-892d-4f2b-9b45-e1f68a00fb1e,ИП «Логинов Медведева»,"п. Шатки, бул. Локомотивный, д. 389 к. 17, 553002",89123358441,Исай Игнатьевич Моисеев
2a67df1e-e34d-4fc0-b032-d57b21ec0794,Антонова Групп,"д. Камышин, пер. Шмидта, д. 2/3 к. 2/1, 757784",+7 (237) 944-5628,Октябрина Рудольфовна Николаева
d71717cd-f5f0-41f1-b6b5-106a4a70169b,Доронин Лтд,"клх Саров (Морд.), пр. Кирпичный, д. 9/9 к. 9, 062120",8 658 940 8012,Аксенова Юлия Афанасьевна
3451cbe1-149f-46d0-bc5e-85185e0fd143,АО «Савина-Рогов»,"с. Павловская, ул. Олимпийская, д. 7 стр. 6/3, 891985",+7 (510) 752-1742,Ермаков Никита Юлианович
13795b6d-9974-4aa8-825e-0737a7fa2c41,ИП «Александрова»,"ст. Палана, наб. Папанина, д. 9 к. 5/1, 612587",8 482 825 61 57,Юдин Валерьян Теймуразович
db3f414d-5eb9-4b43-85dc-279fc4aff63e,АО «Афанасьева-Брагин»,"д. Котельнич, алл. Высокая, д. 96, 469876",+7 (197) 283-33-26,Ярополк Марсович Бобров
56f6417c-5d64-47e5-8c2a-4a6cbf7e7ad0,АО «Зайцева»,"с. Снежногорск (Мурм.), ул. Тульская, д. 21, 160595",8 885 628 34 45,г-жа Егорова Фёкла Архиповна
a2df121c-8447-439f-b6a1-a083b1aed9d3,Фомина Лтд,"д. Нарткала, ш. Энергетическое, д. 5 к. 52, 138947",+7 (956) 900-6696,тов. Воронова Варвара Архиповна
f64a48a3-ea84-40c9-a13b-b6c10a4e3465,РАО «Сидоров»,"клх Анадырь, ш. Рязанское, д. 54, 698214",8 918 388 7487,Климент Гурьевич Щербаков
8315040d-67e5-4c51-9721-84927116e4f5,Шубина Групп,"к. Домбай, бул. Красногвардейский, д. 7, 797346",86600944022,Анисимов Леонтий Григорьевич
471a8054-a21c-4025-a599-c46374aef8d1,ООО «Казаков Комаров»,"ст. Далматово, пер. Тельмана, д. 3/7 к. 203, 499379",8 148 980 15 60,Рогов Кирилл Афанасьевич
0ebb5cf2-31ec-46f1-9e68-a1b38c72ecd4,Гурьев Лимитед,"клх Буйнакск, ул. Свободы, д. 63 стр. 97, 886569",80674169030,Русаков Иосиф Игоревич
17d1b030-f0c0-453d-b93d-6ac8d9b57749,РАО «Стрелков-Федосеева»,"с. Можайск, пер. Заливный, д. 5, 052826",+7 363 140 5783,Фаина Антоновна Зайцева
69d503fe-82a1-4b22-8b02-186743e70eb6,Модум-транс,"ст. Азов (Рост.), бул. Прохладный, д. 446, 772200",8 (860) 801-4585,Тарас Измаилович Ларионов
f932643b-b915-4012-b866-17a8b3b28435,ООО «Королев Лыткина»,"клх Агата, бул. Октябрьский, д. 7 к. 4/7, 104963",+7 063 270 0661,Мариан Трифонович Большаков
f0762c35-7dec-4f7a-aedc-9e83d1588c92,РАО «Гаврилов Лаврентьева»,"к. Любань, пер. Главный, д. 649, 568149",+7 810 228 52 77,Екатерина Никифоровна Кириллова
dc5693a8-8487-44df-8201-77c5b7741b40,ИП «Авдеев-Максимова»,"д. Октябрьский (Башк.), пр. Береговой, д. 71 к. 398, 631748",+71229190635,Мишин Эдуард Антипович
11e57ce5-fd2e-44c3-975f-48aad910cd4e,НПО «Калашников»,"к. Черемхово, бул. Придорожный, д. 64 к. 73, 588769",+7 072 102 0069,Вероника Оскаровна Колобова
4259dce7-14f6-494c-9b54-07b8d636b14e,"АО «Ситникова, Николаев и Панфилова»","г. Тула, бул. Светлый, д. 74 к. 1/2, 955656",+7 (581) 959-99-71,Дроздова София Харитоновна
0a36f82f-a717-471a-a86f-da6f0f7b7128,Национальная медиа группа,"с. Лагань, пр. Микрорайон, д. 9/4 к. 1/2, 828139",+75225756017,Евгения Александровна Полякова
18c00ca0-f1a5-4845-b6b0-9b802d74c10a,ЗАО «Федотов-Стрелков»,"г. Сусуман, ш. Жуковского, д. 107 стр. 7/7, 922791",8 165 450 61 63,Овчинникова Феврония Геннадьевна
1b2f5ea4-043f-4ef6-a53b-444e6eb7ccfe,ГК Эфко,"п. Верхний Баскунчак, бул. Гаражный, д. 750 стр. 20, 461254",8 008 599 0727,Константинова Елена Сергеевна
0319bc67-8b0c-45ee-b1a6-9b994a1b348f,ОАО «Орлов-Пономарева»,"клх Чехов, ул. Луначарского, д. 6, 560049",+7 (929) 935-90-84,Фотий Ефимьевич Голубев
7a5f62da-26f8-4d66-9bf4-2a475b28fccb,ЗАО «Комаров-Поляков»,"к. Валдай, ш. Малиновое, д. 7/3 к. 7, 808923",8 623 823 85 84,Устинова Олимпиада Васильевна
ad2fcb38-4b87-4a93-be93-982c1442944a,"ОАО «Маслов, Прохоров и Фомина»","д. Курчатов, пер. Тульский, д. 3, 353013",8 (420) 163-52-10,Кошелева Пелагея Леонидовна
c4334b88-1aa9-456d-b9f4-96fd8926a5ed,Харитонов Лимитед,"ст. Верхнее Пенжино, наб. Черняховского, д. 7 стр. 34, 505720",+7 (632) 065-73-72,Потап Федосеевич Тимофеев
dae490b3-99c2-4fad-b976-ee20a6fb35fc,Тихонова Инкорпорэйтед,"ст. Железногорск(Курск.), ул. Седова, д. 883, 705838",8 088 632 8284,Лариса Тимуровна Петрова
d096364c-ec4d-471b-96cb-99cd2becba03,Третьяков Лтд,"с. Тайшет, наб. Солнечная, д. 3/9, 486372",+7 689 738 18 69,Евпраксия Руслановна Панова
336a58d9-9441-4e68-ba4f-319793fe5b3a,АО «Кудрявцева Кононов»,"к. Усть-Ишим, пер. Енисейский, д. 810 стр. 872, 718674",+7 410 893 39 85,Велимир Гертрудович Гаврилов
ecf19436-0d7b-4e0f-8f67-1208d2389e77,ООО «Смирнов-Яковлев»,"к. Объячево, бул. Прудный, д. 8 к. 692, 764456",+7 (798) 620-18-30,Наумов Феликс Денисович
f7d6b28d-c8eb-44b1-8562-86a49f1e2b8c,ОАО «Казакова Лобанова»,"г. Тотьма, ш. Восьмого Марта, д. 891 стр. 2/2, 076366",+7 (913) 291-2441,Сафонова Ираида Егоровна
f760006b-0ddf-4d92-b644-e8a98e8be6cd,ИП «Колобова-Тимофеев»,"с. Кузнецк, наб. Байкальская, д. 5, 677024",8 (701) 012-3830,Шубин Виталий Архипович
d9599d80-10fd-4bdd-81fb-566b8ce0fca7,"РАО «Корнилов, Михеев и Ситникова»","д. Бологое, бул. Докучаева, д. 76 стр. 4, 241758",86677308755,Зиновьева Тамара Харитоновна
98524967-0e09-4727-b4f2-368372390fd1,АО «Белоусова»,"п. Вилюйск, ул. Осипенко, д. 317, 428014",+73212128350,Шестаков Аггей Тихонович
d5180fe5-0238-4e10-a629-9941199a1cd1,ОАО «Кабанова Тарасов»,"ст. Югорск, наб. Добролюбова, д. 1/4, 506937",8 636 195 15 43,Жанна Геннадьевна Селезнева
a57d1dee-30de-4d76-a4d2-748bd5e33e4f,ОАО «Субботин»,"ст. Аша, наб. Красная, д. 8/2, 717278",+7 333 714 84 46,Галина Макаровна Семенова
633787fa-3c51-48f9-aa9b-ddaff8123f85,Авиакомпания Икар,"ст. Карталы, пр. Менделеева, д. 1/8 стр. 6/9, 421190",8 (383) 055-7498,Онуфрий Фадеевич Степанов
171f9c16-5241-45cd-95a0-ba0405566ec2,ЭйчПи Инк (HP Inc.),"клх Таштагол, алл. Чернышевского, д. 7/4 стр. 651, 256643",+7 187 597 5641,Корнилова Татьяна Макаровна
cd0d476b-f7b3-4a85-aecd-1c4580036a05,АО «Шестаков Воронова»,"клх Якутск, пер. Дарвина, д. 2/2, 715158",87193338313,Марфа Александровна Колобова
