id,name,address,phone_number,fio_representative
9887e344-bf4d-4dda-9146-aa41e4cdf18f,ОАО «Герасимов»,"клх Ноябрьск, пер. Петровский, д. 898, 382642",8 (446) 151-0099,Логинов Мирослав Данилович
f81d4fd2-6887-4d53-bfd0-5c816bcb03a4,Краснодарзернопродукт-Экспо,"ст. Красногорск (Моск.), алл. Болотная, д. 7/4, 880630",8 (508) 416-15-60,Октябрина Святославовна Ефремова
7847a202-10bf-42eb-966b-78cf61360418,ОАО «Стрелков-Никонова»,"г. Баргузин, бул. Дзержинского, д. 57, 360311",8 783 615 18 55,Севастьян Валентинович Попов
1f645361-fdfd-4653-8a3d-9ef550fd15d4,ООО «Белоусов»,"д. Бийск, алл. Октября, д. 5 к. 5/8, 770224",88415708002,Бобылев Мокей Елисеевич
4d57d4ef-7655-480f-b1f7-18e6bc472857,АО «Денисов-Александрова»,"с. Яхрома, алл. Огородная, д. 5/4 стр. 2/3, 165106",8 434 354 55 30,Казаков Натан Феликсович
8ad1def4-9fc7-4946-9788-1b5d92d71bb0,Федосеева Групп,"клх Чехов, наб. Фабричная, д. 893 стр. 67, 068511",+7 117 879 0097,Никонова Синклитикия Тимофеевна
a28d56e0-0434-41cf-b394-0ebad64be224,Вольво Карс (Zhejiang Geely),"к. Учалы, алл. Тукая, д. 9, 614047",8 (364) 950-5093,Марина Геннадьевна Зуева
54e5dd48-8dfd-4e7b-aa56-43363b0c89e7,РАО «Шестаков-Кулакова»,"г. Мытищи, наб. Толбухина, д. 828, 926781",+7 (848) 448-8486,Колобов Капитон Иосифович
6ff23f37-4684-4b82-86eb-78b8ac440e99,АО «Бирюков-Гордеева»,"к. Орехово-Зуево, алл. Жукова, д. 7/1 стр. 3/9, 046827",8 (838) 244-41-34,Юлиан Еремеевич Константинов
3745e75a-55c3-4e4b-b122-506b7324fb97,ABI Product,"д. Югорск, алл. 9 мая, д. 6/6, 860092",8 745 377 95 63,Муравьева Елена Робертовна
bd4c1fd9-dde6-4f42-9110-5064e2db876e,ЗАО «Самойлов-Сергеев»,"к. Черемхово, алл. Отрадная, д. 162 стр. 47, 475476",+7 (973) 335-4468,Денисов Вацлав Алексеевич
1d545bad-4ce6-4b45-ab37-088d453635f1,Степанов и партнеры,"с. Фатеж, пер. Технический, д. 4, 243236",+7 (922) 504-97-41,Молчанов Ипат Феофанович
bb9918b4-6e4d-4980-b560-64b02337fe09,РАО «Доронин»,"к. Ухта, бул. Клубный, д. 85 к. 7, 568262",+7 609 033 79 66,Октябрина Никифоровна Исаева
9564355d-26a6-4de8-91d7-5f67f82f9b87,ИП «Бобылев-Марков»,"клх Ярославль, алл. Абрикосовая, д. 76 стр. 59, 722611",+7 139 945 9198,Симонова Нина Аскольдовна
7964a3c8-d677-4194-80ab-30725e68352d,Международный центр,"ст. Переславль-Залесский, ш. Коммуны, д. 9/4 стр. 961, 896321",+7 (233) 422-4998,Петрова Валентина Васильевна
df97d8ec-14ec-4b38-823a-6c19bba5d2c1,ЗАО «Лазарева»,"с. Клин, пер. Петровский, д. 8/4, 817057",8 (353) 062-02-61,Корнил Брониславович Гущин
449e4ddb-34d8-4f1e-852d-5a83b825d626,Морозова Лимитед,"ст. Оленегорск (Якут.), алл. Родниковая, д. 7/7 к. 27, 262975",8 (564) 074-99-07,Федот Адамович Сазонов
7545e226-18da-4284-8af9-b0d814913456,ООО «Белякова Архипова»,"п. Томск, пер. Речной, д. 8/1 к. 3/5, 609173",88646921154,Ипатий Фадеевич Белозеров
2a269b05-831b-48f2-9bfe-56a55fabddde,Смирнов и партнеры,"клх Сухиничи, ул. Клубная, д. 7, 146213",+78891690107,Ратибор Викторович Кузнецов
d55573ab-24d2-4a5f-87c0-033f7187ae20,АО «Носов»,"д. Красноуфимск, пер. Высокий, д. 80, 889760",+7 574 411 88 12,Логинова Нина Харитоновна
641d97e0-df8e-47a4-a854-6eae1181b349,НПО «Тетерина-Назарова»,"д. Киржач, пр. Светлый, д. 95, 519458",+72570160377,Игорь Евстигнеевич Федотов
f96efaca-01e7-47c6-87b4-52463379e524,Дмитриев Инк,"п. Александровск, ш. Солнечное, д. 39 стр. 9, 908282",+7 (233) 853-2828,Федосеева Таисия Владиславовна
621f70a0-086a-4323-9cfc-44e572d76df5,АО «Зуев Кудряшов»,"ст. Джейрах, бул. Угольный, д. 60 стр. 704, 193338",8 102 789 7648,Марфа Болеславовна Кононова
17db5bf3-0e24-4313-a969-a9856159d43c,"ИП «Лапин, Дементьева и Гусев»","ст. Томпа, ш. Осипенко, д. 5, 661915",86916392858,Киселев Евдоким Александрович
65972bfe-43ad-4990-83db-b0d6e891e871,РАО «Мамонтова»,"д. Армавир, алл. Тупиковая, д. 85, 147659",8 (170) 237-7338,Ефимов Евстафий Елизарович
dbde072b-5fae-477f-a527-d61c20a4c323,НПО «Калашникова-Медведев»,"к. Энгельс, наб. Советская, д. 777, 515310",8 (717) 777-34-66,Юлия Романовна Чернова
68d3c054-f029-4fd0-848e-8d3e5fa8beb7,ИП «Дорофеев»,"г. Дербент, ш. Макаренко, д. 8/7, 665209",8 (307) 761-29-84,Власов Ермолай Якубович
9e8d0b60-fe95-4977-b094-427038bd655d,ГК Агропромкомплектация,"с. Мокшан, пр. Ватутина, д. 91 к. 949, 578278",8 805 054 8021,Тарасова Агафья Натановна
15622842-c289-4a79-8413-114c37155fcf,НПО «Дорофеев»,"ст. Тында, ул. Ушакова, д. 7 стр. 8, 132346",+7 (449) 412-3795,Лыткина Марина Валентиновна
daad027d-d0b4-4fa0-ad42-56c3ccaca7e0,ООО «Наумова»,"к. Устюжна, алл. Фрунзе, д. 58 к. 3, 469906",+7 828 770 2673,Кондратьева Екатерина Андреевна
99e25e53-f021-4100-8d26-76a65eaa8dd6,РАО «Аксенов»,"д. Каменномостский, ул. Урожайная, д. 6 к. 6/9, 851516",+7 147 304 7037,Ширяев Ким Якубович
8fe52218-7cf6-4171-8906-eed5da93d22d,Мон Дэлис (Mondelez),"д. Лабинск, пр. Павлова, д. 416 к. 5, 517710",84353000845,Мстислав Давидович Евсеев
9d422fe4-7937-4ac6-a0f5-423907bf1a27,ЗАО «Егоров Афанасьева»,"к. Балашов, наб. Калинина, д. 8, 163148",+7 (724) 223-7658,Федосий Яковлевич Калашников
62730ad7-a316-4cb4-91ad-f2d1b943de23,Суханова и партнеры,"ст. Туруханск, ул. Студенческая, д. 41, 542755",+77432194877,Наина Юрьевна Афанасьева
0c808f49-b1ca-4037-ba97-5d9ecf6cf054,Соловьева Инкорпорэйтед,"г. Абакан, алл. Химиков, д. 84 к. 30, 205303",+7 (914) 142-1417,Всеслав Юлианович Наумов
0f967715-96e0-40d2-82cb-095b15aedd1d,СОГАЗ,"к. Плес, наб. Щербакова, д. 3/2 к. 1/3, 690401",8 (263) 456-8381,Лора Дмитриевна Абрамова
232a5471-50c8-4c1d-82b1-d48367462ad5,НПО «Иванова-Горбунова»,"г. Курумкан, алл. Московская, д. 8, 507652",+77213551552,Филипп Еремеевич Сидоров
b74fb799-53c6-478d-bf16-0b73fd84d0ab,ИП «Никифорова Кириллов»,"д. Бодайбо, пр. Белорусский, д. 609 стр. 20, 417292",+71201005624,Григорьева Ирина Аркадьевна
d2e99abb-1020-448e-b183-382a9b9f453f,АО «Коновалова Ефремова»,"д. Александровск-Сахалинский, алл. Морозова, д. 229 стр. 92, 017667",+73598110965,Щукин Савва Фомич
b9027fc0-d358-41a1-bb35-6b2837bb82da,ИП «Рыбаков Самсонов»,"к. Галич, ул. Карьерная, д. 61 к. 7, 512731",+73374431960,Фаина Борисовна Зимина
e2251846-9e28-4f3e-aae8-3070a900d301,ИП «Котова-Доронин»,"п. Слюдянка, ш. Амурское, д. 523, 037913",8 (819) 553-5101,Исаков Прохор Иосипович
705e9706-1c04-4b39-8198-3d37c6b5986a,"ООО «Зайцев, Константинова и Петухов»","д. Хатанга, алл. Новостройка, д. 99 к. 7/8, 921066",8 789 469 19 15,Христофор Валерьевич Якушев
5a0e2fe4-84a2-465c-99f7-11fdfe05504e,НПО «Лебедев-Савельев»,"п. Всеволожск, наб. Лесозаводская, д. 670 к. 9, 329967",+7 (180) 126-09-63,Любим Иларионович Назаров
f2982585-ffa0-4941-ae89-32db11f3f405,Марс (Mars),"д. Тула, пер. Гоголя, д. 5/4 стр. 90, 720337",8 472 234 4060,Маргарита Макаровна Молчанова
51ea5458-8431-4272-9eaf-5045bdfd872a,Лебедева Лтд,"ст. Юровск, бул. Высоковольтный, д. 32, 037084",88564379956,Ситникова Ульяна Мироновна
c92d1224-d87b-4597-9674-aff9f82f6cd4,ИП «Константинова Муравьева»,"клх Биробиджан, пр. Димитрова, д. 6/9 к. 6/1, 521320",+7 (533) 034-0811,Аксенов Дементий Фокич
33131c8d-f2a9-4328-bafe-68ec3cf7acc4,Металлоинвест,"к. Теберда, ш. Коминтерна, д. 9 стр. 89, 491491",8 443 698 56 36,Эрнст Тихонович Лыткин
e652c419-3e92-4cb4-9a27-3005b651ed9a,Коновалова Инк,"к. Тутаев, алл. Лесная, д. 6, 266726",+7 (114) 747-39-89,Зоя Афанасьевна Федотова
ccc425fe-df53-4ba4-945b-de4c3f3f6d19,АО «Воронов»,"г. Омск, алл. Ленская, д. 493 стр. 9, 481404",+7 089 685 0731,Панфилова Наина Мироновна
60284d1b-bac6-4ec8-993c-e6b5b334894a,ООО «Боброва»,"г. Валаам, алл. Чернышевского, д. 8 к. 4, 870049",+7 (960) 165-14-19,Савватий Ефимьевич Журавлев
da8b8dce-afd9-4483-af82-fc2a242f310f,ООО «Соловьев-Абрамова»,"г. Краснокамск, бул. Первомайский, д. 936 к. 2, 791810",+7 (776) 472-0439,Мария Эдуардовна Андреева
2c0246fc-a54e-4be5-83cc-c25dd46765e1,"ИП «Голубев, Фролова и Зыкова»","ст. Вуктыл, ул. Крылова, д. 939 к. 7/6, 219895",+7 (333) 404-94-92,Глеб Фролович Колобов
807726b1-4516-4a0d-a6d9-7621b430b949,НПО «Беляева Игнатов»,"д. Одинцово, ул. Народная, д. 71 к. 21, 118223",8 558 638 08 33,Ангелина Викторовна Цветкова
19bc6054-b393-4baf-8709-0ff155cd1c6b,ЗАО «Андреев-Кузнецов»,"с. Мыс Шмидта, ш. Энергетиков, д. 490, 379109",+7 297 910 79 09,Захарова Кира Никифоровна
5d133aa8-6217-404c-8649-8363429f9932,РАО «Кузьмина Кудряшова»,"г. Шатки, бул. Вахитова, д. 5/5, 527634",8 856 853 7124,Никифор Иларионович Лебедев
e8b05488-8b71-46cc-804b-78160ac93057,ОАО «Цветков-Лыткина»,"г. Саратов, ул. Геологов, д. 658 к. 929, 301275",8 (373) 819-7563,Демьян Авдеевич Панов
558e764f-8596-4399-8b37-031b64ba73dc,"НПО «Беспалова, Исаков и Ширяева»","г. Каменск-Шахтинский, алл. Мира, д. 9/9 стр. 8/2, 314096",8 720 379 28 46,Гурий Ильич Медведев
057fa4d3-cbea-4250-b34c-7bbbccf86785,"ИП «Самсонов, Быков и Чернов»","д. Нурлат, бул. Восточный, д. 7 стр. 951, 583999",+77676081390,Яковлев Лонгин Филиппович
13d07b61-c425-4148-baa5-8589e4c53553,НПО «Сазонова»,"с. Сосновый Бор, пер. Циолковского, д. 9/7 стр. 24, 119842",+7 (312) 604-73-62,Галина Николаевна Лапина
2c274555-778b-417f-8ef2-598dd5d688ea,Авдеев и партнеры,"с. Калач, наб. Горняцкая, д. 504, 130394",+7 651 758 26 36,Богдан Филимонович Казаков
9586f95e-4c07-46ab-a73d-854c6cfbcaac,ОАО «Кулагин Осипова»,"г. Онега, бул. Советов, д. 8/8, 431702",8 851 077 3066,Панфилов Велимир Алексеевич
261898b2-f612-4eab-a828-cfb07b89514c,Гленкор Агро Мзк (Firada),"ст. Лазаревское, алл. Тимирязева, д. 2 к. 150, 731074",+7 569 929 8019,Осипова Татьяна Эдуардовна
9db19dbf-23ee-47a8-808f-0af4cf9ac9dc,РАО «Овчинникова-Громова»,"ст. Избербаш, ш. Высоковольтное, д. 228, 095485",8 (677) 638-0335,Аполлон Исидорович Одинцов
53bda307-4cfb-452b-b31e-a355112b4683,НПО «Федотова Бирюков»,"г. Бугуруслан, пер. Громова, д. 1/7 стр. 4/5, 322359",+7 (827) 143-5270,Орлов Никон Афанасьевич
a1ff506a-3363-4036-8d71-c1f33c2e8d36,АО «Русакова-Вишнякова»,"с. Кировск (Ленин.), алл. Кленовая, д. 6/3 стр. 981, 938521",8 (353) 560-8673,Рябова Антонина Наумовна
ea4202ed-4a2e-47b5-ab49-1a0062b6bd54,ИП «Хохлова»,"п. Старая Русса, пр. Семашко, д. 9/7 к. 4/3, 801785",8 (041) 987-0193,Галкина Анжела Филипповна
b562f037-eecf-4625-a408-36b04c972832,НПО «Турова»,"п. Апшеронск, бул. Челюскинцев, д. 9 стр. 4/2, 065152",+79619172963,Максимова Александра Михайловна
7331ad20-617b-4c82-b3a1-ac562f3ee026,Русэнергоресурс,"д. Нижнекамск, ш. Высотное, д. 736 к. 6, 572987",8 632 826 46 12,Ирина Владиславовна Дмитриева
54d08905-0cfa-4208-b151-ca9587f7d85a,ООО «Елисеев Моисеева»,"д. Костомукша, бул. Р.Люксембург, д. 295 к. 8, 581617",8 (488) 467-0519,Иванова Раиса Кузьминична
111f8eb8-0f3f-4e4e-9e41-d9a471102d5d,ОАО «Стрелкова-Козлов»,"ст. Усть-Баргузин, ул. Балтийская, д. 89 стр. 5, 013747",8 931 866 40 68,Лукия Дмитриевна Алексеева
c622075e-0338-4512-b5be-60a5fe553ca4,"РАО «Сорокина, Белова и Степанова»","к. Кизляр, алл. Таежная, д. 92, 319165",+7 (896) 165-06-60,Карпов Бронислав Денисович
65e45154-d371-4ff8-97cf-443cc2494e13,ООО «Лазарев Жданова»,"клх Астрахань, алл. Мира, д. 772, 556868",82844331117,Дементьев Ираклий Еремеевич
168890ce-4a98-44a5-b55d-b2e81563d7d0,АО «Евсеев Цветкова»,"с. Шелагонцы, ш. Водопроводное, д. 894, 976931",+7 750 027 93 80,Ираклий Фёдорович Кулагин
e833dd97-9e47-41bd-a71b-2e5fac9a20da,ЗАО «Калинина Ситников»,"п. Пышма, наб. Рыбацкая, д. 1, 268937",+7 221 589 0074,Леон Валерьевич Панфилов
9ebcfd38-0478-4de2-adee-5e94744e6ddc,Елисеева Лтд,"ст. Рославль, пер. Союзный, д. 36 стр. 916, 553590",8 380 372 34 73,Парамон Чеславович Федосеев
27f129d0-b3cf-4d4d-98af-fbab862c430d,НПО «Алексеева»,"ст. Тихвин, пр. Энтузиастов, д. 126, 213901",+7 (388) 159-7439,Зайцева Анастасия Львовна
79ee63c3-ebc9-4394-861c-0553454279a7,Softline,"г. Валаам, ш. М.Горького, д. 2, 745093",8 (949) 969-87-91,Медведев Тихон Феофанович
dd452b50-9091-4f0f-a935-41c512a9c438,Щукин Групп,"ст. Вуктыл, пр. О.Кошевого, д. 664, 833954",8 688 700 68 23,Мишина Алла Харитоновна
15b4a6c6-49fc-4ecb-b646-76837c52bee6,"ОАО «Панов, Савельев и Дроздов»","к. Новомосковск, бул. Мая 1, д. 974 стр. 750, 693371",+7 772 069 91 78,г-н Зыков Аникей Глебович
197ef810-a756-487a-86e2-1ef3b3dd05c9,АО «Александрова-Степанова»,"с. Алдан, бул. Фрунзе, д. 2/4 к. 35, 168280",+7 378 704 7861,Юдин Болеслав Даниилович
43f1e0b5-631a-46d2-8843-7421e32662a6,РАО «Ситников-Петухова»,"д. Суздаль, ул. Жданова, д. 722 к. 95, 775626",+7 (735) 384-74-35,Савватий Афанасьевич Архипов
a72afcf2-0130-4987-86e6-9bd0a228c88d,ОАО «Павлов»,"ст. Катав-Ивановск, пр. Приморский, д. 5, 126865",+7 (201) 210-2636,Вера Юльевна Самойлова
24db144d-9e9e-499f-a2d8-a8869f4206e8,"НПО «Самойлов, Гаврилов и Гурьева»","с. Тутаев, ш. Тенистое, д. 5/1, 908853",85807358644,Попова Раиса Робертовна
0267084b-8fdc-46e4-b168-703399df68a9,Шнейдер Электрик (Schneider Electric),"г. Курганинск, алл. Запрудная, д. 66 к. 4/7, 442140",+7 (681) 731-7200,Жукова Синклитикия Федоровна
baed4da0-25f1-4b05-ade4-d683225a55a1,ООО «Нестерова-Кузьмина»,"п. Новороссийка, бул. Надежды, д. 56 стр. 916, 342988",8 (703) 082-2612,Шарапов Егор Филиппович
4c35040c-10de-4758-b3ce-bf46c7d8b95c,РАО «Русакова Никитин»,"с. Махачкала, наб. Новгородская, д. 3/2 к. 2/7, 694765",+78495308085,Феликс Герасимович Кулагин
c1e35bf9-c5ea-4e57-b205-4431afd5eddf,"НПО «Лукина, Гусев и Киселева»","клх Курумкан, алл. Терешковой, д. 365 стр. 528, 683502",83795236195,Степан Исидорович Никонов
beb28477-9a33-454a-86d2-d2b430945d32,АО «Орехова»,"д. Сургут (Хант.), пр. Деповский, д. 5 к. 83, 619768",+7 753 199 34 34,Воробьев Станимир Алексеевич
594f55ba-9757-4d46-ab96-88e0cc389650,РАО «Быков-Пономарева»,"д. Алексин, бул. Хвойный, д. 6/5 стр. 87, 226892",8 615 451 78 21,Субботин Мирослав Иосипович
22a9974c-55cd-4497-8552-b9f8f0228cfa,ЗАО «Степанов-Исакова»,"г. Сергиев Посад, ул. Высотная, д. 769, 154819",+7 (180) 293-18-21,Кира Сергеевна Калинина
19185679-fb4b-4a04-b59f-1dfa8905bf4c,"ОАО «Кондратьева, Суханова и Горшкова»","г. Химки, алл. Щорса, д. 4 к. 489, 577432",+7 (368) 881-97-58,Святослав Анатольевич Кондратьев
89fa61f4-437a-4b57-b992-738f1102507a,"РАО «Ефремов, Турова и Лукин»","д. Брянск, пер. Гончарова, д. 832 к. 37, 684815",+79135735273,Овчинникова Агафья Захаровна
72d4b48e-af70-4b5b-8be6-44995c6dfe2e,Кудрявцева Инкорпорэйтед,"ст. Курильск, ш. Ключевое, д. 298 к. 753, 135865",+7 060 824 3695,Агата Геннадиевна Семенова
9f1240cb-0425-4a02-bfc4-576fea9d75c1,Орехов Инкорпорэйтед,"ст. Данков, ш. Новоселов, д. 9, 796105",+7 558 094 06 12,Лора Аскольдовна Логинова
72fea86f-6270-4ca5-b6cd-9946a8314940,Каргилл (Cargill),"к. Майкоп, пер. Пугачева, д. 3/5, 203916",+7 (206) 042-3901,Милан Бориславович Кириллов
74f7d435-9a93-4bcb-8ea3-3753ab513ba5,ОАО «Алексеев Зиновьева»,"п. Озеры, ш. Угловое, д. 402 к. 9, 260800",8 779 303 2649,Давыдов Демьян Фролович
1923fdd0-7df3-4216-804e-e888dc248501,ОАО «Бурова Горшков»,"д. Осташков, пер. Луначарского, д. 2 стр. 23, 843101",8 510 643 20 01,Давыдова Нонна Геннадьевна
73431794-bfcc-4f63-8f0d-ef13821b4ca4,ОАО «Зуев Прохоров»,"к. Уссурийск, алл. Отрадная, д. 4/5 стр. 7/5, 575403",8 897 388 4561,Спартак Демидович Титов
a7021165-3ffe-43bb-877c-266ca81d0113,ЗАО «Горбачев»,"п. Архангельск, пр. Седова, д. 9 стр. 7, 116735",8 238 883 5360,Беляев Борис Витальевич
86351383-9af3-475b-9914-f526dfb45eb8,Северный ветер,"п. Балашиха, ул. Кольцевая, д. 961 к. 35, 606127",8 (851) 544-1424,Соболева Любовь Матвеевна
a5190afc-ca17-4a5e-b746-3e5b9cf77d67,"НПО «Прохоров, Кузнецова и Степанов»","ст. Оренбург, пр. Чехова, д. 6/8 к. 747, 329649",8 (445) 862-6851,Михей Марсович Пахомов
cfcced00-f509-418f-9359-21b59dd2c5ea,Суханова Групп,"клх Шенкурск, пер. Ленинский, д. 2 к. 76, 377683",+7 (952) 024-79-38,Большакова София Вадимовна
1b96303e-755b-43d2-8abf-0b26e348dc17,ИП «Горшков-Власов»,"клх Тура, наб. Кирова, д. 232, 185071",8 (238) 377-9879,Фёкла Аркадьевна Волкова
7d9d9b3d-d42b-41df-ae9a-ae2e744850ab,Ефремов Лтд,"д. Южно-Курильск, ш. Почтовое, д. 994, 170394",+73203398255,Мокей Геннадиевич Лапин
c5d7beb2-14d7-4fa0-8121-4d89f70bddca,Группа Волга-Днепр,"с. Юрьевец (Иван.), пр. Урицкого, д. 2 стр. 58, 428847",+78770788423,Ангелина Петровна Моисеева
5f9ed612-54b8-47c4-8e51-3282c4c2264e,"НПО «Третьяков, Кошелев и Овчинникова»","г. Усть-Ишим, ш. Леваневского, д. 10 стр. 2, 232895",8 (491) 552-5427,Горшкова Олимпиада Георгиевна
55ef8463-fd7d-4740-8ce0-fb0b85a7509d,"ИП «Щербакова, Одинцов и Волкова»","д. Партизанск, пер. Труда, д. 1/9, 151302",+7 484 600 15 85,Максим Филатович Князев
de0f2a7f-eb60-41b5-bc49-ae5695a8a5f9,"ООО «Горбунова, Кулакова и Ермакова»","к. Кажим, пер. Чайковского, д. 934 стр. 5/4, 643556",8 596 138 43 26,Казимир Гурьевич Тимофеев
67dfb548-0705-4620-a2f0-70946bdcd892,АО «Прохоров Шилова»,"г. Сергиев Посад, ш. Казанское, д. 101, 136875",8 (494) 250-6386,г-жа Евсеева Любовь Тимуровна
5e08e4a6-66b6-4712-87cc-aa9f5be9ab94,НПО «Силин»,"д. Печора, пр. Железнодорожный, д. 7 к. 9, 967486",+7 (411) 017-47-21,Смирнова Полина Рубеновна
24b331e7-c99d-47df-9ff5-dc275e9a0c76,Беспалов Инкорпорэйтед,"п. Апатиты, пер. Детский, д. 1/2 стр. 697, 857482",87756550230,Мясников Никифор Валерианович
77f1ad86-576c-460f-b48c-5306670e556f,РАО «Фролов-Носов»,"ст. Якша, наб. Тупиковая, д. 9/7 стр. 654, 628057",+7 741 183 0847,Костина Лукия Вадимовна
c418aeb0-e521-4360-8248-c6730445a527,Кабанова Инк,"к. Благовещенск (Амур.), пр. Есенина, д. 31, 411634",+7 (901) 935-5285,Клавдия Наумовна Крюкова
72390637-a711-4ad8-9cd2-21c673eb906a,ЗАО «Рогова Белоусов»,"д. Ижевск, ул. Добролюбова, д. 31 стр. 266, 727324",+7 323 327 13 61,Кулагин Ратибор Всеволодович
185eb04e-80a1-4b4e-a12a-7895b7248629,ИП «Блинов»,"клх Ершов, наб. Иркутская, д. 7, 062904",+7 742 880 3082,Федосеева Тамара Ильинична
a2fefd66-ec5b-4c2d-9aa6-9191e39c8c3c,ООО «Соболева»,"д. Юрьевец (Иван.), ул. Донская, д. 6/3 стр. 5/8, 713072",8 798 930 4249,Семенов Лавр Иларионович
ee161f80-ffde-44b8-9ff7-6c6807fec7fb,"РАО «Лазарева, Орлов и Силина»","клх Курчатов, ш. Демьяна Бедного, д. 8, 653172",86061771873,Виталий Федосьевич Поляков
e40cea5c-fea8-4db8-b9a4-3f13d7bc636a,Коновалов Лимитед,"к. Советский, пер. Азовский, д. 6, 675874",+7 (504) 919-70-61,Дементьев Агап Авдеевич
b9b3411d-d5f5-4291-a1d7-f561c9bc9893,"ЗАО «Дроздов, Власов и Миронова»","к. Устюжна, алл. Кутузова, д. 721 стр. 627, 338965",+71641785734,Козлова Раиса Викторовна
90112cc6-1010-4bf2-b74a-1a2d433236ae,"ИП «Захарова, Гусева и Мельников»","д. Тавда, наб. Труда, д. 4/1 к. 89, 890400",8 724 048 6763,Анна Натановна Кулагина
