id,name,address,phone_number,fio_representative
84820fd2-0db0-46b8-8fbc-f214365a4f5f,Богданов Лимитед,"п. Александров, ш. Плеханова, д. 9 стр. 459, 935152",8 (606) 326-0963,Раиса Вениаминовна Морозова
b6357c07-6e75-42e7-a589-b93913a9931e,"ЗАО «Ершова, Архипова и Воронцов»","к. Нарым, пер. Пролетарский, д. 947 к. 8/8, 485717",+7 685 560 12 29,Зоя Натановна Пестова
9b7cccb1-66f9-4d73-9909-b628f54f4134,ЗАО «Хохлов Владимиров»,"д. Шилка, алл. Прибрежная, д. 7 к. 4, 309545",8 075 594 16 47,Бобылева Ия Леоновна
6bb4bebb-79d4-40bd-8a63-d3d696134633,НПО «Комиссаров-Русаков»,"г. Устюжна, наб. Новосельская, д. 9, 851382",+7 932 330 8758,Зыкова Нина Станиславовна
a06cea66-c965-43db-acf0-79079e2e3c11,АО «Давыдова-Цветкова»,"ст. Красноуральск, наб. Попова, д. 3 к. 840, 752435",8 821 796 29 77,Крюков Капитон Артурович
c50ea7e2-9c58-4165-8545-b60734fe063e,РАО «Белозерова»,"с. Уварово, бул. Сосновый, д. 73 стр. 51, 440973",+7 448 786 71 50,Ираида Николаевна Турова
8b260682-c919-4bb3-adb0-38cee3b68c4c,НПО «Зимин»,"к. Кондопога, пер. Матросова, д. 6 стр. 3, 189772",+7 121 741 5012,Екатерина Степановна Куликова
8e306703-ac4d-4631-9b6a-d2fbbcbf98ae,"ООО «Устинова, Кудряшов и Ефимов»","г. Мценск, пр. Казанский, д. 5, 965544",+7 (522) 361-28-28,Хохлов Павел Артемьевич
7bd15924-0050-4f2b-a1d0-b64c82926128,РАО «Меркушева»,"г. Горно-Алтайск, бул. Проточный, д. 7/4 к. 738, 792954",+7 233 630 5708,Викторин Трофимович Жданов
9a9b0948-b190-4687-9f71-c50b10604a50,Беспалов Инкорпорэйтед,"д. Тикси, ул. Светлая, д. 372 стр. 691, 873529",+7 (532) 249-9440,Анжелика Александровна Герасимова
93387230-2377-404c-ad14-6413c41090af,Комаров Групп,"к. Сасово, ул. Полтавская, д. 449 стр. 4, 854333",+7 124 441 4674,Кошелева Юлия Вячеславовна
95da94c2-a02d-4898-a7fd-cad68d54dd21,"НПО «Никифорова, Абрамов и Петухова»","к. Шарья, ш. Уральское, д. 2/9 к. 808, 743614",+7 (933) 268-19-31,Тихонова Галина Никифоровна
2a47f950-f942-4708-a464-2d19ed125872,ОАО «Дмитриева-Меркушева»,"г. Дербент, пер. Песочный, д. 7/3 стр. 2, 416026",8 088 650 3067,Сидорова Нонна Рудольфовна
ed582fdb-fdee-45a8-bc20-151160eb693e,Симонова Лтд,"г. Муравленко, пр. Железнодорожный, д. 999, 336196",+7 793 361 1468,Соболев Прокл Яковлевич
82692629-f5e5-4aa9-9b8f-1fc56fca6850,ОАО «Михайлов»,"г. Сальск, бул. Полярный, д. 664 стр. 572, 318037",+78528270364,Селезнева Лукия Михайловна
1c1154ed-09f8-477f-a244-5352e4331ed4,РАО «Пахомова»,"п. Златоуст, ш. Горького, д. 46, 227262",+7 095 040 0160,Фока Всеволодович Попов
02248e7d-6c5d-4e72-8109-eed2ca90873f,РАО «Романов-Дьячков»,"ст. Охотск, ш. Вавилова, д. 75 к. 794, 349719",+71775801672,Лобанов Тарас Всеволодович
a24d14b1-04d8-4f76-9328-1049d5e1e322,ИП «Лаврентьева Игнатов»,"с. Ангарск, пер. Береговой, д. 9/5 к. 5, 718594",+7 776 024 09 84,Всеслав Денисович Пономарев
482c7d2d-3546-431a-8647-058a1e7ebeef,ИП «Денисова»,"д. Истра, пр. Шоссейный, д. 10 стр. 7/6, 974844",+7 (913) 728-97-91,Сергеева Варвара Степановна
9229c966-3f7f-4d04-8360-142364e1fd3a,"ЗАО «Игнатов, Щербакова и Федорова»","ст. Октябрьское (Челяб.), пер. Красногвардейский, д. 1 стр. 27, 409840",+7 728 507 62 15,Ларионов Соломон Ефимович
1deef38c-8e88-4325-a4db-087da46cc948,НПО «Тетерин-Кабанов»,"ст. Тутончаны, пер. Тукая, д. 72, 947072",8 647 329 38 79,Глафира Игоревна Новикова
619c9ab8-dbb7-4dba-a5cf-da1e406b69ec,ИП «Борисов-Ларионова»,"ст. Белгород, алл. Широкая, д. 986 стр. 815, 416772",8 (283) 224-95-27,Ершов Агап Фёдорович
fc246365-c481-4336-aaf8-04089a6c660b,Большаков Лимитед,"клх Хужир, пер. Энергетический, д. 9, 819061",8 345 984 8496,Исакова Синклитикия Сергеевна
104c00ef-73fb-414f-b686-9dd0d42147d1,ОАО «Дьячков Орехова»,"к. Анива, пр. Народный, д. 3 к. 441, 846676",8 035 565 0846,Филипп Давидович Гаврилов
e3acfedf-1b6d-48a5-85bd-970879225d00,БАСФ (BASF),"к. Тула, пер. Микрорайон, д. 16 стр. 88, 256151",8 263 681 6721,Любовь Феликсовна Сидорова
e18ac0e9-8225-4738-9e72-e3bad016fdfc,ЗАО «Крюкова»,"клх Салават, пр. Тюленина, д. 5/1 стр. 24, 927685",8 005 687 26 14,Ильина Марина Богдановна
b30cf650-c459-40b4-8a4e-35e8d0b48bce,ОАО «Никифорова Артемьева»,"клх Коломна, ш. К.Маркса, д. 3, 735710",+7 587 783 69 60,Валентина Кирилловна Рыбакова
48251836-ed9d-4898-876d-a7333d417f30,ОАО «Коновалов-Петров»,"ст. Троицко-Печорск, пр. ДОС, д. 9 стр. 65, 436438",84725419642,Мечислав Васильевич Брагин
5fe0a466-e578-4efc-9f20-5a0b35f4fb44,АО «Котова Воронцов»,"ст. Тимашевск, пр. Троицкий, д. 13 стр. 6, 881105",+7 567 615 8528,Зиновьев Осип Денисович
b372d512-b014-49eb-a433-3cf5270c6b51,"ООО «Никитина, Меркушева и Большаков»","д. Губкинский, ул. Чкалова, д. 4, 875641",+76085758591,Копылова Евгения Робертовна
ea1c04c8-0a42-41d9-bffa-a20e32199ed1,ОАО «Волков Соловьева»,"ст. Ямбург, пр. Гоголя, д. 9/2 стр. 5/5, 820950",+78007940421,Жуков Аверкий Игоревич
47ecc59c-7e47-4435-80a1-b0c4991c4899,ЗАО «Гаврилов Рябов»,"ст. Дербент, пер. Гаражный, д. 6 к. 7, 206367",8 (409) 052-4668,Тимофеев Филипп Федотович
ceee03b6-e6e8-482b-9037-29c5c1f3dc3a,"ОАО «Ширяев, Архипова и Сафонов»","п. Невельск, алл. Чайковского, д. 6 стр. 8/8, 853218",+74534648144,Блинов Лазарь Федосеевич
a1a8ba41-891a-4bc6-976f-1d71e83ece1a,Зиновьев Инкорпорэйтед,"д. Грозный, алл. Курортная, д. 480 к. 431, 311339",8 (083) 132-7312,Горшков Иван Гертрудович
f80cbccf-59d4-463c-a97f-e7dc5c0b7667,ЗАО «Баранов»,"п. Богучар, ш. Смирнова, д. 58, 982810",8 (999) 558-7258,Соловьев Иннокентий Тимурович
5202d8bb-dd7c-49c3-a74b-cc4527cc1de3,"ООО «Виноградова, Фролов и Мясникова»","к. Смоленск, пер. Демьяна Бедного, д. 595, 500868",+7 (419) 990-13-20,Нестор Арсеньевич Уваров
9579fc59-a07b-4adf-8b21-31321fe81c81,"ОАО «Селиверстова, Жукова и Самойлова»","клх Междуреченский, бул. Сиреневый, д. 2/8 стр. 5/6, 227824",+7 853 996 4339,Евгения Васильевна Ситникова
47284617-4397-4224-889f-284b619affea,Трофимова и партнеры,"г. Самара, ш. Жуковского, д. 5/3 к. 48, 372285",+77455860729,г-н Шубин Тит Тарасович
a2ff0d21-3701-4d33-8ca4-c31959f30de6,"ООО «Никитин, Сафонова и Федосеев»","с. Усть-Баргузин, ш. Прибрежное, д. 7, 349497",+7 898 323 9661,Давыд Викторович Никонов
21d1bc21-1155-4f36-85e4-5a2a97669b90,НПО «Королев Елисеева»,"клх Кирово-Чепецк, пер. Сахалинский, д. 3/7, 239336",8 986 768 8124,Белоусова Марфа Наумовна
dd47ac8c-21a1-45c8-a51d-a1f0cdbaf83b,Хохлов Инк,"г. Зарайск, алл. Тукая, д. 69 к. 9/4, 988044",+7 765 233 5434,Лукина Лариса Максимовна
53ca14ff-29a4-427c-947a-23c9d7323b4f,ЗАО «Васильева-Горбунова»,"д. Калач, наб. Коминтерна, д. 3, 227517",+7 849 340 06 03,Ермил Фадеевич Щербаков
1d44353c-e41a-4aea-930c-d7f75ebe7213,ОАО «Соловьева-Васильева»,"с. Новочеркасск, ш. Медицинское, д. 962 стр. 1/3, 442425",+7 (747) 968-6566,София Оскаровна Мишина
9649d9b5-b1a2-4812-9d03-1bd11291edd9,ОАО «Королева»,"к. Нурлат, ул. Ручейная, д. 715 к. 168, 155334",8 905 601 05 44,Воробьев Натан Гурьевич
5f9e62fa-4cc7-4eee-a19f-0dd0619895cc,Наумов Лтд,"с. Холмск, ул. Высоцкого, д. 29 стр. 47, 170871",+7 229 419 2956,Корнилов Панфил Эдгардович
4495c620-e69f-47c5-b4cf-6f3b080ea1b0,ИП «Сидоров Поляков»,"клх Осташков, пр. Алтайский, д. 5/9 к. 588, 270973",8 335 583 5240,Виталий Тихонович Аксенов
7df7ff26-9f18-41da-90b4-02fc382ea8e7,ООО «Александров Пестова»,"с. Беслан, ш. Комсомольское, д. 6 к. 96, 252341",+7 338 065 4049,Ксения Мироновна Кабанова
a55e009b-48e8-43b9-8be0-7004b0ce9fd5,Наумов Инк,"г. Славянск-на-Кубани, наб. Курчатова, д. 79, 720038",+7 (111) 721-72-61,Евпраксия Архиповна Костина
931eb191-4251-4796-a060-b82e717dac19,РАО «Носова»,"п. Горячий Ключ, наб. Подстанция, д. 792 стр. 8/8, 128298",+7 (252) 851-99-71,Шестаков Никон Вячеславович
9c908fd5-084c-4657-a74c-e2ebf255c9af,НПО «Веселова-Новикова»,"д. Горячий Ключ, ш. Совхозное, д. 1 к. 20, 055827",84217490775,Белозеров Парфен Алексеевич
0b3958da-ab93-4c2e-903c-709806e1acb3,ИП «Максимов-Пономарев»,"г. Новый Уренгой, пер. Кузнецова, д. 4/4 к. 2, 825504",8 (058) 026-53-30,Гурьева Ольга Геннадиевна
49ab2ee7-17c5-466a-89cc-4e65fc8032fd,ИП «Уваров-Фадеева»,"с. Пенза, ш. Полтавское, д. 6/5 к. 1/9, 454747",+7 (784) 325-8891,Наина Ефимовна Шилова
814f115e-ef12-4f38-9482-cb7f7aa6645c,РАО «Крюкова»,"к. Кызыл, ул. Коллективная, д. 1 стр. 9/4, 474591",8 (134) 869-7267,Калашникова Иванна Константиновна
05d11b03-e724-4404-af0e-c871cf01d181,Киселева Лтд,"п. Гдов, бул. Союзный, д. 2 стр. 2, 031436",+7 (898) 093-4618,Филатова Алла Аркадьевна
b4db8b2d-0803-4c22-a1bd-3b1ca01f7d32,"РАО «Соболев, Блохина и Калинин»","п. Чермоз, алл. Маркса Карла, д. 598 стр. 7/1, 404404",+71236145853,Элеонора Святославовна Осипова
e387ed72-47a2-4124-87e7-38de15be6570,АО «Титов»,"г. Верещагино (Перм.), пер. Кузнецова, д. 4, 811110",8 (178) 094-27-37,Ираида Антоновна Орлова
ec146139-da1f-4667-8128-0e64b5211fdf,"ОАО «Евдокимов, Сергеев и Лобанов»","п. Кижи, алл. Ярославская, д. 529, 524194",8 (945) 228-64-91,Прохоров Творимир Димитриевич
7f701a7a-966e-4f4e-a65e-7b938ca794cc,"ОАО «Максимов, Самойлова и Миронова»","ст. Фатеж, ш. Флотское, д. 716 к. 18, 233793",+7 (028) 328-8915,тов. Смирнова Татьяна Аскольдовна
0decb88f-e228-4eac-a04c-8c8c3ccd866f,ВСК,"к. Меренга, наб. Парковая, д. 558, 298997",8 969 176 37 44,Константинова Надежда Тимофеевна
38f80628-ecb0-4ecc-ae81-497d4ca5f21c,Горбунова Лимитед,"ст. Мураши, ш. Тульское, д. 47 к. 917, 386254",+7 113 165 8891,Громова Тамара Оскаровна
303da4b7-4d1d-48fe-9641-3e24f8d4bb1c,Одинцов и партнеры,"г. Объячево, бул. Таежный, д. 114, 073298",+7 (928) 491-83-56,Эрнст Гаврилович Мухин
46451508-6be5-421b-85a5-aa5aebdd35c4,АО «Горшкова Гаврилова»,"ст. Карабулак, бул. Курортный, д. 13 стр. 5, 909955",+7 (118) 484-20-74,Молчанова Клавдия Михайловна
fe939cb3-606f-4077-8fc2-04db64a1bcb3,Силин Лимитед,"п. Улан-Удэ, бул. Шмидта, д. 5 к. 236, 022802",8 (902) 529-63-63,Аксенова Ульяна Владимировна
424c59d7-6a30-4844-aa4d-1407ca22f5f8,РАО «Кириллов»,"ст. Можайск, пер. Садовый, д. 2/4 стр. 37, 034891",8 262 073 00 92,Жанна Никифоровна Юдина
278bfb5f-3a42-4479-83b3-f6b6b70980b4,ГК Фаворит Моторс,"к. Витим, ул. Специалистов, д. 4/1, 517372",+7 673 122 71 59,Тимур Устинович Шарапов
6f8cce21-b8d6-4a88-946c-ee6eb646c519,НПО «Гурьев-Горшков»,"п. Тюмень, наб. Высоковольтная, д. 2, 560009",+7 (702) 012-18-15,Михаил Бенедиктович Волков
490d86a8-9186-4ff9-97b6-b241972306b4,РАО «Быков-Макарова»,"с. Нязепетровск, наб. Краснодарская, д. 34 стр. 56, 250357",+7 033 480 51 02,Евгений Игнатович Сидоров
1d64e1a0-388c-47d8-af6c-df5ffbb07a91,ОАО «Беспалова-Козлов»,"к. Октябрьский (Башк.), ул. Урожайная, д. 7, 047990",+7 054 714 84 65,Варвара Мироновна Соколова
8616b3d2-e001-41a7-99f5-ba714f8c0829,ОАО «Авдеев Третьяков»,"клх Магнитогорск, ш. Ушакова, д. 8 стр. 3, 892071",8 (519) 274-1204,Иван Фролович Никонов
29498e67-6c75-498e-8fb4-05c1aa083be2,Ферреро Руссия (Ferrero),"ст. Карталы, алл. Средняя, д. 631 стр. 6, 591545",8 (181) 429-6761,Анжелика Леонидовна Щербакова
c4baf126-adba-403e-81b7-4a067b8d6e3e,Неофарм,"с. Билибино, пер. Безымянный, д. 5 стр. 227, 698858",8 (594) 151-28-97,Миронов Мирослав Аверьянович
75cbda83-7c2a-4726-87a4-976b6a40a8ba,АО «Корнилова-Мартынова»,"к. Домодедово, алл. Плеханова, д. 64 к. 397, 741018",8 667 907 35 23,Игнатьева Алла Леоновна
1c4edb0d-e4e1-4f3b-a00a-1e2f1b8dc726,Корнилова и партнеры,"к. Тура, ул. Тихая, д. 5 стр. 23, 616234",+70712690140,Григорий Георгиевич Кондратьев
a25d8606-5ab6-44bc-9400-097fb2a988eb,Селиверстов и партнеры,"г. Касимов, пер. Челюскинцев, д. 8/4 к. 80, 327003",+7 (878) 498-82-19,Лучезар Федотович Лебедев
fed0d284-cef6-49ee-9436-b296e0caa4ef,Королев Лимитед,"д. Смирных, ш. Лесное, д. 33 стр. 6, 196949",+7 412 999 8482,Глеб Андреевич Пономарев
3fbce684-e92d-4d49-ab5c-d630837f6a18,Воробьева Инкорпорэйтед,"клх Каневская, ул. Рябиновая, д. 270 к. 4, 137198",8 (250) 441-15-96,Калинина Елизавета Вячеславовна
7612d0fe-bda6-4b35-8bcc-1fbcfd51aee4,ООО «Шашков-Журавлева»,"ст. Туапсе, алл. Сибирская, д. 762 стр. 1/1, 225115",+7 (547) 934-4846,Дроздова Надежда Кирилловна
cc85d23c-395f-42e5-bcd0-02a7253be8a0,ИП «Воробьева-Костин»,"п. Приморско-Ахтарск, ул. Победа, д. 43 к. 6, 800557",+7 (502) 800-39-18,Муравьев Дементий Богданович
b61995ce-6661-4d4b-b119-9d41bf37f12d,НПО «Елисеев Самсонов»,"с. Зеленоград, алл. Менделеева, д. 826, 509836",8 (141) 421-3017,Трофимов Михаил Викторович
0e3b61ac-9016-4c0c-85a4-1d073bb64905,Князева Лимитед,"г. Беслан, пр. Советской Армии, д. 216, 541111",+7 (936) 746-7002,Лора Архиповна Калашникова
f1cf7e5c-7de8-4624-bb27-9a69e5256678,ЗАО «Калинина-Третьякова»,"с. Якша, алл. Новая, д. 59, 009931",8 804 242 85 24,тов. Федосеева Надежда Руслановна
34a7fe4b-0d3d-466c-b856-604f36fd8c3d,ООО «Рябов»,"д. Талдом, пр. Трактовый, д. 25, 407918",+77630674580,Воробьева Тамара Геннадиевна
2221ee73-84c7-4ba0-abbc-4d83371a22e6,АО «Миронова-Никифоров»,"г. Наро-Фоминск, пр. Беляева, д. 1/9, 914575",+7 952 367 57 96,Кононова Екатерина Наумовна
0543fa30-342a-419e-a918-455076ec3cac,"ИП «Миронов, Жданова и Уварова»","с. Барнаул, ш. Волжское, д. 538, 630716",8 (963) 179-9069,Мартьян Тихонович Комаров
b6486975-8d16-411a-9b15-8f1871ee9682,"ИП «Попов, Лебедев и Фадеева»","п. Елатьма, пр. Покровский, д. 460, 555774",+7 864 696 14 42,Нонна Григорьевна Елисеева
cdd62f7b-f95c-4ed2-9cb8-b761de19a89c,НПО «Мухина Авдеев»,"д. Качканар, бул. Магистральный, д. 2 к. 298, 871868",+7 601 289 9435,Агата Леонидовна Бирюкова
dd12620e-1282-4c84-9651-6179747f9656,АО «Шарапова Владимирова»,"д. Нягань, ш. Панфилова, д. 80, 313810",87046355518,Авдеева Глафира Петровна
6699c744-da65-4231-a231-3c355ef1ca87,Крылова Лтд,"п. Армавир, ул. Цветочная, д. 30 к. 72, 716452",+7 (523) 730-08-66,Виктория Робертовна Тихонова
41d3bb3e-464b-4470-a55a-17748954eb8c,ЗАО «Чернова-Лазарев»,"с. Карабулак, бул. Ручейный, д. 4, 742566",+7 465 057 1691,Клавдия Аскольдовна Сергеева
9eb9f208-8a71-4705-98c5-df45883ac2f5,"НПО «Шашков, Рогова и Лебедев»","ст. Кулунда, алл. Приморская, д. 13 стр. 3/4, 705176",8 910 881 13 63,Молчанова Ксения Леоновна
12a86501-1ab3-4c58-a79d-e043a024e02b,"ИП «Корнилов, Гущин и Сысоева»","г. Забайкальск, пр. Полтавский, д. 178, 282241",+74055234425,Сысоев Елисей Игнатович
b1c27113-a6ba-40c5-b8c0-6d3950ad3b4e,ОАО «Третьякова Юдина»,"г. Ставрополь, алл. Таежная, д. 406, 012136",81504256715,Любомир Харлампович Панфилов
42aef33f-6d18-48df-9560-f375a858d9c1,"ИП «Баранов, Федосеев и Игнатьева»","клх Крымск, бул. Декабристов, д. 5, 713571",+7 (081) 968-1583,Стоян Иосифович Зыков
04078355-3156-4018-a0ce-a3ea079901de,Брагин Инкорпорэйтед,"ст. Макушино, пр. Волгоградский, д. 1/6, 056196",8 (441) 621-0382,Воронов Панфил Гордеевич
94dc20d7-74cc-48e5-83b9-fb294ce8d6fc,Фармимэкс,"д. Королев, пр. Центральный, д. 567, 058384",80924524909,Тамара Юрьевна Орехова
0b6281fd-9c1b-4081-836f-1d9e235f7156,ООО «Колесников-Ефремова»,"к. Серов, ш. Геологов, д. 1 стр. 8/3, 052630",+7 591 261 9145,Авдеева Элеонора Анатольевна
a94099a2-6360-4836-a249-f5d3d7f599be,"ООО «Селезнева, Гущин и Наумов»","ст. Волоколамск, наб. Нефтяников, д. 324 стр. 6, 949727",+7 (454) 602-02-21,Светлана Андреевна Фадеева
2d424ea6-ee02-4932-9f96-0c6c1d125fdf,Ренейссанс Констракшн (Ronesans Holding Anonim Sirketi),"ст. Усть-Камчатск, пер. Садовый, д. 3/7 к. 9, 753646",+7 777 794 39 19,Олимпиада Петровна Новикова
249f5987-0f2e-442a-b823-deb28669aefc,"РАО «Кондратьева, Жданов и Агафонов»","клх Яшкуль, ш. Гаражное, д. 6/1 к. 6/6, 209028",+7 (217) 276-5376,Гаврилов Елизар Иосипович
483e3e16-7853-4eca-a843-0061b7c0cf5f,ЗАО «Трофимов Белякова»,"г. Усмань, ш. Ленинское, д. 7/9 к. 3/3, 372554",82392553579,Сазонов Андрей Георгиевич
ec5002f9-479a-4612-a6fb-1df8a9d059b4,ООО «Петрова»,"г. Новомосковск, ш. Л.Толстого, д. 1 к. 1, 687121",8 411 882 29 30,Мефодий Эдгардович Доронин
70880cd8-cf27-43c9-8a8d-5e335f599311,АО «Ефремов Морозов»,"п. Яхрома, пер. Красина, д. 86 к. 648, 059698",8 (018) 324-43-35,Дмитриева Анжела Тимуровна
208926c5-7606-4e00-8aa8-506293694138,ЗАО «Уваров»,"ст. Тамбов, пр. Волкова, д. 46, 256596",81557059075,Пахомов Спиридон Иосифович
319e6927-d293-4a13-8d2f-fe6d22c0edc4,Жданов и партнеры,"клх Вуктыл, пер. Путейский, д. 2/7 стр. 6/2, 627556",+7 (894) 929-2092,Елисеев Рюрик Виленович
d624dd08-b449-4a1b-9ed2-0413cb195863,"НПО «Киселева, Исакова и Павлов»","с. Урюпинск, ул. Нагорная, д. 3 стр. 788, 065623",8 (694) 455-99-23,Воробьев Пимен Трофимович
35382872-f315-4bcd-b191-7a2b2249faf0,"АО «Власов, Щукина и Калинин»","к. Егорьевск, ш. Лазо, д. 6, 672473",+7 107 859 5848,Федот Германович Пестов
e91f4bcd-29cc-4083-bdd0-83d42f5cd2d7,Фадеев Инк,"д. Кущевская, пр. Леонова, д. 49, 723866",+7 (557) 256-86-21,Лихачев Юрий Антипович
24c635ad-ce56-4a84-b9b9-4ab6dace94ad,Эйвон Бьюти Продактс Компани (Avon),"ст. Объячево, алл. Угольная, д. 3 к. 289, 578628",8 406 738 5507,Архипов Захар Васильевич
7c533bb2-7b9e-4c1d-93cc-3457a6e1e0b9,РАО «Григорьев-Королев»,"с. Баксан, алл. Техническая, д. 181 стр. 896, 343286",83381738911,Ольга Сергеевна Комиссарова
8bc684e6-fcee-48f0-a30d-56603c2e5860,ООО «Брагина Калашникова»,"ст. Санкт-Петербург, бул. Матросова, д. 313 стр. 574, 044361",80317349932,Марина Тимуровна Игнатьева
cebc6442-7eb4-4541-bf90-6c95294cf963,Сидоров Групп,"г. Богучар, пр. Монтажников, д. 282 стр. 5, 804705",80737330568,Владилен Иосифович Николаев
60cf89a0-4699-4529-b727-28b0257aa176,НПО «Тихонов Григорьева»,"п. Тутончаны, пр. Гастелло, д. 58 к. 506, 415851",+7 (662) 910-8322,Алевтина Александровна Давыдова
d417d4b9-6e2b-48e2-be3b-4a5b54ec00dd,"ОАО «Гущин, Сафонов и Осипова»","ст. Тайшет, пер. Привокзальный, д. 1, 250475",89380389358,Гришина Дарья Святославовна
7788bb57-8957-4b16-b933-9ce68e206a33,Артемьев Групп,"п. Глазов, алл. Терешковой, д. 7 стр. 5/4, 443499",+7 997 065 08 87,Самуил Демидович Горбачев
5f6254ba-5a85-4920-85ce-d7571f14f401,ЗАО «Кабанова Муравьева»,"п. Тобольск, бул. Байкальский, д. 73 к. 40, 561180",8 (920) 208-9689,Евгения Аркадьевна Смирнова
4421a5e8-66df-4db7-8456-50c8b99e9598,НПО «Туров»,"ст. Новокузнецк, пер. Ульяновский, д. 6/6 стр. 96, 183793",+7 (746) 182-35-07,Спиридон Филимонович Блинов
5833d0e9-4e85-4c06-a90e-67c1c5e542b8,"АО «Сидоров, Новиков и Абрамова»","с. Усть-Ишим, бул. Омский, д. 5/1 к. 28, 309389",+73982242187,Наина Леоновна Горбачева
ba414367-0c3a-4c81-9e52-991138889efb,ОАО «Артемьева Орлова»,"п. Тулун, пер. Карла Либкнехта, д. 2/7, 098129",8 (761) 981-15-85,Арсений Изотович Прохоров
