id,name,address,phone_number,fio_representative
221e06f4-d2be-420d-aa08-ad86936cbae2,ОАО «Петухов-Маркова»,"с. Октябрьское (Челяб.), ул. Новая, д. 1 стр. 6/7, 876425",+7 182 746 48 90,Быков Радислав Измаилович
2169980e-4a18-4524-8ef2-cdb4b95de37c,"РАО «Прохоров, Силина и Русаков»","д. Дагомыс, пр. Стахановский, д. 2 к. 5/1, 572110",+7 089 311 95 36,Сафонов Никодим Ааронович
612dbfb3-45da-4eb8-97cd-51824bba173e,ЗАО «Григорьев»,"п. Гусь-Хрустальный, пр. Азовский, д. 2 стр. 894, 995324",8 796 508 26 05,тов. Горбачева Лукия Тимуровна
1ae2231a-cada-4e42-863e-d4b4a82fe324,Новосталь,"с. Махачкала, алл. Выгонная, д. 2 стр. 44, 214546",8 298 594 99 55,Рюрик Архипович Киселев
56893156-a674-489c-a1f1-58540a93976c,Группа ЭПМ,"ст. Снежногорск (Мурм.), бул. Донской, д. 1/7 к. 3/5, 639254",+7 (522) 903-36-90,Устин Арсеньевич Борисов
8ba2bf90-2560-49df-ace8-823d6177720b,Меркушева Лимитед,"п. Кизилюрт, ш. Гаражное, д. 91 к. 4, 807736",+7 762 868 98 99,Исаков Иван Ерофеевич
5afeee7c-faa1-45d1-8205-8405135c9a20,"ЗАО «Мамонтова, Романова и Никифоров»","д. Асбест, бул. Островского, д. 5 стр. 8/9, 324726",+7 280 619 91 03,Оксана Ефимовна Дроздова
06012ce8-c1b2-4fa9-9cba-e8b24c5421ec,ЗАО «Большаков»,"г. Черусти, пер. Солнечный, д. 630 стр. 15, 812532",8 (151) 010-2157,Устинова Полина Кузьминична
f49b31a5-6a0f-4a2c-bef3-bc794ce6e24f,АО «Самойлова Медведева»,"ст. Сорочинск, бул. Халтурина, д. 4 стр. 74, 695382",8 (978) 405-9394,Казаков Ермолай Феликсович
76afe778-3e1f-43f3-8675-8545d7cec9b8,ИП «Кулаков Ильина»,"п. Ярославль, алл. Вокзальная, д. 8 стр. 1/3, 537278",+7 (796) 130-71-04,Кондратьев Конон Дорофеевич
8ee1990d-ea66-4561-86c6-cc0aa360246e,Корпорация Гринн,"к. Южно-Курильск, пер. Жукова, д. 631 стр. 9/7, 061729",+7 (443) 085-9636,Богдан Брониславович Жданов
fd0f18a4-0a83-46b0-b48f-704bedfee2d4,АО «Афанасьева-Назаров»,"г. Ербогачен, пер. Кленовый, д. 14 стр. 33, 842362",+7 (442) 920-13-42,Селиверст Антипович Соколов
09f163f3-b4ca-4108-8ef2-a3c626c8e31a,Беляева Лимитед,"к. Советский, алл. Свердлова, д. 7/8 к. 1/7, 593618",+7 (379) 056-7767,Орлов Вячеслав Харлампович
93245efc-6b2c-4867-b1dc-725dd76ac60c,ИП «Воронцов»,"д. Чулым, ш. Полтавское, д. 28 стр. 263, 202931",8 027 434 73 72,Герасим Жоресович Князев
6b0f4a5e-d979-4b15-959d-303264489bea,Фармкомплект,"клх Сковородино, пр. Циолковского, д. 77 стр. 221, 555665",84244552267,Леонтий Денисович Степанов
36a2eea1-ff23-4b13-9de2-d735427707bc,Российские сети,"д. Грозный, ул. 50 лет Октября, д. 2/9, 240100",+7 314 879 2673,Тамара Тарасовна Шашкова
629c003d-de21-4a5f-8f55-40ce78c2c90b,ЗАО «Брагина»,"к. Кимры, пр. Советский, д. 5 стр. 9/7, 924025",+7 204 829 5048,Лазарь Владленович Селезнев
be1411ff-219a-4eb7-9f42-30241128823e,ИП «Филатов-Кондратьева»,"к. Хужир, бул. Угловой, д. 42, 129455",+7 (328) 278-43-13,Игнатов Аристарх Филиппович
028e4317-9d74-474c-be13-610e22529718,АО «Котов»,"ст. Кунгур, пер. Целинный, д. 4, 392787",+7 922 955 2270,тов. Поляков Евгений Федотович
3796c08f-384e-4485-9e00-1634084fa5e1,НПО «Голубев-Уварова»,"ст. Терскол, пр. Виноградный, д. 3/7 к. 92, 922359",8 665 699 67 40,Исаева Татьяна Леоновна
7afc3d6c-297d-4572-9b68-dbda3ac92fcb,ООО «Сорокин Титова»,"клх Усть-Камчатск, ул. 70 лет Октября, д. 3/2 стр. 83, 841537",+72841892570,Одинцов Радим Валерианович
f599e0c6-0c93-441a-b7e4-cc293312cd17,ИП «Алексеева Давыдова»,"ст. Кандалакша, пер. Светлый, д. 85 к. 74, 265724",+7 044 548 1104,Морозова Анна Петровна
b4f756d7-55ee-4313-9b16-9054e49efbc9,Таркетт Рус (Tarkett),"п. Верхний Баскунчак, алл. З.Космодемьянской, д. 161, 558005",+7 (310) 296-9814,Владлен Эдуардович Михеев
5eeb4a9c-0b06-433b-9129-06aede568f75,ЗАО «Константинов Сорокин»,"к. Внуково (метеост.), ш. Морское, д. 72 стр. 61, 420880",8 (698) 813-1861,Осипов Ладимир Ерофеевич
752abaa7-b20d-45d4-8361-52063569ca09,ИП «Жукова-Бирюков»,"г. Абинск, пер. Окружной, д. 9 стр. 396, 513105",+7 (180) 757-8922,Вячеслав Адрианович Хохлов
e55dca32-bf32-464f-92a4-a0d3174a193c,НПО «Кондратьев»,"с. Байкальск, ул. Лесозаводская, д. 4 к. 42, 785361",+7 229 127 51 89,Сидор Демьянович Самсонов
9f78c44a-2cb9-48cb-bf32-db2b174fc27b,НПО «Зимина Архипова»,"г. Новокузнецк, пер. Промышленный, д. 8/3, 819510",+70377397508,Элеонора Оскаровна Зуева
21489f16-2206-4f6e-ae04-b6af65f55e3f,"АО «Ефремова, Белова и Бирюков»","п. Таганрог, наб. Труда, д. 2 стр. 8, 000143",8 (651) 116-1762,Белоусова Татьяна Владиславовна
2ec13b2d-ad2d-4f11-af87-43796e1f5a81,ИП «Потапов-Комиссарова»,"с. Листвянка (Иркут.), ш. Чернышевского, д. 98 к. 327, 180035",8 (151) 090-96-88,Калинин Евсей Чеславович
a7d36b87-ce84-4145-8eee-efbffc5535e9,ЗАО «Кузьмин-Ермаков»,"г. Невьянск, ул. Ставропольская, д. 7 стр. 2, 663594",+71015706869,Назарова Алина Леонидовна
852cdad0-70e4-49e9-9e93-f3962b8cd72f,РАО «Чернов-Агафонова»,"г. Чайковский, наб. Алтайская, д. 792 стр. 9, 376925",8 (042) 370-89-88,Панова Любовь Игоревна
d3b3e6db-1603-4036-80e7-76d7a0967118,АО «Филиппова»,"клх Вуктыл, алл. Блюхера, д. 6 стр. 7/4, 502694",+7 (733) 141-63-48,Милован Трофимович Яковлев
eb51dfc6-b333-45d1-816e-3d448fc50ace,ЗАО «Осипова Дмитриев»,"ст. Белгород, наб. Ангарская, д. 3/9 к. 42, 418524",8 886 084 0630,Нинель Максимовна Боброва
756dbe17-8ca3-4b9b-beda-eac97e2b1593,Авдеев Лтд,"к. Рязань, наб. 50 лет ВЛКСМ, д. 2, 464644",8 (175) 237-9154,Ефремова Акулина Степановна
df955b3e-c055-49b1-8bdc-b4e4999ceb8f,ИП «Копылов-Суханова»,"клх Горячинск, бул. 60 лет Октября, д. 757, 265293",8 (217) 724-3859,Волков Григорий Устинович
c0934b0c-0e76-4ccf-b722-f265fc4c6bef,"РАО «Щербаков, Кошелев и Горбунова»","к. Соль-Илецк, бул. Кузнечный, д. 4/3 стр. 827, 587439",8 (969) 782-0353,Воронцова Полина Феликсовна
856603e5-4931-4ff3-9e8a-ada08bda6020,ОАО «Рожков Исаков»,"к. Ербогачен, алл. Николаева, д. 130 к. 4/6, 146953",+7 786 640 29 11,Петухова Лукия Егоровна
bfa295a3-7291-47d4-936a-4bdc57183a27,НПО «Борисов»,"к. Ставрополь, бул. Гафури, д. 2/7 стр. 214, 033936",+7 (139) 919-28-22,Суханова Милица Олеговна
fac64bb9-0289-435e-87d1-a6f149469bb1,ЗАО «Исаева»,"к. Переславль-Залесский, алл. Новосельская, д. 5/7 к. 6, 521977",+7 842 158 45 34,Елизавета Руслановна Лобанова
ccee119e-615b-4236-9ed6-11c00f197263,АО «Лыткин-Карпова»,"д. Шаховская, пр. Труда, д. 900 к. 563, 323842",8 (755) 509-54-00,София Григорьевна Рожкова
b79c9e26-3ace-44e4-9cf6-7be5dac2d74f,ИП «Жукова Родионова»,"с. Каменск-Шахтинский, алл. Ставропольская, д. 5/8, 512640",+7 (546) 742-82-91,Акулина Алексеевна Терентьева
8f7b2665-4871-445f-ad94-e08cd284b166,РТИ,"г. Хабаровск, бул. Средний, д. 596 к. 8/2, 033455",+7 976 416 36 00,Капитон Богданович Афанасьев
c5c09696-ad67-49f7-b13a-0fe2b94be102,Молчанова Лимитед,"д. Тавда, бул. 8-е Марта, д. 4/9 стр. 4/5, 280827",8 (202) 431-41-42,Таисия Антоновна Михайлова
2e44f86b-b7a0-4f01-b952-f1daa08f344e,Концерн Титан-2,"г. Ясный (Оренб.), бул. Загородный, д. 258, 716734",88689377288,Бобров Яков Владленович
6e926a51-d2e9-436a-aa4e-c90e9bb92628,Группа О'кей,"к. Шахты, ул. Коммунаров, д. 145 к. 163, 098100",8 (688) 806-3049,Орест Аверьянович Беляев
b3bda29b-05ca-4bb4-acae-c1f8e3f9bf85,Никонова Инкорпорэйтед,"ст. Лянтор, наб. Путейская, д. 311 к. 2, 416845",8 156 893 70 10,Лазарь Тимурович Никитин
a4dc48d0-c3d6-40aa-90ac-90d287903981,СДС-Уголь,"г. Старая Русса, пр. Индустриальный, д. 12 стр. 7, 534523",86415183517,Агап Игнатьевич Крюков
3f40fc0c-eb44-43b8-a65a-a5fddcf6b9b2,РАО «Кудрявцев-Сафонова»,"д. Клин, алл. Таманская, д. 8, 664436",8 731 290 62 55,Носов Семен Ильич
6f25230f-87b8-4b00-8716-dc367de48092,ИП «Громов-Соколов»,"клх Лабытнанги, бул. Пионерский, д. 1/3, 801413",+7 828 148 1946,Болеслав Ефремович Горбунов
0c6181e0-f76d-4df0-ba81-828f39418cac,"АО «Суханова, Якушев и Сафонов»","к. Лодейное Поле, ш. Олимпийское, д. 8/1 к. 6/1, 242039",85874857878,Родион Викторович Гурьев
fc654567-352d-4e5b-a7d9-ae4253e93ba6,Евсеева Групп,"с. Дивногорск, ш. Жуковского, д. 3/3 стр. 3/8, 882862",+7 738 314 1992,Дорофеева Людмила Аскольдовна
1a9204be-88e8-4686-85c7-f64bd6b9397f,Калашникова Инк,"к. Красногорск (Моск.), пер. Шевченко, д. 5 к. 270, 824872",+7 (737) 429-0501,Галактион Жоресович Иванов
9458c86e-5961-4bb2-b17e-41c345aff21e,ЗАО «Афанасьев»,"к. Чебаркуль, бул. Мичурина, д. 4 к. 7/1, 494874",8 882 242 72 77,Агата Эльдаровна Фокина
ad6e490c-9e88-41b4-9ff3-8f299ab0e1e7,Капустина Лтд,"с. Стрежевой, пер. Вишневый, д. 193 стр. 63, 606734",8 (711) 772-71-05,Бобылева Глафира Руслановна
19d427e5-b49d-49ac-ad57-0b7ac84937cc,Новиков Лтд,"п. Северобайкальск, наб. Сибирская, д. 237 к. 336, 261235",8 (676) 415-3585,Яков Авдеевич Колесников
06086e11-882e-4d26-96ae-1e9c0bee032b,НПО «Аксенов Дроздов»,"клх Люберцы, пер. Иркутский, д. 65, 741313",8 874 110 01 19,Марфа Константиновна Соловьева
20e15eb2-32e3-4436-89f4-39af3546ca09,ЗАО «Григорьев-Блохина»,"с. Красноселькуп, ш. Мелиораторов, д. 13, 111825",80800683122,Зосима Матвеевич Яковлев
4494ad5e-13fb-4ea8-8122-b00f4fe91596,"ОАО «Васильев, Яковлев и Артемьева»","п. Шуя, ш. Революции, д. 853 к. 31, 621371",+7 871 931 29 97,Надежда Борисовна Колесникова
41732a6e-a5b6-45c2-8e7d-529a63691859,Сибтрейд,"с. Жуковский, пр. Большой, д. 1/1, 504538",+7 (050) 877-71-11,Мариан Харитонович Сорокин
675c3f5e-5f17-458f-970e-e8800744a80e,ЗАО «Сысоев Тарасов»,"ст. Ессентуки, ул. Шишкина, д. 782 стр. 4/2, 519770",+7 (623) 009-9951,Силина Регина Никифоровна
9e9fb582-94f2-4850-8613-b6f05e4f5524,РАО «Гусева Ларионова»,"ст. Снежногорск (Мурм.), пер. Дружба, д. 5 стр. 8, 732689",+7 173 352 38 70,Казаков Модест Ефстафьевич
6e5da8aa-dd09-4a9a-9c3b-064ab440a938,Харитонов Инкорпорэйтед,"ст. Верещагино (Перм.), пер. Привокзальный, д. 4/4 стр. 35, 655797",+7 (759) 413-1659,Ефимова Полина Юрьевна
9c9e9c44-43fc-4620-aabe-700258e0eda2,"НПО «Федосеев, Максимова и Белоусов»","клх Красноуфимск, пер. Клубный, д. 7 к. 79, 630807",+7 345 781 1828,Василиса Афанасьевна Никонова
fe7e65ae-f3aa-4866-aa5a-9ba591079ffd,РАО «Муравьева»,"п. Вологда, пр. Молодежный, д. 432 к. 9/4, 692522",+7 (136) 875-56-30,Евпраксия Богдановна Овчинникова
76b27751-9748-452f-b910-406991112a6e,БелАЗ-24,"с. Грозный, ул. Крестьянская, д. 86 стр. 62, 619492",+7 (395) 111-5774,Князева Наина Макаровна
edf95e2d-a4e0-4d12-b395-8aba7a6d5784,ООО «Беляев Михеева»,"п. Шенкурск, пр. Металлургов, д. 5/5 к. 39, 118175",8 141 582 2567,Стрелков Зосима Харлампьевич
e85fbfa5-25cb-4e0a-9c08-7cc26e3f2629,РАО «Миронова-Исакова»,"п. Курчатов, ш. Алтайское, д. 18 стр. 2, 141275",8 545 297 13 13,Филатова Агата Филипповна
006008d8-451f-4036-ac97-1a7ec21da5b5,Лапина Лтд,"д. Волгоград, ш. Большое, д. 4/6, 886956",+7 (445) 640-78-62,Евгений Харитонович Суханов
b993f284-093e-4d5d-925e-0cbed91846f5,Главное управление обустройства войск (ГУОВ),"п. Ельня, алл. Металлургов, д. 5/8, 296381",+7 (225) 325-57-56,Игнатьев Арсений Афанасьевич
52d21d42-1803-4365-9f8b-3c0f57dc1f12,ГК Российские коммунальные системы,"ст. Кузнецк, алл. Правды, д. 6/6 к. 9/1, 359909",+7 (922) 915-9741,Боян Феофанович Титов
5cc73841-8de4-4631-9b37-45b5cb927338,РАО «Зыков Тимофеев»,"п. Нижневартовск, бул. Котовского, д. 9 к. 5/8, 775217",8 857 945 64 06,Попова Алевтина Вячеславовна
8398f28f-13a6-4a41-b42c-ee88e431758e,Аэрофлот — Российские авиалинии,"г. Соликамск, пр. Подстанция, д. 617, 438025",+7 (989) 882-48-62,Нифонт Эдуардович Волков
b5891c07-59a9-4205-b220-e2983bd94fb7,"ИП «Кириллова, Лазарев и Николаев»","к. Минеральные Воды, ул. Орджоникидзе, д. 3/8, 398259",8 (779) 651-85-38,Регина Семеновна Маркова
079c65c8-7c8c-4bae-baa0-fb2612b31d15,Международный центр,"г. Махачкала, пр. Весенний, д. 4/1 стр. 2, 258585",8 098 513 3685,Самсонов Ратмир Егорович
6a40835e-aa95-467b-86ad-4f721f8d480c,"РАО «Савельев, Владимирова и Константинова»","клх Ижевск, алл. Средняя, д. 110 к. 662, 096071",8 (784) 706-69-73,Азарий Дмитриевич Давыдов
39fe1e43-4059-4097-a628-94f86c99656b,Росморпорт,"ст. Агата, ш. Нахимова, д. 564 стр. 5/3, 288099",+7 913 021 3946,Изот Борисович Русаков
3adb2734-d3ab-4628-b3be-d90659a3aa2a,ИП «Миронов Коновалова»,"п. Сунтар, пер. Космонавтов, д. 6, 979547",86790362738,г-н Ситников Святослав Алексеевич
1786f1eb-4ede-42c5-90d2-7001e0fa97cc,Группа РТК,"п. Кузнецк, пер. Крымский, д. 82 стр. 6/3, 887244",84688659556,Фадеева Марина Олеговна
485e5488-6c5d-49cf-91fb-0477daa07376,АО «Колесникова»,"с. Северобайкальск, наб. Профсоюзная, д. 1 к. 8, 367266",+7 (660) 041-78-77,Сергеева Нина Андреевна
22bd0105-acee-45d4-95a0-26abee346d4f,"НПО «Владимирова, Беляева и Кузнецова»","к. Салават, ш. Казанское, д. 968 к. 1/4, 920339",+7 507 134 93 29,Белов Ратмир Исидорович
e3bb8ca9-03e0-4ccd-ae9b-0b5cc83f0c02,Степанова Лтд,"п. Горячий Ключ, пер. Лесный, д. 37 к. 5/4, 019382",84510252481,Антонин Анатольевич Петухов
974eea9d-cf00-4460-b9c8-6c1b5d3f0bb4,Меркушев Инкорпорэйтед,"д. Шумиха, пр. Надежды, д. 16 к. 4, 522224",+7 (249) 684-8080,Кабанова Олимпиада Андреевна
acc05f37-b5bd-4812-8110-5e62f0b59dc8,ОАО «Александров Белякова»,"д. Светлогорск (Калин.), наб. Севастопольская, д. 853, 290688",+7 (415) 601-8465,г-н Шашков Владилен Ефстафьевич
bd98e9bd-1d7a-49d0-9b77-780030071dd3,ООО «Лукина Панова»,"г. Терней, наб. Харьковская, д. 992 стр. 7/2, 295100",84119356214,Баранова Синклитикия Львовна
0770fca9-0411-4a90-96db-7aef25550a06,РАО «Кузнецов-Королев»,"к. Дудинка, наб. Волжская, д. 2/2, 057816",8 180 891 17 88,Филарет Валерьянович Шестаков
92cc5d27-8184-41dd-9bf5-d19131beca1a,ОАО «Ершов Колесников»,"к. Междуреченский, наб. Кооперативная, д. 2 стр. 20, 195887",+7 776 569 69 28,Регина Альбертовна Гришина
aef6b632-1349-4c93-9075-c7b21c12cb96,"ЗАО «Некрасов, Кулакова и Голубева»","г. Апшеронск, ш. Сельское, д. 52 к. 96, 134362",8 580 625 06 65,Нина Ждановна Владимирова
fcdb3428-648a-459a-a489-0f82fbe8c2c8,НПО «Чернов»,"д. Великие Луки, ул. Чернышевского, д. 518 стр. 5/6, 002304",+7 (473) 891-3042,Майя Никифоровна Лапина
6a79f19b-0f5f-4fa1-a7e7-a3a1d6f183b9,Мазда Мотор Рус (Mazda),"к. Златоуст, бул. Блюхера, д. 2/5 стр. 2/4, 667971",8 (921) 054-10-86,Мартьян Даниилович Поляков
3b324a1d-3be7-488c-aea5-ac11a2f73a59,Беркс,"клх Березники, ш. Станционное, д. 5/7 к. 3/7, 610975",+7 086 706 0887,Касьян Терентьевич Молчанов
85c51b69-dcf0-4ea2-bf07-e513a77020c6,Группа Синара,"п. Ставрополь, ш. Вольное, д. 39 к. 69, 931688",8 593 566 2981,Сидор Феоктистович Александров
7ed1f583-85cd-45af-beb4-58a59dbe03ed,Снежная Королева,"п. Гудермес, наб. Димитрова, д. 3, 551813",8 (374) 604-83-86,Волкова Майя Мироновна
3712f900-1a87-4b0f-8fa5-681e6202425c,ТД БелАЗ,"клх Ямбург, ул. Мельничная, д. 6 к. 5, 999673",+7 151 671 73 56,Сорокина Ксения Даниловна
19e75ac4-3f5e-4690-9bb1-0e709e9100f7,ЗАО «Ильина»,"ст. Палана, ш. Свердлова, д. 5 к. 2, 546362",+7 911 242 7516,Киселев Мартьян Ефремович
921e0032-51f9-4ae9-9bcf-a76390281c49,Фармимэкс,"п. Нефтеюганск, ул. Геологическая, д. 372, 949567",8 (798) 239-4746,Коновалов Моисей Евсеевич
8ac9a372-9ed6-4c63-83a8-769ff7ad9338,"НПО «Мишин, Сорокин и Журавлев»","к. Горно-Алтайск, ул. Победы, д. 1 стр. 1/6, 720729",+7 511 838 22 65,Романова Юлия Антоновна
65835302-9a40-4254-9436-28862838fcae,АО «Абрамова-Туров»,"клх Дивногорск, алл. Петровская, д. 50 к. 5, 347481",+7 230 193 45 12,Тарасов Антип Фомич
58573544-6725-4eae-b24f-386193dae785,Амурская нефтебаза,"п. Белореченск, ул. Пионерская, д. 9, 157314",8 (570) 215-5519,Новикова Октябрина Егоровна
7c6a2078-2c3a-4a9e-9ef4-bfa0a1c757cb,ЗАО «Кириллов-Тетерин»,"п. Середниково, пер. Верхний, д. 17 к. 93, 818941",+7 (029) 473-76-59,Полина Эдуардовна Наумова
8c72391f-d5c0-4fa2-af30-d62e174911ca,АО «Шашкова»,"п. Курчатов, алл. Юности, д. 6 к. 912, 835949",+7 477 460 1520,Лидия Филипповна Субботина
d5b4deaa-9e41-4dfd-98b3-284cd3d8b155,ЗАО «Исаков-Киселев»,"г. Зеленогорск (Ленин.), ул. Кутузова, д. 770 к. 9, 155760",+7 (907) 732-8899,Семенова Елена Борисовна
2f42e788-e26c-4cc2-87ab-d158e72979dc,НПО «Рябова»,"к. Нефедова, ш. Спартака, д. 8/5 стр. 25, 599819",+7 (456) 490-92-05,Регина Евгеньевна Князева
c00c29ad-1d9e-4aa3-b46b-5125d1211561,ООО «Большаков Медведев»,"д. Пушкино (Моск.), бул. Дзержинского, д. 88, 489327",+7 458 806 4494,Мясников Лавр Филатович
fc0b1ce0-0a6f-4bbe-9100-ffdf7e1222e0,Максидом,"г. Далматово, алл. Минина, д. 7 стр. 28, 579715",+7 359 218 38 34,Велимир Димитриевич Макаров
1a8664f5-a9dd-4e2b-af9c-72dc3ba0065d,Зуев Инк,"г. Краснокамск, бул. Курортный, д. 3 к. 2/7, 148073",8 (558) 254-6683,Родионов Демьян Изотович
d4e91622-98f4-4549-851a-6ea833d87ba2,Орлова Инкорпорэйтед,"к. Сортавала, пр. Бажова, д. 4, 233774",+7 490 661 7495,Князева Наталья Ждановна
1a8691ce-9781-4fae-b56d-e63cdd274c8c,ЗАО «Петров-Суворов»,"ст. Усмань, бул. Павлова, д. 229 стр. 28, 426288",8 717 934 0841,Сазонов Викторин Феоктистович
716b1465-61a1-4498-9b43-f90b62730a80,НПО «Копылова Ларионов»,"ст. Вязьма, алл. Ульянова, д. 7 к. 5, 643859",+77229064386,Кириллова Иванна Львовна
f9adec1b-d642-4d7d-aa58-afde124e48e7,"ИП «Рогова, Тимофеев и Чернова»","г. Хасан, пр. Баумана, д. 3/7 к. 7, 939686",+7 173 000 3675,Степанов Гаврила Всеволодович
dedabe78-af37-4983-9a45-7e5bdad4a737,ГСЛ,"д. Курганинск, бул. Ветеранов, д. 68 стр. 658, 801956",87610939661,Мартынова Кира Кузьминична
9afa40f4-e2bb-47ef-88e3-29815141aafb,АО «Трофимова Васильев»,"д. Шуя, пер. Амурский, д. 9/6 стр. 9/1, 536763",8 394 717 9802,Марина Ниловна Андреева
070c2f9d-2aae-4c5a-b1d9-11b59090e010,ИП «Рыбакова Шашкова»,"клх Муравленко, пр. Ярославский, д. 270 стр. 308, 763881",+77189321597,Руслан Ильясович Князев
c2d8a7f2-5ca9-4738-b0d2-b47c5db61081,"ООО «Исаков, Шашкова и Шилова»","ст. Углич, ш. Станиславского, д. 2 к. 477, 628722",8 434 692 51 32,Варвара Ждановна Брагина
3e8062fb-f45d-442b-a79b-d014985a1088,АФК Система,"клх Железногорск(Курск.), пр. Тукая, д. 182 стр. 51, 728426",+7 898 746 8498,Агафон Феодосьевич Субботин
b7719535-8d6b-4a8a-842f-cfb4fa98d781,ИП «Бирюков Кудрявцева»,"ст. Добрянка, пер. Семашко, д. 35 к. 6, 117643",86487836567,Сафонова Октябрина Руслановна
fdbf636b-4d4c-4009-845e-7334eab19beb,Суворова и партнеры,"с. Гагарин, наб. Хуторская, д. 1/9 к. 511, 953349",8 706 304 96 07,Ювеналий Филиппович Баранов
80ca4623-2a5e-4b68-9342-c658657d6f0c,ОАО «Жданов-Кузнецов»,"ст. Чермоз, пер. Шишкина, д. 75 к. 9/3, 326064",+7 874 324 12 65,Фомичев Никандр Антонович
be1102f4-040d-4ce6-9b90-9755d7d561df,ЗАО «Меркушев-Дроздов»,"к. Чита, ул. Есенина, д. 2/6, 160432",8 (137) 873-57-05,Галина Максимовна Орехова
