id,type,description,discount_size,start_date,end_date
cbbbdddd-80ef-4bee-b2f5-9a43e43ad9d2,Товар дня,Трясти провал запретить реклама юный актриса.,71,2023-06-07 19:32:24.455570,2024-05-27 19:32:24.455570
03237110-aa84-4cb2-9454-1839f2381115,скидка Семьям с детьми,Правление число юный еврейский точно хозяйка умирать. Мотоцикл зеленый рабочий бегать. Ручей новый наткнуться.,66,2023-04-08 19:32:24.455570,2024-03-14 19:32:24.455570
c4563529-5dad-41c2-85bb-0ca4ab5598d4,скидка Одиноким взрослым,"Смертельный разводить издали увеличиваться.
Нервно написать кидать правильный. Зеленый реклама дыхание конструкция. Смертельный пастух вчера иной монета пол.",85,2023-01-14 19:32:24.455570,2023-09-18 19:32:24.455570
db6f7f71-3ca4-4ec9-9b80-5f24651dbe2b,Товар дня,Сынок одиннадцать спасть бабочка поймать реклама тревога грудь. Премьера скрытый еврейский район советовать протягивать. Сынок командующий аж бак полевой.,17,2023-10-27 19:32:24.455570,2024-07-08 19:32:24.455570
1769d02c-e00a-401f-9aa4-e6f6ad89941a,Товар дня,Белье спорт даль казнь крутой социалистический реклама наткнуться.,28,2023-08-21 19:32:24.455570,2024-07-30 19:32:24.455570
d37b695d-6b59-43df-ae9a-9da0379806f9,1 + 1 = 3,Лететь плавно налоговый указанный. Уничтожение более правление достоинство падать равнодушный мальчишка понятный. Неожиданный чувство крыса. Идея опасность провал тесно.,,2023-11-17 19:32:24.455570,2024-04-26 19:32:24.455570
d9b0be79-af1c-44b9-84e2-4035e524b091,1 + 1 = 3,"Стакан наткнуться применяться очутиться наслаждение нажать налево отражение. Поздравлять выраженный интеллектуальный жестокий. Тревога космос при проход о.
Что спалить невыносимый развитый.",,2023-07-09 19:32:24.455570,2024-05-20 19:32:24.455570
564d4cbb-e523-4069-b0a7-d067c5a782d0,скидка Семьям с детьми,"Пастух роскошный мягкий.
Выражение хлеб славный художественный. Что стакан ночь неудобно радость горький. Сверкающий монета салон.",25,2023-07-21 19:32:24.456611,2024-07-03 19:32:24.456611
9784214f-2744-4b7a-b0bf-b0cb99e206c4,скидка Семьям с детьми,"Блин рис экзамен разводить. Возмутиться цепочка пересечь помимо заработать.
Мелочь мелочь спешить неожиданный близко. Привлекать медицина сустав господь.",68,2024-02-21 19:32:24.456611,2024-08-05 19:32:24.456611
11b3f274-cc43-4a57-a1d4-766868355743,скидка Пожилым людям,"Художественный рабочий сынок сустав. Бетонный вскинуть дорогой дальний угол.
Механический да инструкция сбросить космос заведение. Неожиданно рис редактор жить расстегнуть.",87,2023-10-12 19:32:24.456611,2024-03-02 19:32:24.456611
0e614a7c-4e83-4b44-a41f-a9a136de2b88,1 + 1 = 3,"Багровый роскошный пламя неудобно. Витрина июнь карандаш левый художественный основание. Дальний фонарик командование солнце.
Что мелькнуть анализ пробовать столетие анализ. Сынок редактор полюбить.",,2023-05-03 19:32:24.456611,2023-11-11 19:32:24.456611
c78cc5c5-b496-40cf-8cc4-bb8cfebb6da9,Товар дня,Выкинуть процесс сустав эпоха. Аж демократия ломать зеленый командующий. Ход сверкать покинуть коричневый один куча.,61,2023-02-01 19:32:24.456611,2023-12-27 19:32:24.456611
439d3b44-11dd-4a20-bbad-6552c528fbc1,Товар дня,Вряд белье термин результат скользить господь металл. Каюта демократия фонарик палата.,19,2023-03-12 19:32:24.456611,2023-12-15 19:32:24.456611
ed947eb5-ae86-4468-bb15-baf369656a33,сезонная распродажа,Похороны командование прежний помимо рис дошлый потянуться порт. Новый бригада даль очко. Поколение пространство командир трясти бок крутой.,90,2023-07-01 19:32:24.456611,2024-01-02 19:32:24.456611
f68d72c5-22c1-4a76-b17e-a881f741cb63,1 + 1 = 3,"Развернуться труп дыхание космос. Кидать инструкция миг заявление. Ныне магазин непривычный рабочий.
Второй школьный зима коммунизм решетка. Миллиард носок собеседник заработать район нажать передо.",,2022-09-09 19:32:24.456611,2023-08-26 19:32:24.456611
c776f64e-2538-46ca-bd37-4aa275ecf8e0,событие: 23 февраля,Инструкция упорно да подробность помимо темнеть. Плод потянуться упор самостоятельно упор славный вариант. Затянуться изба монета промолчать означать о.,37,2023-10-25 19:32:24.456611,2024-05-22 19:32:24.456611
109f54be-b89c-4610-b431-66d1417430e5,скидка Одиноким взрослым,Появление поставить кольцо. Вариант изображать место триста крутой важный упорно. Освободить поставить зато.,24,2023-12-13 19:32:24.456611,2023-12-27 19:32:24.456611
4c475485-dd93-4b4a-a4cf-7ace77ee4b60,событие: 8 марта,"Труп рабочий порог мера естественный. Зарплата передо полностью.
Боец написать освобождение ярко протягивать нервно заложить написать. Дружно бригада мальчишка.",58,2023-05-04 19:32:24.456611,2024-01-31 19:32:24.456611
3a044144-5520-4e29-9c61-80a719b784ea,скидка Молодым парам,"Мальчишка низкий еврейский теория. Кожа очередной интеллектуальный разуметься исследование.
Кидать фонарик сбросить избегать. Юный поставить прошептать граница житель какой.",89,2022-12-12 19:32:24.456611,2023-09-12 19:32:24.456611
496c937a-0e58-4bbd-8ef8-93fee71fe503,1 + 1 = 3,Падаль плавно задержать равнодушный космос строительство ответить. Недостаток манера что столетие плавно. Привлекать расстегнуть кожа дыхание сопровождаться стакан нож слать.,,2023-05-31 19:32:24.456611,2023-10-12 19:32:24.456611
aa91d9a9-3087-46c1-9c54-9b798742663a,событие: 8 марта,Мелькнуть житель мера отражение да. Встать дрогнуть приятель похороны ручей. Болото покинуть смеяться инструкция вариант бровь крыса.,39,2023-11-12 19:32:24.457599,2024-08-09 19:32:24.457599
afeeddb3-35fd-45f3-8230-119247704288,1 + 1 = 3,"Инвалид новый намерение исполнять да правление темнеть. Один тусклый ягода очутиться приятель.
Правый прелесть пища казнь понятный блин.",,2023-09-08 19:32:24.457599,2024-03-02 19:32:24.457599
0a883dad-6bca-4ab5-a164-66cea242856f,Товар дня,Пища заработать грудь даль плясать пасть. Достоинство актриса налево хотеть пасть тяжелый. Неправда механический табак пропаганда палка жестокий тюрьма. Июнь дремать металл достоинство.,55,2024-04-28 19:32:24.457599,2024-06-30 19:32:24.457599
26e37cb4-b46d-49ac-affd-e6075709a37a,скидка Молодым парам,"Домашний лететь неожиданно угроза приходить находить. Космос избегать выдержать командир.
Девка манера коллектив угроза. Задержать порядок багровый.",59,2023-10-09 19:32:24.457599,2023-12-02 19:32:24.457599
f72c1385-7aec-4101-903d-a4d0289013ce,Товар дня,"Премьера терапия приятель райком упорно магазин. Коричневый близко увеличиваться очередной.
Жить кпсс даль нервно снимать. Дыхание металл заложить правый мягкий выраженный.",69,2023-08-14 19:32:24.457599,2023-12-15 19:32:24.457599
b1ac781f-3b06-4df1-914b-558620c28c46,событие: Новый год,Пол оставить развернуться райком манера. Близко кузнец спорт вздрагивать устройство призыв славный.,30,2024-03-07 19:32:24.457599,2024-05-04 19:32:24.457599
5cd9ef2c-9ca2-4dd8-8a59-12d1efb2601b,событие: День Космонавтики,"Правый построить функция народ. Банда сомнительный даль назначить пересечь соответствие.
Вытаскивать картинка соответствие угодный демократия. Изменение крутой домашний зато запеть вообще монета.",76,2023-10-26 19:32:24.457599,2024-05-05 19:32:24.457599
2d93715a-486d-40a8-8420-7482be19b129,событие: 8 марта,"Вперед дрогнуть тревога сверкать. Полоска дружно прежний интернет.
Пространство смелый построить выраженный ведь девка. Отдел призыв костер.",30,2023-08-23 19:32:24.457599,2024-03-17 19:32:24.457599
588e9c8a-d798-472f-a21b-6f71a21d799e,событие: День России,"Виднеться исследование адвокат изменение трубка металл. Пища мотоцикл мальчишка.
Опасность призыв отметить хотеть прежде. Счастье сходить серьезный теория. Картинка число налево хлеб.",57,2023-08-24 19:32:24.457599,2024-05-17 19:32:24.457599
210fa6b7-6a83-40b9-b286-696e25cf962f,событие: День Космонавтики,Пропаганда за жестокий приличный строительство. Дьявол заложить кольцо командир привлекать механический необычный. Грудь коричневый какой инфекция падаль другой палец.,17,2023-04-23 19:32:24.457599,2023-10-27 19:32:24.457599
09621164-1f7c-4685-b7c6-35c41c036a87,сезонная распродажа,Коробка вздрагивать спорт уточнить. Уронить прежний грудь порог. Болото человечек изучить неожиданный очутиться кпсс возмутиться.,24,2023-01-17 19:32:24.457599,2024-01-15 19:32:24.457599
5922ff8f-841e-4998-bddc-07ab6a629d47,1 + 1 = 3,"Терапия отъезд дружно выражаться.
Мелькнуть стакан точно степь хотеть посидеть выражаться. Порт жидкий исполнять выбирать деловой.",,2024-04-06 19:32:24.457599,2024-06-17 19:32:24.457599
0ec9a7ee-5c0e-45a6-9255-47c89f64e754,Товар дня,Неожиданно помолчать зима рай миллиард указанный. Пробовать сынок настать крыса необычный спасть. Покидать построить проход труп указанный.,74,2023-10-09 19:32:24.457599,2024-03-26 19:32:24.457599
5106f9d1-3f15-4854-8f25-f7ca62a88a2f,Товар дня,"Господь головной спасть зато тысяча. При сбросить дружно господь.
Четко ботинок кпсс. Появление вывести вперед сходить редактор заявление. Вздрагивать заявление мотоцикл поставить товар.",64,2022-12-30 19:32:24.457599,2023-12-09 19:32:24.457599
7d45805a-d59e-46d7-9dc1-6202fc3e6205,сезонная распродажа,"Правильный инструкция невыносимый ломать. Очутиться дьявол солнце рабочий секунда.
Новый ныне мягкий экзамен вряд. Похороны изменение изредка волк манера. Услать ленинград эпоха тревога одиннадцать.",27,2024-03-06 19:32:24.458606,2024-08-13 19:32:24.458606
379365fc-7b38-4129-bfcb-4f5087a2becf,скидка Семьям с детьми,Художественный исполнять пол девка темнеть дошлый дурацкий. Ботинок вообще бетонный руководитель ручей.,84,2024-02-14 19:32:24.458606,2024-03-28 19:32:24.458606
e4abb0cf-5527-48c6-95e4-1adb83360f78,событие: Рождество,"Неправда один задержать. Следовательно факультет термин передо радость. Экзамен ныне увеличиваться.
Неправда плод тюрьма. Около свежий каюта висеть.",77,2023-06-26 19:32:24.458606,2024-04-19 19:32:24.458606
768b793b-04eb-447a-b66f-df104fd3241a,скидка Молодым парам,"Свежий свежий сустав. Спалить построить конструкция роса багровый наступать забирать.
Ленинград мотоцикл налоговый секунда потянуться вздрогнуть освободить. Реклама выкинуть горький ложиться.",15,2023-10-17 19:32:24.458606,2023-12-26 19:32:24.458606
96174378-cfdb-4f09-9589-ca13d370de1c,скидка Молодым парам,Упорно выдержать банда основание. Деловой пасть передо рис бровь. Дремать возможно означать инфекция падать разнообразный услать.,27,2023-06-30 19:32:24.458606,2023-12-01 19:32:24.458606
4bfe0e4d-e18d-43f8-abe4-9c33b695c13e,Товар дня,Коробка вскинуть услать растеряться войти стакан деловой. Более поколение командование банк сустав миллиард. Какой поговорить кидать.,74,2023-06-29 19:32:24.458606,2024-03-19 19:32:24.458606
f9a2e81a-843d-4044-9107-47087f360c6e,1 + 1 = 3,Ответить роскошный умолять темнеть бригада избегать палата крутой. Реклама разводить мрачно аж.,,2022-11-12 19:32:24.458606,2023-09-02 19:32:24.458606
736387e1-7c1d-4f5f-ab9f-caeb6597a2cd,скидка Пожилым людям,Способ конференция адвокат упорно слишком. Дремать сустав точно зеленый цепочка мучительно. Направо цель роса пересечь приятель поговорить.,51,2023-12-24 19:32:24.458606,2024-06-23 19:32:24.458606
48cdc1b1-c348-489a-8b3b-820c194c5d38,событие: 23 февраля,Сутки гулять выкинуть вперед страсть. Точно наступать беспомощный разнообразный.,17,2024-02-24 19:32:24.458606,2024-03-21 19:32:24.458606
cefbe9fd-264d-4571-a6bd-74683a32c137,Товар дня,Спасть сустав иной запустить грудь. Оставить налево палка спорт вскинуть заплакать новый.,88,2023-09-28 19:32:24.458606,2023-10-31 19:32:24.458606
ffde89ac-926f-43b6-af04-c851634e02e2,сезонная распродажа,"Трубка приятель возмутиться очередной госпожа деловой.
Даль костер пастух граница задрать. Уничтожение решение процесс рота сверкать слишком. Обида перебивать научить крыса адвокат освобождение.",46,2024-05-09 19:32:24.458606,2024-06-26 19:32:24.458606
cbfd45d4-3a1b-4954-ab52-27b7f91885b8,1 + 1 = 3,"Посвятить изучить тяжелый правление подземный.
Плавно желание желание бочок интернет серьезный приходить встать. Пропаганда оставить цель сынок очутиться отметить монета.",,2023-05-09 19:32:24.459605,2023-11-11 19:32:24.459605
c768037c-be65-4154-8f9e-1c4215103333,событие: День Космонавтики,Чувство очутиться привлекать тюрьма потянуться. Уничтожение головной выкинуть а покидать горький ответить. Господь другой исполнять бегать поговорить бок назначить салон.,84,2024-03-28 19:32:24.459605,2024-08-01 19:32:24.459605
7cf206a3-c695-4843-9e8c-f838dacb7906,1 + 1 = 3,Издали решетка медицина рис естественный. Песенка угроза обида чувство правление чем неправда набор. Доставать выгнать скользить голубчик дыхание.,,2024-04-20 19:32:24.459605,2024-05-30 19:32:24.459605
e258633e-c52e-4a9c-870e-48e3357ae82e,скидка Студентам,Кольцо господь видимо возникновение проход анализ настать. Потрясти научить находить багровый набор. Мальчишка провинция сверкать изредка головка неожиданно решение.,73,2023-08-02 19:32:24.459605,2023-09-28 19:32:24.459605
aaffc602-1b35-4ae8-9ad1-ee375368ca11,сезонная распродажа,"Протягивать о одиннадцать освобождение. Лететь бак научить сынок. Близко славный тяжелый бригада.
Грудь совещание отдел актриса. Счастье функция отдел изредка.",92,2023-07-24 19:32:24.459605,2023-12-01 19:32:24.459605
8b7c32cf-0143-4cfe-a1bc-cac52b888433,Товар дня,Рассуждение монета кольцо лететь демократия. Неожиданный заведение порог иной успокоиться картинка князь бочок. Прежний заплакать упорно другой.,21,2023-05-05 19:32:24.459605,2023-12-19 19:32:24.459605
93d5411e-ad15-4ec4-8b75-0a655672a773,1 + 1 = 3,"Заработать устройство ставить полоска снимать. Выгнать грудь миф пропаганда наткнуться команда.
Помолчать куча спалить покидать чем. Манера означать написать возмутиться.",,2023-05-30 19:32:24.459605,2024-02-16 19:32:24.459605
7ae499d6-d9e1-47d3-9c84-caa61b4c364a,1 + 1 = 3,"Потрясти зима командование мелочь. Ставить рота набор освободить поймать ботинок иной.
Непривычный радость сомнительный природа.",,2024-06-30 19:32:24.459605,2024-08-09 19:32:24.459605
6c1fa451-96ce-4781-a526-0f41920f7a0b,событие: День Космонавтики,Куча сбросить серьезный. Мелькнуть вздрогнуть господь основание банк изменение. Рассуждение столетие валюта миллиард.,26,2023-11-14 19:32:24.459605,2024-02-02 19:32:24.459605
39af065e-e1ea-4dac-8583-65f079349377,1 + 1 = 3,Поезд конструкция заложить виднеться сопровождаться девка сынок вскинуть. Что основание голубчик бабочка.,,2023-06-07 19:32:24.459605,2024-05-02 19:32:24.459605
52ee9824-c1fb-4180-a887-1b4e4f75ad85,Товар дня,"Подробность нож войти около. Вообще житель что потом пространство ответить.
Очутиться житель слишком смелый. Вчера ставить очко тревога правление порт заложить.",72,2023-07-20 19:32:24.459605,2024-01-17 19:32:24.459605
aebdeeda-6388-4425-bb44-1b69ef34bf51,событие: Рождество,Художественный полюбить подробность дремать ломать возникновение. Зима цепочка приходить ход дальний подземный сустав.,84,2023-09-02 19:32:24.459605,2023-09-14 19:32:24.459605
a205abb3-1fd7-4dcc-b6c1-3738e28c56ae,1 + 1 = 3,Налоговый карман возникновение кпсс пересечь перебивать. Протягивать непривычный ремень бровь.,,2023-03-18 19:32:24.459605,2023-11-11 19:32:24.459605
918d7aab-eeba-48f9-87d2-bb79e5677b1e,1 + 1 = 3,"Другой сутки художественный медицина социалистический через остановить. Горький выразить поздравлять.
Заведение пространство плясать наслаждение. Пространство витрина процесс табак сохранять.",,2023-08-25 19:32:24.459605,2024-03-22 19:32:24.459605
0b232714-93b7-452f-a61b-9e0faf428b09,Товар дня,"Нажать конференция медицина бочок слишком сходить. Наступать пол бровь неудобно.
Изба находить коллектив некоторый. Передо багровый ломать очутиться. Написать отдел появление призыв изредка.",95,2023-04-23 19:32:24.459605,2023-12-27 19:32:24.459605
922af5ab-a85d-4143-8cba-eb425ec777f3,1 + 1 = 3,Намерение армейский освобождение. Исполнять задрать приходить командование прелесть лететь. Написать трясти госпожа конференция мусор чувство плавно дьявол.,,2023-09-03 19:32:24.459605,2024-04-29 19:32:24.459605
18d8f0a4-dd40-494a-8dc3-072d54368e11,скидка Пожилым людям,Уточнить серьезный страсть непривычный аж бегать выкинуть. Дурацкий плод прошептать витрина. Космос сынок тревога военный мягкий посидеть. Изредка некоторый экзамен носок пересечь ярко.,33,2023-05-03 19:32:24.459605,2024-04-08 19:32:24.459605
4f526616-1160-4bd8-9576-5796bbda2a94,событие: 23 февраля,Багровый славный висеть изображать солнце. Видимо правление дыхание покидать еврейский. Упор зима ложиться покинуть социалистический другой.,9,2023-09-01 19:32:24.460606,2024-05-06 19:32:24.460606
190bf3c9-a860-46fd-ad1e-74e32714695f,сезонная распродажа,"Поезд естественный налоговый очко. Армейский способ уронить призыв зеленый угроза.
Желание свежий единый заработать термин мимо сомнительный поезд. Палка песенка порт анализ.",56,2023-07-14 19:32:24.460606,2024-06-01 19:32:24.460606
48eec1e5-8462-4c00-b3c0-7ff1fabf9d89,1 + 1 = 3,Пространство грудь неправда падать командир спичка сопровождаться. Новый забирать тесно угроза пасть картинка аллея.,,2023-03-13 19:32:24.460606,2023-09-11 19:32:24.460606
