id,type,description,discount_size,start_date,end_date
a8b6ab75-4f48-4b09-b01a-866de36f30f5,1 + 1 = 3,"Разуметься свежий а поймать наступать шлем.
Человечек монета расстройство неудобно виднеться. Исполнять выразить основание витрина посвятить.",,2023-01-19 19:32:24.493222,2023-11-16 19:32:24.493222
1192275b-e870-4f23-8941-005230e6060d,скидка Семьям с детьми,"Задержать лететь сравнение юный. Казнь деловой торговля монета волк витрина. Налево песенка господь тревога мотоцикл.
Возбуждение солнце порт.",46,2023-07-07 19:32:24.493222,2024-02-28 19:32:24.493222
13964b90-3357-4bbb-a8bd-a0f0789091c1,Товар дня,Настать чувство прошептать монета полоска плод. Мимо возможно провинция упорно порядок. Банда наслаждение чем командир товар деньги упорно.,47,2023-04-15 19:32:24.493222,2024-02-12 19:32:24.493222
2bfd9950-4564-462f-9f8b-c2ccac288926,Товар дня,Каюта манера космос нож деньги устройство о. Правление налево тусклый. Сверкать нервно полевой еврейский рабочий вздрагивать правый.,9,2023-07-14 19:32:24.494431,2024-06-26 19:32:24.494431
d50b47a5-7ec6-4442-87ad-c77ed6432771,событие: День Космонавтики,Предоставить грудь счастье пасть низкий очередной. Июнь проход новый подробность командующий белье призыв. Умолять торопливый написать рабочий.,34,2023-05-03 19:32:24.494431,2023-09-19 19:32:24.494431
f4626744-44c7-4deb-b8d3-b1acff74ddf3,сезонная распродажа,Развитый монета научить отметить о интернет эффект находить. Обида триста порядок банда подробность миг функция.,87,2023-05-29 19:32:24.494431,2024-01-09 19:32:24.494431
9a4631b7-7bac-44f2-8a3d-0750e8e6ef51,Товар дня,Мучительно мотоцикл дрогнуть магазин совет построить кожа видимо. Граница левый что командир анализ правление рассуждение. Посвятить сбросить тяжелый даль. Граница угол поймать новый бок.,43,2023-10-30 19:32:24.494431,2023-10-31 19:32:24.494431
7d06db81-ed86-4a99-b1fc-72deae7fa44d,сезонная распродажа,Помолчать скользить научить ведь грудь коллектив. Теория решетка человечек табак. Прежний порода прошептать ложиться головной какой. Радость издали невыносимый бак сходить.,89,2023-06-30 19:32:24.494431,2024-04-06 19:32:24.494431
432da0bf-1611-45cf-9f53-b350b1dcdd5d,1 + 1 = 3,Скользить носок казнь потрясти выгнать близко рассуждение падать. Смеяться радость карандаш вскинуть. Скользить витрина налоговый металл рассуждение академик доставать.,,2023-06-08 19:32:24.494431,2024-04-17 19:32:24.494431
750cecf0-2544-42e7-a4ac-f4bb94f507a5,скидка Студентам,Руководитель коллектив привлекать конференция порт означать рис. Коробка построить успокоиться носок тюрьма спешить угол ведь. Коричневый инструкция пастух рис бак хотеть.,59,2023-07-19 19:32:24.494431,2024-05-21 19:32:24.494431
086afbab-b759-4238-a37b-274f7905b789,скидка Пожилым людям,Пастух князь прощение дьявол природа новый. Крыса уронить каюта упорно появление. Штаб снимать освобождение пища выраженный.,18,2024-02-09 19:32:24.495440,2024-03-16 19:32:24.495440
4e1b40ea-5723-42cb-8644-4040ce09e148,событие: Рождество,Порода другой оборот. Хотеть дремать прощение опасность о каюта. Важный выраженный более аллея ночь.,21,2023-08-04 19:32:24.495440,2024-02-07 19:32:24.495440
b6879f38-adb3-47b7-a2ab-67cde0597b21,1 + 1 = 3,Человечек мягкий табак сутки полностью самостоятельно. Иной указанный ленинград военный. Упор пламя неожиданно выраженный социалистический присесть.,,2023-05-18 19:32:24.495440,2023-09-13 19:32:24.495440
04f99008-419d-4ea8-9a85-4534e27632b0,Товар дня,Мимо полевой висеть чем налево деньги. Крутой даль полюбить металл обида смеяться. Поговорить намерение бок руководитель еврейский что вряд.,77,2024-03-30 19:32:24.495440,2024-04-04 19:32:24.495440
1832aaff-47bf-4fd2-9e8d-2614dba559f5,1 + 1 = 3,Вскинуть снимать плод ягода степь. Другой бочок разнообразный наступать присесть.,,2023-03-28 19:32:24.495440,2023-11-20 19:32:24.495440
7159149b-16fd-4ac6-b280-42fba6d7d90c,скидка Студентам,Сверкать руководитель умолять развернуться поймать издали вздрогнуть. Стакан сбросить доставать слишком куча ручей приятель. Страсть тревога труп вытаскивать бегать.,30,2024-03-04 19:32:24.495440,2024-07-28 19:32:24.495440
38bc8b0b-383d-4082-99bc-3186f73d9f19,скидка Студентам,Уничтожение промолчать художественный важный космос. Степь палка штаб сбросить.,67,2023-08-20 19:32:24.495440,2024-01-07 19:32:24.495440
c93e2ce2-1c4c-4c32-beba-b464c3a19e73,1 + 1 = 3,Назначить роса дружно да разуметься возмутиться. Назначить роскошный торговля деловой.,,2023-07-11 19:32:24.496432,2024-01-19 19:32:24.496432
3687bcd5-7214-442c-b554-34fa01ee3744,сезонная распродажа,Уточнить сустав анализ. Природа коллектив естественный покидать. Сынок близко добиться задержать социалистический находить.,32,2023-04-16 19:32:24.496432,2023-08-27 19:32:24.496432
eb16f2b6-0a1a-4490-a1b1-19aa84899324,скидка Семьям с детьми,Металл команда сутки бок угол возникновение уничтожение. Изменение вряд исследование медицина. Блин хозяйка домашний степь приятель.,60,2024-01-21 19:32:24.496432,2024-06-28 19:32:24.496432
068b8b75-dd1a-4ce0-a121-ba3215c640eb,событие: 8 марта,Пространство угроза невыносимый за самостоятельно написать. Медицина пламя тута вскакивать неожиданный ученый.,50,2024-04-03 19:32:24.496432,2024-05-31 19:32:24.496432
bb0a19e4-85b2-43bf-bbfd-594fdf5f9e65,Товар дня,Запустить левый природа поговорить. Устройство болото успокоиться неожиданно недостаток очутиться сустав. Песня конструкция издали изменение.,71,2022-10-20 19:32:24.496432,2023-09-14 19:32:24.496432
ddcdd8a5-0a6b-49e9-9c4f-87e43ee08dca,1 + 1 = 3,Валюта устройство пропаганда важный ботинок вывести очередной. Торопливый предоставить еврейский деловой заплакать плавно.,,2023-07-17 19:32:24.496432,2024-04-16 19:32:24.496432
d1c30994-04a5-48f8-bf63-d564840334f1,скидка Молодым парам,Сверкающий лапа функция. Торопливый уронить коробка премьера.,13,2023-05-23 19:32:24.496432,2024-05-20 19:32:24.496432
25e301ec-36e5-456a-a3f5-9e4633e5bd05,1 + 1 = 3,Монета выражение вскакивать опасность картинка парень. Рот намерение сохранять опасность желание носок.,,2023-09-19 19:32:24.496432,2024-07-10 19:32:24.496432
a3ea745e-064a-463c-b65a-60047135e390,событие: День Космонавтики,Коммунизм вряд ботинок экзамен тута устройство анализ. Угроза коробка еврейский способ затянуться военный ученый.,42,2022-10-30 19:32:24.496432,2023-09-25 19:32:24.496432
e288c14a-093d-4301-9701-b0b424264fac,Товар дня,Карман сбросить потом миг обида. Иной каюта способ висеть. Заработать необычный эпоха горький горький очутиться предоставить.,14,2023-07-17 19:32:24.496432,2024-06-15 19:32:24.496432
85e328ec-6732-466c-99ba-01b5bda41b4a,1 + 1 = 3,"Забирать сынок лапа аллея растеряться ленинград. Бабочка зарплата соответствие страсть.
Аж второй карандаш способ монета болото. Нажать бригада возбуждение спалить.",,2024-02-12 19:32:24.496432,2024-05-01 19:32:24.496432
a9d9242d-c43b-41ac-9291-59641c96886d,событие: 8 марта,"Виднеться очко неправда. Пространство освобождение вздрагивать поколение.
Находить спешить актриса падаль одиннадцать дурацкий горький. Эффект лететь факультет рис. Хозяйка умолять важный идея.",38,2023-07-05 19:32:24.496432,2024-03-14 19:32:24.496432
1209a189-06c5-4260-a29c-5dee028c82e6,событие: 23 февраля,Крыса армейский магазин смеяться. Школьный мальчишка медицина премьера выражение построить растеряться.,6,2024-06-04 19:32:24.497454,2024-08-15 19:32:24.497454
b2e1cd6e-d1fd-4ba7-b015-3371558405d2,событие: День России,Банк каюта снимать волк дурацкий домашний запретить. Сомнительный стакан изба направо исследование. Освобождение выражаться непривычный плясать бровь голубчик.,69,2023-10-12 19:32:24.497454,2024-01-07 19:32:24.497454
e824b7bc-8860-4bb5-86ae-0b965bf544fb,сезонная распродажа,Пропадать потянуться вообще оборот. Мрачно решение спорт забирать тысяча уронить. Райком триста командование армейский применяться грустный сохранять.,55,2023-10-07 19:32:24.497454,2024-01-05 19:32:24.497454
9e565b32-ef74-471e-8063-c52bb5d0d369,скидка Студентам,Спорт падать смелый около миф картинка аж. Порядок оборот носок художественный полностью дурацкий полностью пища. Аллея нажать заплакать.,70,2024-02-04 19:32:24.497454,2024-06-15 19:32:24.497454
0ede25a3-cb2f-4006-860f-18ea962f761c,событие: 23 февраля,Вперед кпсс понятный покидать пересечь. Зеленый назначить падать добиться медицина исполнять фонарик. Дрогнуть похороны демократия приятель.,91,2024-01-26 19:32:24.497454,2024-03-30 19:32:24.497454
cee079bc-c370-4df8-9a3b-11d4890ad121,сезонная распродажа,Около процесс идея покидать господь. Господь домашний дошлый рабочий. Коммунизм металл лететь медицина школьный манера господь выраженный.,11,2023-09-09 19:32:24.497454,2024-04-05 19:32:24.497454
7a9764d1-94b6-482b-9d2e-0637f1e89fe3,Товар дня,Иной труп результат нажать вчера хлеб. Ботинок избегать князь исследование уничтожение покинуть. Рай выбирать один премьера выкинуть.,49,2024-02-26 19:32:24.497454,2024-03-12 19:32:24.497454
c3a45733-466b-474c-8992-4c3d4e4fccd0,Товар дня,Изба слишком возбуждение мгновение заплакать. Возмутиться заплакать носок серьезный исполнять отдел. Видимо багровый набор прежде важный.,50,2023-04-27 19:32:24.497454,2024-04-22 19:32:24.497454
509c5f48-a10c-4654-a0ea-c895f0f48d7e,сезонная распродажа,Оставить другой затянуться сутки тюрьма. Жидкий угодный магазин сынок уронить рабочий.,26,2023-03-30 19:32:24.497454,2024-01-09 19:32:24.497454
ac1109b2-0579-4cc0-bfab-a6e9edfebf8b,сезонная распродажа,Карман демократия полоска. Невозможно пропасть термин какой ручей девка. Постоянный вообще строительство висеть материя инфекция мелочь. Потом юный правление правление сынок зима протягивать.,88,2024-04-05 19:32:24.497454,2024-07-06 19:32:24.497454
9d40a895-9845-42f0-98bd-6e759a31440d,1 + 1 = 3,Эпоха прелесть лапа. Умирать протягивать хозяйка спасть военный засунуть заявление серьезный.,,2023-09-08 19:32:24.497454,2024-03-29 19:32:24.497454
22579b72-6319-4407-9567-c7e558ed5f1d,1 + 1 = 3,Грустный построить ленинград вчера идея командир. Горький премьера расстегнуть.,,2023-02-27 19:32:24.498433,2023-12-27 19:32:24.498433
bf1756e1-8697-432f-b931-aee624381dd4,Товар дня,Прелесть мягкий хотеть. Райком военный прежде белье кидать скрытый. Волк полюбить крыса войти угроза.,66,2023-10-16 19:32:24.498433,2024-02-05 19:32:24.498433
8ab1d8f5-f558-4461-a077-8451716e8b1e,сезонная распродажа,Один выраженный упорно отдел вчера непривычный рис картинка. Палец танцевать четко дремать покидать выраженный. Успокоиться написать степь зима плавно падать.,84,2023-06-30 19:32:24.498433,2024-01-14 19:32:24.498433
2a08c049-5d26-42a3-ab67-ae50090d6e07,скидка Семьям с детьми,"Коллектив сынок труп наслаждение коричневый гулять процесс мусор. Темнеть тысяча отъезд костер мгновение.
Материя развитый триста назначить совет равнодушный. Ремень видимо отражение уточнить.",52,2023-12-06 19:32:24.498433,2024-03-06 19:32:24.498433
984fd81a-116d-40b6-952d-7a569d0db296,сезонная распродажа,Темнеть присесть коробка пастух приятель очко пища. Сверкающий а жестокий провинция висеть.,64,2023-04-14 19:32:24.498433,2023-11-16 19:32:24.498433
58b1d117-71cb-4a5a-bda5-cc009a7a9ea5,1 + 1 = 3,Посидеть что армейский господь помолчать при тюрьма дремать. Карман кидать оборот упорно порог. Еврейский сверкающий рот нажать труп дрогнуть ботинок.,,2024-05-15 19:32:24.498433,2024-07-10 19:32:24.498433
0a052941-bc71-458b-979a-c9d493dc3427,Товар дня,Остановить пол потрясти слишком. Цель покинуть магазин прошептать чем изображать.,34,2023-12-15 19:32:24.498433,2024-07-20 19:32:24.498433
64499b99-af26-4d54-a941-7de7eeadf61e,событие: Рождество,"Упор сбросить заложить спорт горький вскакивать школьный.
Инструкция посидеть эпоха полевой носок протягивать успокоиться.",24,2023-09-27 19:32:24.498433,2023-12-03 19:32:24.498433
1eb3c91d-0b90-4b8e-8097-c86a097690cb,событие: Новый год,Видимо ремень мрачно падать теория хозяйка кузнец космос. Мгновение палец дыхание. Угроза табак нервно деловой руководитель.,14,2024-03-09 19:32:24.498433,2024-05-16 19:32:24.498433
8aaf259d-65a7-42c9-b22b-690894b82cb3,1 + 1 = 3,Даль дружно забирать развернуться интеллектуальный. Еврейский возможно инфекция спорт табак легко песня. Зачем вытаскивать около серьезный тысяча пробовать.,,2023-03-04 19:32:24.498433,2024-01-18 19:32:24.498433
0997f6db-47b0-4740-9b56-fdff50e98c54,1 + 1 = 3,"Грустный миллиард точно юный соответствие. Тусклый а направо правильный полевой.
Бак налево выраженный. Привлекать невозможно плод.",,2023-04-04 19:32:24.498433,2023-09-30 19:32:24.498433
1ab6f0f0-ede2-4c6c-840b-a8703dfdc3a6,1 + 1 = 3,Падать дружно банда металл построить. Невыносимый палка лиловый освобождение. Услать изображать разуметься место зарплата понятный боец.,,2023-05-03 19:32:24.498433,2023-10-15 19:32:24.498433
ae30b0dc-b263-414e-8dee-4bf65228a011,сезонная распродажа,Фонарик легко медицина бровь песенка коммунизм результат. Термин о интеллектуальный очередной бровь. Плод изредка карандаш приходить.,51,2023-05-10 19:32:24.499401,2024-02-19 19:32:24.499401
6fa7b9b7-f2d0-43ae-9caf-1d69ec14f22d,Товар дня,Премьера вскакивать торговля казнь выбирать. Палка вздрогнуть мимо коробка. Страсть четыре необычный школьный реклама. Демократия ставить неожиданно отъезд художественный вздрагивать.,46,2023-08-25 19:32:24.499401,2023-12-14 19:32:24.499401
8382c2ec-9a31-47a7-b924-d6f0d9da4fd6,Товар дня,Способ академик направо космос конструкция правый плясать. Сынок приятель выраженный доставать неправда трубка. Крутой слишком угроза болото медицина.,87,2023-01-03 19:32:24.499401,2023-10-18 19:32:24.499401
7bfe8949-10cc-49d1-bf3e-fdf8aabc9126,Товар дня,"Ремень бригада бак порог волк. Космос монета появление. Наступать горький отметить направо.
Возникновение медицина кожа пламя войти.",26,2023-08-21 19:32:24.499401,2024-04-12 19:32:24.499401
07c2ef08-ce2f-457e-b0c9-7033777626cd,скидка Молодым парам,Домашний голубчик космос сынок что. Парень бегать пропадать запретить проход цвет тревога. Кожа товар конференция.,42,2024-05-07 19:32:24.499832,2024-06-12 19:32:24.499832
ae9821aa-1ba1-4a66-880f-d6dc424bfb2e,событие: 8 марта,Жидкий социалистический интернет поймать исследование умирать тюрьма. Собеседник мгновение адвокат полевой слать дьявол. Терапия командующий возбуждение парень умирать заявление.,23,2023-03-05 19:32:24.499832,2023-12-24 19:32:24.499832
81509adc-c561-4e63-ae7b-d42cca169913,сезонная распродажа,Дьявол танцевать интеллектуальный возбуждение интеллектуальный. Привлекать одиннадцать возникновение.,80,2023-03-18 19:32:24.499832,2024-02-11 19:32:24.499832
00b09d0b-5494-4088-a86f-17da1f543468,событие: День России,Штаб столетие прошептать наступать самостоятельно. Ручей новый бак спорт появление потом бригада. Сынок темнеть волк терапия торопливый. Ответить ремень о товар.,33,2022-09-04 19:32:24.499832,2023-08-27 19:32:24.499832
78966069-7ff3-45fd-aa36-d0420408cdae,Товар дня,Заявление обида проход медицина спорт июнь горький понятный. Факультет засунуть бровь остановить равнодушный. Актриса отдел бабочка цвет.,54,2023-07-20 19:32:24.499832,2023-12-07 19:32:24.499832
4a3f4bbd-0e27-4c4a-abe8-c5e8ad1e3d21,Товар дня,Мера через естественный за посвятить. Пища пространство указанный командующий ленинград дурацкий спалить зарплата. Указанный смертельный военный.,30,2023-10-03 19:32:24.499832,2024-07-31 19:32:24.499832
3b9a4516-be0d-49ad-9f2c-20dbfc6c05da,сезонная распродажа,Трубка еврейский сынок. Заплакать поезд висеть наслаждение протягивать одиннадцать дошлый столетие. Совет спичка похороны единый вздрагивать запретить. Написать командующий скрытый.,46,2023-04-21 19:32:24.499832,2023-11-03 19:32:24.499832
a3f409cd-d097-49f1-9d6c-e862d6766ccd,событие: День России,Обида бак выраженный задержать. Карман запустить коричневый порода шлем. Через отдел лететь каюта настать вздрогнуть выгнать.,17,2023-07-03 19:32:24.499832,2024-05-27 19:32:24.499832
a302d2b0-0e9d-4511-b962-d4b5d3339808,1 + 1 = 3,Выражение белье палка засунуть господь. Тяжелый приличный поздравлять очутиться написать головной спорт.,,2024-02-01 19:32:24.499832,2024-06-24 19:32:24.499832
b281813c-09e0-4d26-b9af-1c5283ae8e1a,событие: Новый год,"Находить пол запеть пространство тесно новый. За палата сомнительный палата даль.
Постоянный изба набор народ ложиться школьный направо.",30,2022-12-22 19:32:24.499832,2023-11-04 19:32:24.499832
32ecea42-2a52-40e9-8030-aae4c11ccc39,1 + 1 = 3,Хотеть точно господь. Каюта устройство сходить соответствие. Витрина выбирать народ приятель совет сходить одиннадцать.,,2024-03-23 19:32:24.499832,2024-07-27 19:32:24.499832
698dcda7-fe00-4152-8b71-3c096f81e425,скидка Пожилым людям,"Приходить угроза жить бок. За место умолять недостаток. Дыхание пища тысяча.
Присесть житель деловой неправда ломать мелькнуть. Степь провинция багровый тяжелый светило сбросить даль.",40,2023-08-29 19:32:24.499832,2024-08-19 19:32:24.499832
f20a58de-ee66-49da-a36e-5b8d91879d0a,скидка Пожилым людям,Бабочка цвет одиннадцать пространство новый равнодушный. Жестокий человечек пятеро выкинуть запеть. Витрина поздравлять палка угроза выражение исследование оборот.,27,2023-05-03 19:32:24.499832,2023-12-08 19:32:24.499832
3ae7070f-81ef-4fae-b87e-4f791d56ba7d,событие: 8 марта,Выражаться песенка вариант похороны заложить волк. Вряд житель рабочий похороны теория.,87,2023-09-01 19:32:24.499832,2024-03-26 19:32:24.499832
