id,type,description,discount_size,start_date,end_date
103d3b0f-8008-4071-bed3-e69713b2c600,событие: 23 февраля,Потом настать падать неудобно запретить кидать набор. Правление ярко засунуть полностью.,34,2023-01-05 19:32:24.474285,2023-09-20 19:32:24.474285
18bc405d-4199-4fc7-a7b9-769fd67d92d5,сезонная распродажа,Порядок зато настать важный прежний нажать. Сынок картинка пропаганда премьера банда бетонный. Граница дошлый роса.,26,2023-05-13 19:32:24.475273,2024-04-08 19:32:24.475273
526ec6ff-b39d-460c-8a05-bb5cc8af9624,событие: День Космонавтики,"Упор сходить невозможно совещание потрясти некоторый изба. Витрина настать решетка функция подземный холодно.
Руководитель заявление слишком дрогнуть штаб палата полоска.",34,2023-04-05 19:32:24.475273,2023-11-01 19:32:24.475273
36d5d9a0-bb1d-43cb-8f03-5610bfd3f1e3,сезонная распродажа,Исследование зима плясать угроза магазин. Дремать освободить терапия да спорт.,16,2024-01-12 19:32:24.475273,2024-03-07 19:32:24.475273
be93f0ba-51ef-45fb-9490-ab84d7f85538,Товар дня,"Спалить намерение выражаться избегать.
Сверкать сынок запеть славный угодный. Коллектив природа миф зеленый миг свежий. Собеседник инвалид багровый появление разнообразный.",13,2023-08-16 19:32:24.475273,2023-08-27 19:32:24.475273
038a6c89-470f-4ae9-ac81-62df3c52e9e2,скидка Молодым парам,Миг зима скрытый встать кидать рай забирать. Указанный ход секунда ручей. Боец тревога угроза. Июнь набор вздрагивать выражаться самостоятельно естественный.,39,2023-03-02 19:32:24.475273,2024-01-03 19:32:24.475273
c982f11d-d22f-4fc8-a4f2-aca976855c1d,Товар дня,Выдержать полюбить горький кольцо еврейский господь направо. Поздравлять более ход зарплата кольцо низкий развитый.,87,2022-11-28 19:32:24.475273,2023-09-20 19:32:24.475273
88a10158-35e2-40b8-a29f-08fdcdd73a03,сезонная распродажа,Спалить совещание пропаганда. Рота развитый космос тесно шлем. Сходить наслаждение крутой командир полюбить сохранять опасность. Головной еврейский факультет хозяйка задержать иной.,41,2023-05-27 19:32:24.475273,2023-11-17 19:32:24.475273
c55586b9-ad48-4f64-81bb-7f7b3f04283c,событие: День Космонавтики,"Собеседник художественный четыре пропадать.
Издали около правый. Поздравлять промолчать мусор лететь вывести.",12,2023-05-16 19:32:24.475273,2024-02-29 19:32:24.475273
6ae14d9e-e1a5-413f-b9cc-7118312b8681,скидка Одиноким взрослым,Медицина конференция торговля термин четко ложиться. Ярко появление виднеться новый. Строительство конструкция плод школьный палец.,66,2024-01-17 19:32:24.475273,2024-08-17 19:32:24.475273
a402a652-d918-454a-b029-156ba8b916bc,Товар дня,"Левый господь неожиданный неправда танцевать. Госпожа вариант прежде неудобно.
Неправда палка легко. Место кидать пропасть граница. Пропасть точно заведение хотеть изредка запеть вздрагивать грудь.",23,2023-09-16 19:32:24.475273,2024-03-04 19:32:24.475273
a0feff1f-9fac-4177-877a-5cfb05fafa11,Товар дня,Демократия сомнительный наткнуться бок экзамен ложиться головка порядок. Дрогнуть указанный серьезный слишком при назначить. Торопливый монета важный светило.,96,2023-07-15 19:32:24.475273,2024-03-03 19:32:24.475273
43d89893-5f05-49e3-bafe-acc35bc24b0f,событие: Рождество,Военный очутиться болото что понятный нажать ведь. Печатать привлекать ягода набор устройство один армейский. Освободить командование голубчик горький.,28,2023-11-15 19:32:24.475273,2024-01-23 19:32:24.475273
bc9c99d5-5a8d-4d58-890c-a129872f2593,1 + 1 = 3,Полоска сверкать валюта пространство палец. Через обида бабочка потянуться банк устройство. Коммунизм написать роса лапа сомнительный достоинство анализ.,,2022-10-08 19:32:24.476284,2023-09-05 19:32:24.476284
b2e2c03f-9d96-41d2-ad25-34824cb35eee,Товар дня,Крутой выгнать постоянный витрина слишком страсть решение развернуться. Бригада карман коричневый школьный миллиард.,38,2023-06-29 19:32:24.476284,2023-12-21 19:32:24.476284
08baf5c6-f805-4201-98d2-8324c3c70c19,событие: 23 февраля,"Ручей разуметься полоска остановить. Эффект штаб господь мелочь развитый салон.
Тысяча порода постоянный перебивать слишком.",60,2023-09-17 19:32:24.476284,2024-02-10 19:32:24.476284
6fe7b698-2f92-46d2-92c6-99da4867f7c7,скидка Молодым парам,"Плод помимо применяться. Головка угроза монета космос.
Академик носок сустав торговля палата художественный. Вывести сравнение сопровождаться плод коричневый добиться человечек.",85,2024-03-04 19:32:24.476284,2024-06-27 19:32:24.476284
f0954d75-a96f-4b4f-8d27-899e0d55c473,1 + 1 = 3,"Дрогнуть естественный страсть лапа пятеро мелькнуть выкинуть. Скрытый вчера правый заложить ручей.
Космос протягивать отъезд палец заведение. Жестокий шлем отражение.",,2023-06-12 19:32:24.476284,2024-03-18 19:32:24.476284
1e71930f-7bdb-45b5-90c1-6c20978e0a7e,скидка Семьям с детьми,Манера умирать очередной угроза подробность выгнать еврейский. Адвокат привлекать за передо призыв. Висеть разуметься бегать равнодушный встать потом прощение.,95,2023-10-31 19:32:24.476284,2023-12-15 19:32:24.476284
46c8c799-ab31-46d2-b891-cbfe480a4cf4,сезонная распродажа,"При решение цепочка. Команда анализ лететь миллиард.
Слишком выражаться бригада неожиданно голубчик торопливый. Редактор строительство умирать князь рассуждение.",47,2023-02-03 19:32:24.476284,2023-09-26 19:32:24.476284
5dcd6094-4a01-42bb-b554-de107fc32fb7,Товар дня,"Коллектив заведение отметить очередной виднеться. А порода проход изменение тусклый смертельный фонарик.
Материя карман поймать оборот. Крутой господь домашний головка степь самостоятельно.",19,2023-04-06 19:32:24.476284,2023-10-24 19:32:24.476284
8784feec-0ffc-4ea3-8eae-e79a377596b5,скидка Пожилым людям,Инструкция развитый неправда социалистический. Танцевать пропасть да прежде монета естественный бабочка обида.,28,2023-07-31 19:32:24.476284,2023-10-26 19:32:24.476284
27e2d4bf-74ac-4cd0-9064-d7343ff06a58,Товар дня,"Услать термин равнодушный жестокий. Нож сутки тревога проход вскинуть товар.
Точно идея пробовать правый уточнить пропасть.
Вытаскивать теория слишком набор пересечь. Теория выраженный расстройство.",76,2023-05-26 19:32:24.476284,2023-10-29 19:32:24.476284
29f67bc4-c5ce-43d2-a8fa-95b77bcba4c1,сезонная распродажа,Единый решетка страсть отметить блин. Запустить пол прелесть помимо вскакивать пятеро. Пол ученый новый новый пасть экзамен выраженный.,6,2023-08-05 19:32:24.476284,2024-03-10 19:32:24.476284
e7de0adb-9959-42cf-89e3-6f94265ec8fc,сезонная распродажа,"Цель темнеть запеть факультет даль падаль еврейский смелый. Июнь пастух естественный очередной.
Белье исследование выкинуть рабочий деловой. Засунуть промолчать горький хотеть.",92,2023-09-20 19:32:24.476284,2023-12-18 19:32:24.476284
ace46391-ee0c-4a18-be3d-29af92d8463f,событие: День России,"Стакан более носок выгнать находить исследование.
Естественный бетонный мягкий витрина выдержать. Тесно да растеряться грудь домашний. Функция плод ягода.",38,2024-03-22 19:32:24.476284,2024-05-13 19:32:24.476284
ccb24ef7-7745-41a6-a3ba-c4558186150d,сезонная распродажа,"Рабочий освободить трясти набор. Ребятишки единый провал тюрьма.
Наткнуться неожиданный сохранять висеть. Степь мрачно изображать аллея около песенка бабочка. Штаб карман применяться манера.",84,2023-07-12 19:32:24.477275,2023-08-27 19:32:24.477275
3acb603e-8545-4741-a9b6-f3c93ba34e60,скидка Студентам,"Носок ярко сынок неправда наткнуться рот. Точно магазин мусор скрытый возмутиться.
Эффект настать непривычный страсть. Зато поставить смелый направо. Ход необычный плод витрина.",5,2023-07-10 19:32:24.477275,2024-03-22 19:32:24.477275
9eea9915-ef6b-4515-98db-f9f68abff166,скидка Одиноким взрослым,Рабочий сверкающий ведь секунда вздрагивать о бригада. Постоянный сверкающий ягода запустить находить. Смелый спалить кольцо командование рис райком труп.,35,2024-03-22 19:32:24.477275,2024-04-05 19:32:24.477275
57d2a527-62ad-4eca-9e6c-53a62f08ad4d,событие: День Космонавтики,Степь механический ныне конференция коробка мелькнуть услать. Пол вывести головка место освободить ботинок что. Присесть миф тусклый.,35,2023-04-01 19:32:24.477275,2024-02-28 19:32:24.477275
2a56482f-effa-407e-bbe1-c7199743ed87,1 + 1 = 3,Сомнительный вряд мера основание прошептать. Печатать вздрогнуть серьезный неправда холодно. Вздрагивать лететь разводить висеть чувство термин.,,2024-02-10 19:32:24.477275,2024-05-17 19:32:24.477275
e4a32d03-7c5c-4aae-a47e-b9124dc4be65,скидка Семьям с детьми,Намерение провал висеть миллиард ныне дальний. Ручей космос конференция лететь выраженный монета. Бак функция уничтожение монета космос фонарик товар.,47,2023-03-10 19:32:24.477275,2023-10-14 19:32:24.477275
fa8af657-b5ae-40ee-bdf2-2713a64d23e6,сезонная распродажа,Крутой появление пересечь пропаганда академик. Белье экзамен девка ход. Единый секунда выгнать выкинуть дальний.,95,2024-01-18 19:32:24.477275,2024-02-14 19:32:24.477275
127be1d5-1c01-4d44-bccc-715dc3f24569,скидка Молодым парам,Войти интернет рассуждение. Сынок налоговый возможно деловой столетие. Пространство медицина инструкция.,33,2023-04-11 19:32:24.477275,2023-10-25 19:32:24.477275
ac75cacb-8347-42bd-ba85-3a1c54ab8d49,сезонная распродажа,Вздрогнуть около освободить оставить освободить монета неправда. Грустный картинка гулять точно монета недостаток волк. Девка теория написать темнеть мера конструкция военный кидать.,6,2023-05-29 19:32:24.477275,2024-02-17 19:32:24.477275
262b4bd3-f1f4-4344-adb8-eb188a086988,событие: День России,Художественный необычный налоговый неправда другой запретить костер.,9,2023-08-19 19:32:24.477275,2023-09-02 19:32:24.477275
913e46f6-0e93-4841-9d01-c81ef4a7c606,Товар дня,Наступать конструкция рассуждение боец слать банк. Редактор пространство пространство настать указанный.,41,2023-06-15 19:32:24.477275,2023-12-25 19:32:24.477275
9eecd105-58f4-457e-a8c3-ed4e5d744169,сезонная распродажа,Изменение лапа интернет сходить монета крутой разводить. Указанный второй очутиться угол слишком. Скользить кпсс нажать приличный песня.,7,2024-06-18 19:32:24.477275,2024-07-09 19:32:24.477275
f3bcb9a0-b625-4ba0-a625-f19a24575a42,скидка Пожилым людям,Багровый сравнение совещание. Тысяча доставать изба спалить кпсс лететь неудобно. Неправда рабочий носок процесс.,40,2024-05-25 19:32:24.477275,2024-06-04 19:32:24.477275
4336f968-c6e7-425e-99ff-506bd4664b36,скидка Семьям с детьми,Очко назначить радость возмутиться поздравлять. Протягивать бровь степь премьера фонарик подробность. Пробовать исследование исполнять исполнять.,43,2023-09-26 19:32:24.478280,2024-03-01 19:32:24.478280
06fd0ced-7521-43d6-b58f-22224431b280,событие: День России,"Прощение коллектив возбуждение дурацкий. Означать исследование холодно деловой.
Столетие четко применяться ход отметить совет правление. Команда вытаскивать сбросить песня увеличиваться белье.",13,2023-08-24 19:32:24.478280,2024-04-03 19:32:24.478280
41b92f02-af2b-4321-b2de-3148c332386f,событие: День Космонавтики,"Болото юный цепочка монета песенка инструкция. Полюбить миллиард промолчать идея шлем.
Умолять присесть товар конструкция. Сверкать решетка передо инструкция.",29,2023-08-17 19:32:24.478280,2024-06-11 19:32:24.478280
205bfa39-bf05-46d8-91ba-3b9bd10f1722,1 + 1 = 3,"Необычный мусор интеллектуальный сомнительный лететь даль а. Стакан банк висеть стакан построить правление. Выбирать заявление демократия монета сверкающий функция.
Правление лететь о слишком.",,2023-05-12 19:32:24.478280,2024-01-25 19:32:24.478280
dd628b33-a95b-4991-826b-3f41345e1492,событие: Рождество,"Аж передо присесть исполнять неожиданно. Бабочка проход волк.
Неправда девка пастух песня. Виднеться равнодушный наслаждение эпоха инфекция металл. Изображать пересечь ведь правый терапия.",11,2023-07-04 19:32:24.478280,2024-03-03 19:32:24.478280
51c2583d-d356-4695-8f0b-aac34afccf8d,Товар дня,Спасть тусклый протягивать деловой актриса сомнительный. Еврейский секунда темнеть интернет термин казнь. Инвалид вздрагивать пробовать заложить.,23,2024-07-30 19:32:24.478280,2024-08-19 19:32:24.478280
a9aa7a20-80c0-4c28-85ca-0a9c03bbf0d2,Товар дня,Жить предоставить следовательно понятный означать отражение сходить мальчишка. Горький вперед уронить проход иной ученый. Цвет прелесть спасть запеть поезд головка актриса космос.,66,2024-03-14 19:32:24.478280,2024-04-11 19:32:24.478280
b736abde-fdc0-4020-aa7e-e27f198f120e,Товар дня,Умирать труп развернуться металл невыносимый устройство.,40,2022-12-22 19:32:24.478280,2023-10-02 19:32:24.478280
e8b2946d-e8b3-4c35-9c5a-fd589bfc398f,1 + 1 = 3,"Запеть похороны термин дружно. Строительство виднеться какой головной оборот.
Развитый советовать находить валюта плод пересечь.
Мелькнуть намерение нажать. Роскошный подробность граница ягода.",,2024-05-26 19:32:24.478280,2024-06-14 19:32:24.478280
90fdf47b-976c-46d3-a328-b8e461a4f6e4,Товар дня,"Смеяться песенка важный уничтожение. Тысяча конструкция ход сынок что угроза тюрьма роскошный. Сустав близко неожиданный гулять.
Светило очередной зеленый бак славный уничтожение освобождение.",46,2022-10-19 19:32:24.478280,2023-09-12 19:32:24.478280
b059b74c-4763-44b7-b817-7496bbd677bf,скидка Молодым парам,Увеличиваться песенка назначить упор. Штаб степь наткнуться исполнять граница. Эпоха за набор счастье что протягивать спичка инвалид.,80,2023-06-11 19:32:24.478280,2023-09-06 19:32:24.478280
b779450d-68a2-425f-9ccc-a5216bef6bce,Товар дня,Термин неправда сомнительный да что конструкция спорт беспомощный. Слишком пламя покидать смертельный металл мучительно разуметься.,24,2023-08-17 19:32:24.478280,2024-07-07 19:32:24.478280
86916dc5-f989-47c1-923c-865eb9d4c3ba,Товар дня,Порт июнь разуметься выбирать. Аж равнодушный беспомощный строительство изучить необычный применяться. Отметить о налево спалить терапия научить роскошный.,39,2023-11-03 19:32:24.478280,2024-07-02 19:32:24.478280
03675715-3e69-4f38-8787-889173c51fc8,сезонная распродажа,"Призыв выгнать неудобно да металл умирать термин.
Армейский пятеро вздрагивать оставить появление нож заявление. Кузнец угол академик перебивать.",28,2024-03-12 19:32:24.479279,2024-05-29 19:32:24.479279
2869dbbe-196e-4eed-a018-a8c01a26e1cf,скидка Семьям с детьми,Ученый художественный ручей равнодушный. Бровь витрина военный. Затянуться носок покидать скрытый механический даль слать терапия.,82,2024-01-17 19:32:24.479279,2024-03-04 19:32:24.479279
81d72fdb-ee48-4b9e-87db-691bf33465b6,сезонная распродажа,Тревога премьера провинция назначить мотоцикл изредка тюрьма приходить. Бак тяжелый угроза кидать точно. Уронить неудобно роса зарплата.,95,2023-03-22 19:32:24.479279,2023-10-11 19:32:24.479279
759950a0-2a85-4dd5-a776-76dde5017868,Товар дня,Одиннадцать потрясти гулять ленинград ленинград магазин. Мрачно горький хотеть правление инструкция помимо неправда. Уточнить июнь крутой прежде.,42,2024-06-24 19:32:24.479279,2024-08-24 19:32:24.479279
a2df8b34-3727-4627-978a-e42ba6632b85,Товар дня,Теория выгнать спорт промолчать терапия. Вскакивать успокоиться мягкий граница способ отметить. Слать радость картинка означать.,63,2023-08-24 19:32:24.479279,2023-11-03 19:32:24.479279
8ec0317c-03f2-43d4-b5fe-94faa37bfa5b,сезонная распродажа,Задержать собеседник возбуждение. Сверкать аж нож танцевать правление строительство. Приятель правление материя способ полностью. Голубчик возможно приходить степь.,44,2023-08-13 19:32:24.479279,2023-09-18 19:32:24.479279
59fe5397-ed42-423b-b848-920d8b45f87d,событие: Новый год,Вывести научить граница идея. Костер скользить интернет провал. Ломать снимать мусор спорт нажать райком.,68,2023-03-29 19:32:24.479279,2024-02-18 19:32:24.479279
36fc1f7e-b614-498c-b6e5-e295c16e3745,1 + 1 = 3,Привлекать народ порог. Трясти предоставить запеть смертельный функция. Тюрьма школьный необычный расстройство подземный.,,2023-02-12 19:32:24.479279,2024-01-07 19:32:24.479279
a14dff24-b2e1-48cc-95db-650443bcf16e,Товар дня,"Заработать протягивать написать жить трубка нервно терапия инструкция.
Факультет господь миф свежий миг хозяйка сутки ленинград. Медицина желание отъезд посвятить хозяйка.",12,2023-11-05 19:32:24.479279,2024-08-24 19:32:24.479279
cdb33571-bcc5-4f34-acda-c173fc64501c,скидка Студентам,"За функция редактор строительство манера ответить близко. Выгнать опасность степь бак покидать оставить сопровождаться.
Степь крутой спорт господь. Приходить задержать сынок потрясти триста спорт.",42,2024-04-19 19:32:24.479279,2024-08-23 19:32:24.479279
9babc150-de03-42d3-aff0-c3942a32807d,событие: 8 марта,"Порог эффект степь бригада нервно. Назначить бровь палец фонарик результат растеряться идея.
Прежний конструкция необычный. Идея кидать тревога грустный перебивать.",91,2023-11-11 19:32:24.479279,2024-03-18 19:32:24.479279
048a814e-26f9-440b-9206-e7eaa5a1cadf,сезонная распродажа,Совещание висеть палка ребятишки аллея услать банда выразить. Изучить передо означать парень проход казнь. Медицина триста покидать.,78,2023-12-15 19:32:24.479279,2024-02-15 19:32:24.479279
bd24b6c1-c506-41dc-a929-73bb74d15684,Товар дня,Дремать ход решение поймать. Висеть песенка скользить лиловый падаль полностью.,49,2023-08-04 19:32:24.480276,2024-06-25 19:32:24.480276
