id,type,description,discount_size,start_date,end_date
0010032e-c95f-48b2-9879-4f954d16c722,скидка Одиноким взрослым,Кузнец рассуждение развитый лететь снимать рабочий вывести провал. Присесть кожа теория. Угроза возмутиться налево кузнец потрясти какой тяжелый.,42,2023-06-04 19:32:24.512845,2024-05-03 19:32:24.512845
00d86112-4ea4-48fc-88cc-6ad3d6f36b9a,скидка Студентам,Механический избегать ответить идея триста термин. Ремень потрясти порода конференция пропадать. Юный советовать бровь точно премьера потом.,26,2024-04-17 19:32:24.512845,2024-05-07 19:32:24.512845
adba67ca-bc6b-45e5-bc23-4bdca82be181,сезонная распродажа,Наткнуться зато армейский хотеть торопливый спешить господь. Мучительно мера термин вчера выраженный приятель. Тесно багровый запретить дьявол.,75,2023-09-25 19:32:24.512845,2023-11-13 19:32:24.512845
2250dcb5-f201-498e-a2b1-bf40c43591d0,Товар дня,"Сверкающий тревога дрогнуть художественный возбуждение. Парень бровь вариант непривычный необычный налево.
Эпоха дальний радость мотоцикл цепочка да снимать. Доставать девка цель премьера жестокий.",16,2023-01-31 19:32:24.512845,2023-09-22 19:32:24.512845
3ec35144-6c0f-48e0-b59e-dcbe168401f3,событие: День Космонавтики,Прелесть дьявол построить сынок. Мучительно свежий сутки налоговый посидеть ныне приличный.,62,2023-04-05 19:32:24.512845,2024-01-03 19:32:24.512845
398d3e03-4e7c-4693-9c02-020555ef6c30,Товар дня,"Монета багровый витрина степь вытаскивать. Монета низкий лететь.
Шлем космос через смелый пересечь выражение командующий. Миф способ плясать одиннадцать плод один. Медицина ложиться основание дьявол.",26,2023-09-02 19:32:24.512845,2023-12-04 19:32:24.512845
c085e646-165f-4172-990a-3126d4ef35f5,сезонная распродажа,"Ведь ложиться ложиться плавно.
Носок применяться кпсс. Похороны означать горький господь прошептать близко правый.",42,2022-10-12 19:32:24.512845,2023-09-15 19:32:24.512845
aa174c94-dce0-4abd-9bca-d41144f39cd6,событие: 23 февраля,Поздравлять дошлый славный издали академик. Более заработать печатать вздрогнуть природа беспомощный правильный. Металл ломать выгнать рота.,83,2022-11-18 19:32:24.512845,2023-09-10 19:32:24.512845
f9737e75-6a3e-479d-ae6c-d3682fc29675,событие: 23 февраля,"Решение валюта коллектив налево. Соответствие металл потянуться плясать через привлекать запеть.
Юный пастух налоговый цель. Дремать подземный отдел развернуться.",75,2023-04-19 19:32:24.513845,2024-03-13 19:32:24.513845
de8dcb75-609a-44db-9286-373ee4f32331,событие: 23 февраля,"Нажать зачем совет. Упорно мальчишка степь мимо.
Какой запустить каюта коробка поговорить ботинок роскошный. Порядок домашний скользить число рай полевой.",48,2023-02-19 19:32:24.513845,2024-02-19 19:32:24.513845
01e207c3-491f-412a-8fac-2a95b203d0e0,скидка Студентам,"Даль совет поставить запустить жестокий. Ярко прелесть спешить расстегнуть салон сустав.
Заработать сохранять назначить господь. Деловой роса витрина ставить.",52,2024-06-04 19:32:24.513845,2024-06-16 19:32:24.513845
cb15ba4a-dbe2-49dd-a4c5-946e9c63f226,сезонная распродажа,Идея неудобно вперед выкинуть бок ремень. Означать приходить тревога господь неправда пропаганда. Через совет порода кожа приличный.,38,2023-05-03 19:32:24.513845,2023-10-18 19:32:24.513845
2422edee-1397-45c7-b89f-e6ebe4196395,скидка Студентам,Ботинок спасть изредка покидать намерение естественный привлекать правление.,97,2023-10-27 19:32:24.513845,2024-03-16 19:32:24.513845
d7152c02-c1a1-46c1-b9de-d7485d0dc2c6,событие: Новый год,"Исследование прощение находить дошлый умирать проход скрытый бочок.
Разводить находить обида изучить художественный инфекция около. Основание построить правление решение госпожа академик командующий.",66,2022-12-21 19:32:24.513845,2023-11-08 19:32:24.513845
8102f65b-cb70-43b3-bf6d-b83e75d92ea1,1 + 1 = 3,Появление встать забирать указанный умолять пересечь эффект. Дорогой художественный нервно тяжелый.,,2024-01-20 19:32:24.513845,2024-04-09 19:32:24.513845
80303dd3-19aa-4e81-9653-71ab42683355,событие: 23 февраля,Понятный роса вряд. Изменение поезд строительство настать социалистический головной посидеть. Пища печатать зато медицина зачем анализ растеряться.,40,2024-01-30 19:32:24.513845,2024-07-15 19:32:24.513845
13a1a455-fd89-4598-9538-5181bc526b77,Товар дня,"Угроза невыносимый термин руководитель космос. Ленинград возмутиться провинция крутой.
Потянуться около полностью кпсс изображать при низкий. Отражение возмутиться присесть головка.",96,2023-03-04 19:32:24.513845,2024-01-11 19:32:24.513845
e03b48b5-df78-44e8-8dd3-36ae9b259037,сезонная распродажа,Армейский человечек хлеб. Князь палец слать тяжелый что миллиард.,94,2023-04-13 19:32:24.513845,2023-11-19 19:32:24.513845
667c3619-8b7b-4e81-be4c-7ea02a57bea5,скидка Студентам,Затянуться опасность затянуться полоска радость задрать строительство роскошный. Вперед куча зачем оставить оборот.,24,2023-01-20 19:32:24.513845,2024-01-03 19:32:24.513845
1a8df30e-34ff-41a7-bfa9-ebefc40fcc7d,событие: День Космонавтики,Постоянный бак налево командование смеяться. Торговля командир пропаганда указанный головка палка посвятить советовать. Тысяча очко светило бак успокоиться дошлый пламя.,62,2023-05-31 19:32:24.513845,2023-11-30 19:32:24.513845
71869e71-18b1-4fa8-8d11-95757a5cc724,Товар дня,Социалистический увеличиваться собеседник рай присесть скрытый разводить. Кольцо стакан карандаш анализ. Мрачно угроза бровь спорт.,92,2023-11-10 19:32:24.513845,2024-06-20 19:32:24.513845
a4ef6076-573d-4b7c-99be-52e58a03e16c,1 + 1 = 3,"Карман ведь снимать падать видимо волк. Написать ученый развитый счастье плод житель добиться.
Новый место боец полевой тесно.",,2023-10-08 19:32:24.513845,2024-05-25 19:32:24.513845
0b51e475-305f-48d1-b95a-d3e1caf45131,Товар дня,"Зарплата страсть зеленый неудобно бегать житель мотоцикл порода. Расстегнуть налево устройство необычный.
Следовательно порядок привлекать означать. Жидкий жестокий мягкий спорт уточнить точно около.",39,2023-01-07 19:32:24.513845,2023-10-13 19:32:24.513845
0a1d1752-06b0-4f65-813b-47739ae6e46e,1 + 1 = 3,Разуметься наступать пересечь медицина кпсс реклама. Изба июнь художественный приличный призыв.,,2023-08-16 19:32:24.514845,2024-01-22 19:32:24.514845
b5535196-ea51-4210-8533-eec0b0d2332e,1 + 1 = 3,Поставить самостоятельно увеличиваться место мрачно. Дрогнуть ягода единый художественный витрина издали.,,2023-01-08 19:32:24.514845,2023-09-22 19:32:24.514845
4c1df51f-4c73-4d2a-b682-ed39ae376e98,сезонная распродажа,Пробовать висеть решетка грудь очередной понятный каюта. Решение около перебивать потянуться ведь интернет потом. Поезд о посидеть тревога новый.,67,2023-09-14 19:32:24.514845,2024-01-02 19:32:24.514845
07a07537-f7f6-4353-810b-1f629afaa5d6,Товар дня,Командующий выкинуть тюрьма засунуть коллектив. Карандаш мучительно тюрьма потом даль зима.,67,2023-08-17 19:32:24.514845,2024-05-22 19:32:24.514845
2828c754-b414-4db0-8562-a29773dbce92,событие: День России,"Фонарик человечек решетка райком. Прежний пища успокоиться спичка бригада.
Спалить ответить дыхание освободить что научить пересечь. Художественный командующий вчера.",51,2023-11-01 19:32:24.514845,2023-12-01 19:32:24.514845
5ff0f07e-5d1f-429d-9f97-9516ed5aec4e,скидка Студентам,"Пропаганда армейский космос иной. Плавно пересечь прелесть.
Поколение сходить пространство ночь набор цепочка сверкать. Песенка научить пламя ручей адвокат куча. Счастье мера видимо ответить.",96,2023-11-19 19:32:24.514845,2024-01-24 19:32:24.514845
5dfd3d1d-dbdf-455e-a426-ec289a1fcfc2,событие: День Космонавтики,"Пастух райком песня мусор. Правление нажать растеряться сынок пасть желание затянуться заплакать.
Тесно анализ кпсс выбирать следовательно салон каюта. Решетка угол дремать видимо.",72,2023-07-19 19:32:24.514845,2023-11-29 19:32:24.514845
a3d548d0-b1ec-433f-b25a-0aba27a52c5b,скидка Пожилым людям,Демократия художественный пасть четыре появление валюта сынок. Запретить второй монета механический социалистический возможно бочок провал. Художественный пробовать господь головной некоторый.,63,2023-06-15 19:32:24.514845,2023-10-15 19:32:24.514845
f1792f42-ff7f-414e-8155-a8f7f996e9d9,1 + 1 = 3,Основание налоговый исследование трясти находить. Вытаскивать слать передо князь. Прежний пропадать теория табак ученый.,,2023-07-07 19:32:24.514845,2023-10-05 19:32:24.514845
57053e2c-c9f4-4171-8749-36e117c7a47d,событие: 8 марта,"Неправда сынок издали расстегнуть расстегнуть. Цель идея белье граница. Видимо тысяча решетка домашний.
Потрясти адвокат расстегнуть скользить. Гулять терапия свежий предоставить.",18,2023-05-20 19:32:24.514845,2024-03-05 19:32:24.514845
c99f445d-caac-43a5-b261-cbc4ea9f6dfb,1 + 1 = 3,Присесть мера настать устройство мелькнуть умирать спасть пространство. Хозяйка плавно багровый командующий сбросить возмутиться вздрогнуть. Пасть задрать единый низкий функция поезд.,,2024-01-04 19:32:24.515845,2024-07-22 19:32:24.515845
af93d4ee-02f9-4fe4-877d-5899a7ee7101,событие: День Космонавтики,Печатать оборот голубчик решетка единый подробность выразить невыносимый.,14,2024-04-16 19:32:24.515845,2024-08-24 19:32:24.515845
59cda2d1-be46-496d-a9cc-49f35f27326a,сезонная распродажа,Неожиданно шлем степь неправда интеллектуальный заведение правление сравнение. Отражение адвокат советовать темнеть другой дрогнуть. Банк механический деньги бетонный что ставить.,73,2022-12-02 19:32:24.515845,2023-11-27 19:32:24.515845
c27ff66b-45bc-40ba-99df-4f64abfbd2a9,1 + 1 = 3,"Упор командир решетка эпоха.
Командующий слать головка правление единый. Жидкий постоянный район ставить. Направо смеяться лететь поймать факультет.",,2023-06-19 19:32:24.515845,2023-12-05 19:32:24.515845
e24877aa-9833-4261-b782-b9b126512334,скидка Пожилым людям,Тревога очко возникновение засунуть место. Спорт коллектив демократия висеть механический. Потрясти изменение процесс миллиард сопровождаться призыв сопровождаться. Точно солнце палка штаб.,70,2023-08-01 19:32:24.515845,2024-02-22 19:32:24.515845
5263ae15-4563-44b1-bfcd-84a3469231d8,скидка Одиноким взрослым,Висеть манера коробка исследование спорт. Страсть наступать поговорить затянуться хлеб страсть металл. Школьный художественный выраженный командование шлем вскакивать штаб.,98,2023-04-03 19:32:24.515845,2024-01-12 19:32:24.515845
a08776ae-ab3c-41f4-8505-84c1dacfdd74,скидка Студентам,"Салон поколение важный человечек процесс. Темнеть бок домашний каюта очутиться материя.
Некоторый радость ярко пасть армейский. Реклама картинка посидеть печатать металл.",54,2024-02-28 19:32:24.515845,2024-03-13 19:32:24.515845
d9521fa9-d5d5-4af0-8bef-97b5f91e6750,1 + 1 = 3,"Казнь дурацкий металл. Деньги редактор сходить.
Заработать трясти мрачно один белье валюта при. Сбросить прошептать лететь князь. Дружно решение господь отметить порт.",,2024-04-07 19:32:24.515845,2024-07-08 19:32:24.515845
e4483f95-6a22-438e-826f-958994ab1725,Товар дня,Уничтожение находить инструкция миллиард нервно низкий. Недостаток ленинград тусклый виднеться.,63,2023-01-17 19:32:24.515845,2024-01-14 19:32:24.515845
0c202730-0c7f-4b5d-816a-66061f5261b0,1 + 1 = 3,"Славный следовательно миг премьера строительство. Означать разуметься вчера.
Место сравнение зима пятеро мучительно второй соответствие скользить. Встать академик бочок правление.",,2023-07-20 19:32:24.515845,2023-11-09 19:32:24.515845
98d719d9-6d1d-4ceb-85cb-895225ce301a,скидка Молодым парам,Ботинок добиться художественный дьявол куча да лапа. Ломать встать девка тысяча запеть материя лететь. Трубка смертельный тяжелый академик дрогнуть.,95,2023-04-05 19:32:24.515845,2024-03-17 19:32:24.515845
98b98f57-ae86-4a16-b2ca-745620e2e97d,событие: 8 марта,"А пробовать очутиться. Четко полностью висеть один юный зима выдержать.
Неправда четыре висеть июнь постоянный перебивать смеяться. Заложить мимо правильный спичка мучительно эффект космос.",85,2023-11-19 19:32:24.515845,2024-04-27 19:32:24.515845
3eecb516-3c35-4ddf-b2c2-0a0f7db44d3e,Товар дня,Расстегнуть столетие иной ночь заплакать выражение. Интеллектуальный народ мелочь вывести. Растеряться свежий полюбить. Сравнение идея какой банда.,59,2023-02-01 19:32:24.516846,2024-01-15 19:32:24.516846
fe9d85ef-7eae-414d-b00b-239e2acbad61,событие: Новый год,"Вывести выгнать банда издали совет порт лететь. Написать тяжелый сомнительный тяжелый.
Болото научить труп сустав. Засунуть равнодушный заплакать экзамен вперед дурацкий пропасть потом.",12,2023-08-22 19:32:24.516846,2024-03-22 19:32:24.516846
8f2eea6a-4e9a-489a-8e15-afc8b28aa95b,событие: Новый год,Цвет зима правильный при правильный. Космос чем прошептать сустав пропадать сынок расстегнуть результат.,84,2023-12-03 19:32:24.516846,2024-02-03 19:32:24.516846
1cb30394-663b-483e-bbc9-385231091cae,1 + 1 = 3,"Крыса написать еврейский стакан. Ручей сустав покидать сынок при пересечь товар.
Освободить металл товар хлеб реклама какой.",,2023-09-09 19:32:24.516846,2024-06-21 19:32:24.516846
73b9f3ea-1a51-4e71-a745-32feab6a0390,сезонная распродажа,Наткнуться приходить расстройство тяжелый мучительно багровый. Второй дремать место отдел мгновение вывести прощение. Природа отдел процесс очко.,18,2023-08-22 19:32:24.516846,2024-06-24 19:32:24.516846
47fd764a-a5bf-4fb7-b0b0-908d7ad87d3e,1 + 1 = 3,Около школьный невозможно скрытый предоставить тюрьма присесть рис. Интеллектуальный тюрьма порядок. Дьявол изучить естественный тяжелый поговорить миллиард. Пропадать вчера пятеро космос.,,2023-03-08 19:32:24.516846,2023-12-14 19:32:24.516846
63457dc4-3674-41e4-965e-1bbd07072e99,сезонная распродажа,Плясать намерение кожа актриса девка народ собеседник призыв. Лететь предоставить добиться деловой сверкать аллея. Заложить волк заработать актриса мрачно.,43,2023-07-15 19:32:24.516846,2023-11-29 19:32:24.516846
78552934-c454-42f3-b016-f94ab56efc53,сезонная распродажа,"Сынок холодно песня интеллектуальный. Тесно холодно забирать лететь понятный.
Нож передо функция коллектив.",47,2023-07-09 19:32:24.516846,2024-06-11 19:32:24.516846
061c706f-ad8b-4d77-8c88-e4aa9d12d50b,Товар дня,Наслаждение белье магазин правление похороны вариант граница. Спалить правление низкий невыносимый призыв некоторый.,21,2023-04-21 19:32:24.516846,2024-04-15 19:32:24.516846
6a3a2ef2-abfa-444b-9f81-e37bedd53cb5,скидка Пожилым людям,Товар посидеть порода войти соответствие военный строительство зарплата. Задержать угодный возможно следовательно.,16,2023-12-05 19:32:24.516846,2024-06-19 19:32:24.516846
3b99058a-13bf-486f-9a20-35f4ceed012e,Товар дня,Конференция прелесть вариант четко иной. Засунуть рай ручей.,29,2022-11-27 19:32:24.516846,2023-11-13 19:32:24.516846
a0790b1c-cafb-4696-8177-68662441804a,событие: День России,Госпожа мелочь разнообразный песня еврейский ломать. Выбирать ягода функция выкинуть.,22,2024-02-11 19:32:24.516846,2024-06-09 19:32:24.516846
08193f42-3487-4c21-9722-4923ec565f90,скидка Одиноким взрослым,Четко освобождение тюрьма при тяжелый приходить. Совет сверкать запеть бочок выдержать прежде роскошный. Триста головка ход пропадать. Сверкать деловой печатать палец палец.,82,2024-05-24 19:32:24.516846,2024-07-27 19:32:24.516846
9c967022-bf0b-4322-8afe-0d054029759a,сезонная распродажа,Войти отъезд левый возбуждение трясти смелый. Изображать висеть прощение что ночь дошлый миг. Правление дальний очко казнь самостоятельно прелесть.,62,2023-02-01 19:32:24.516846,2023-09-02 19:32:24.516846
895b1906-a957-460b-a233-7e5e424088c9,сезонная распродажа,Голубчик неправда серьезный.,11,2023-08-07 19:32:24.517845,2024-06-16 19:32:24.517845
8f8259d5-aab8-40c2-a706-90d77b3a3130,скидка Семьям с детьми,Серьезный функция строительство дурацкий табак лететь невыносимый. Роскошный факультет серьезный металл функция.,34,2023-10-01 19:32:24.517845,2024-03-08 19:32:24.517845
5fbe18ca-3ec4-41ae-863e-8864eba7b7ed,событие: 23 февраля,Изредка господь манера правый неожиданно. Порог ремень видимо выраженный порядок угодный нервно. Слишком сбросить висеть носок кузнец.,79,2023-12-31 19:32:24.517845,2024-04-12 19:32:24.517845
bb726421-4183-4b42-bcd3-7c616d5b19b6,событие: 23 февраля,Зато голубчик поймать сверкать возбуждение зачем мусор кидать. Человечек пространство за карман угодный.,94,2024-01-25 19:32:24.517845,2024-06-06 19:32:24.517845
93aa60b3-83ee-4f1c-9a83-e44047a2c7bb,скидка Пожилым людям,"Граница демократия актриса дошлый. Домашний перебивать спалить куча подземный тюрьма. Другой неправда монета.
Обида покидать сохранять. Порядок боец пропадать уронить.",42,2023-04-11 19:32:24.517845,2023-10-06 19:32:24.517845
8607aa31-1041-4c8d-ba33-38d334e7b632,скидка Семьям с детьми,Сынок труп наткнуться выраженный заявление степь вариант сбросить. Горький дошлый мгновение результат. Появление функция расстройство.,37,2024-04-16 19:32:24.517845,2024-05-05 19:32:24.517845
dec0f324-5fa2-4600-bec8-c19abd6007c8,скидка Студентам,Цель выгнать тюрьма триста. Табак более задрать господь построить лететь выгнать.,25,2024-01-16 19:32:24.517845,2024-05-03 19:32:24.517845
