id,name,address,phone_number,fio_representative
a9d67ed3-b954-4608-bb89-c498887be2ed,Банк Ак Барс,"п. Урус-Мартан, пер. Вахитова, д. 724 стр. 4, 469959",+7 368 846 25 70,Майя Владиславовна Горшкова
8edb5b46-7dea-4afe-92c3-bcf48f42ff19,Доронина Групп,"г. Владимир, наб. Щорса, д. 832 к. 29, 006850",8 (745) 457-30-05,Евдокия Павловна Носова
b84f2019-dc55-4b94-a59b-ef5ade71dc2d,АО «Мишин Васильева»,"д. Качканар, пер. Дорожников, д. 5/9, 038679",+7 (891) 890-0846,Дорофеева Александра Робертовна
97eaf43b-4b3b-4e6e-9f66-2bd132c92b2a,ЗАО «Потапов Доронин»,"ст. Кедровый, пр. Окружной, д. 55 стр. 48, 053399",+7 446 438 4786,Калашников Вышеслав Викторович
e021105e-0758-474e-92bd-b8917db89189,Кордиант,"г. Красноярск, пр. Пушкина, д. 3/5 стр. 397, 819902",87422658402,Ирина Дмитриевна Самсонова
b5f4dce0-0427-43d1-8b9b-b6a17fec8a23,ООО «Никонова-Елисеев»,"клх Кимры, бул. Алтайский, д. 7 стр. 87, 824444",8 (924) 595-74-43,Дорофей Феофанович Силин
892c1e14-78c0-4a17-86a4-f52f7e6f8434,АО «Громов Евдокимов»,"клх Адлер, пер. Строительный, д. 165 к. 67, 006724",+7 (003) 684-4455,Крылов Болеслав Иосипович
18c3b29f-5bfd-437f-b8db-aa71843c5e52,СДС Азот,"клх Кызыл, ш. Саратовское, д. 32 к. 1/5, 003388",8 016 196 28 80,Митофан Фокич Блохин
f2c1be11-4229-479e-95d8-b99d51cf23cf,АО «Шашков»,"г. Териберка, алл. Гончарова, д. 7, 892190",8 692 125 64 32,Милица Леонидовна Харитонова
15f75f98-1723-4145-8ea7-2eeab805567e,ЗАО «Агафонов-Петрова»,"ст. Ангарск, ш. Фадеева, д. 51, 357274",+7 (163) 721-6504,Новиков Аристарх Елизарович
19961e72-6d63-4855-8b05-d75fc54c37a8,ООО «Ильин»,"ст. Дубна, алл. Смоленская, д. 244 к. 8, 621563",8 (106) 135-31-57,Суворова Оксана Тимуровна
d0b7b8a4-fa99-4498-a5fa-afa86edae9c4,ДСК Автобан,"г. Елец, наб. Новосельская, д. 95 стр. 47, 626733",8 722 996 2852,Амвросий Демьянович Колесников
fabf3739-e2e5-4eaf-bc53-eb17bd9e2380,Корпорация Тактическое ракетное вооружение,"клх Ковров, ул. Звездная, д. 33, 729462",8 (788) 196-5753,Лукьян Евсеевич Лаврентьев
a5549d1a-18b3-4967-8b7c-ffbfded65e59,Захарова Групп,"д. Астрахань, наб. Сахалинская, д. 9 к. 1/1, 246517",+71683385251,Новикова Евпраксия Ильинична
59e5050d-d144-4361-88d0-8d20681e4325,ОАО «Лаврентьев Сазонова»,"к. Сунтар, наб. Коллективная, д. 989, 829762",+7 522 519 85 93,Антонов Тимофей Измаилович
5251606b-aadf-4343-a0be-822909b27ed6,ОАО «Доронина-Капустина»,"с. Пышма, пр. Железнодорожный, д. 4/7 стр. 1/9, 958413",8 750 531 5606,тов. Капустин Любосмысл Андреевич
b6f5fa91-65fd-409a-add0-3227fafbad9f,РАО «Громов»,"с. Салават, пр. Станиславского, д. 7/4 к. 6/2, 510869",+73426404844,Данилова Дарья Артемовна
badb3dd0-4f24-4ea2-9170-34a1b6234629,Группа ЭПМ,"к. Серафимович, пер. Транспортный, д. 82 к. 87, 584327",+73638200043,Дроздов Антип Ефимович
5362d5df-6db3-4fe2-82fc-18ad51fd18e1,Сандоз (Sandoz),"с. Зеленогорск (Ленин.), ш. Большевистское, д. 1/7 к. 827, 365851",+7 (751) 860-3525,Уварова Вера Леонидовна
f14cfdaf-e21d-4d9d-a8a7-59d470124be2,ОАО «Калинина»,"д. Черский, пр. Есенина, д. 2/4 к. 133, 834196",+7 423 252 03 68,Олимпиада Егоровна Панфилова
0aac47b8-6c5f-4835-8f0e-6040978cfa8d,"ОАО «Вишнякова, Копылов и Гуляев»","клх Невинномысск, ул. Ростовская, д. 839 стр. 3/7, 069910",+7 099 901 17 67,Агафонов Богдан Харлампьевич
ba68ea34-e54f-490a-8574-59f55a941b41,Силовые машины,"д. Сортавала, пр. Крайний, д. 2/1 к. 1/9, 521411",86986934899,Клавдия Кирилловна Денисова
949c199c-da98-442f-9045-b6bd0e6eb100,ИП «Крюкова Сорокин»,"с. Рыльск, пр. Кольцова, д. 943, 542353",+7 419 106 6185,Гришин Агап Викентьевич
83451c44-415b-46d3-bc21-53968fc0ed0f,Комацу СНГ (Komatsu),"г. Меренга, пр. Заозерный, д. 6/4 к. 7, 805276",+7 352 792 41 02,Романова Лора Сергеевна
7c96e67b-f9c3-4cc3-877e-a43df00b6435,Эссити (Essity),"п. Холмогоры, алл. Тукая, д. 22 стр. 853, 669073",+70685803824,Лора Евгеньевна Селиверстова
b5eb9b33-3841-4422-9862-db582b1cca6a,"АО «Никонова, Рябов и Молчанова»","с. Уссурийск, ш. Московское, д. 8 к. 9/2, 165065",+7 (993) 788-5055,Лукия Львовна Белова
7bc5f6fb-9091-413a-af22-43d5627ea44e,Несте Санкт-Петербург (Neste),"д. Красноярск, наб. Совхозная, д. 9 к. 558, 190158",85206523726,Юлия Святославовна Юдина
f3bac42c-9480-4e35-9671-b2d771150f92,РАО «Жукова Богданова»,"г. Сухиничи, наб. Геологов, д. 7 стр. 5, 388136",8 (239) 248-43-28,Михей Гавриилович Филиппов
74c0f26a-1134-4b2d-b433-c615e0f0d245,"ООО «Калашников, Романов и Федоров»","п. Кашхатау, ул. Папанина, д. 609 к. 783, 065410",+7 (729) 562-9642,Петухов Фотий Демьянович
829cf42d-2693-484e-8320-0d5a11a6030b,"ИП «Ершов, Пахомов и Кузьмин»","с. Орел, пер. Проточный, д. 170 к. 2/8, 639048",83509012535,Никанор Егорович Субботин
7e8cd2c3-f32b-4619-9d8a-b49b5af4cba6,ОАО «Щербаков»,"с. Чебаркуль, ул. Геологическая, д. 9 к. 1/9, 225762",+73756766749,Таисия Харитоновна Турова
ce1e9994-366d-42e3-9351-adf4f2133028,НПО Алмаз,"с. Шадринск, пр. К.Маркса, д. 38 к. 5/8, 563254",8 (033) 624-18-96,Фаина Оскаровна Третьякова
f21a2270-4a68-402a-b59a-1dd461c56d4d,РАО «Сергеев-Якушева»,"ст. Тверь, алл. Владимирская, д. 82, 833088",82093263551,Быкова Олимпиада Ждановна
d01f79aa-901e-4562-ae92-381f8a35e732,Ашан (Auchan),"г. Можайск, пр. Докучаева, д. 8, 728114",84412293911,Севастьян Августович Корнилов
5b893ab9-8937-4e5e-82d3-c6617134e384,ООО «Юдина Михайлов»,"ст. Уссурийск, бул. Орловский, д. 7 к. 6/9, 255451",85132351320,Денис Георгиевич Лебедев
1a22b864-b646-411c-9cc3-0915a2132876,Лебедева Лтд,"к. Сухиничи, наб. Новгородская, д. 8 к. 299, 307369",8 691 833 08 66,Соловьев Савелий Игоревич
2e915e8a-894f-4727-b5ea-bb3cafef0ab4,АО «Доронина-Галкина»,"д. Каменск-Шахтинский, алл. Окружная, д. 9 стр. 233, 091771",8 688 041 47 50,Потап Эдуардович Одинцов
227f7b06-3d75-4f1d-8c63-4bfee853b4ca,Объединенная компания Связной — Евросеть,"г. Серебряные Пруды, алл. Береговая, д. 4, 615494",8 708 849 6545,Мария Владимировна Боброва
214e0c09-afef-4cc3-a8cc-d980104363fd,ООО «Крылова»,"ст. Тихорецк, бул. Огородный, д. 57 стр. 1/1, 246003",+7 (483) 655-8057,Прасковья Аркадьевна Алексеева
1abb476d-e12e-4b8a-8f92-fb3bd42fbc03,ЗАО «Сысоева-Крюков»,"г. Качканар, пр. Элеваторный, д. 23, 917244",8 (934) 663-48-62,Ульяна Петровна Жданова
3c6ade88-51bc-4295-80a1-d9a666752999,ООО «Мясников Носков»,"д. Нарткала, пр. Привокзальный, д. 482, 275851",8 140 644 27 13,Блохин Андрей Терентьевич
e53c669f-f980-4b7f-b926-7e15e5615526,"ИП «Игнатьев, Михеева и Мамонтов»","д. Батайск, наб. Фадеева, д. 3/5 стр. 8/8, 129279",+7 (769) 121-55-55,Самсонова Евфросиния Сергеевна
2f6f8ff7-5a67-4b7a-85bb-8bea26bf8ac0,ИП «Кудрявцев Титов»,"ст. Новокузнецк, пер. Р.Люксембург, д. 49 стр. 7, 280607",8 402 329 01 96,Олимпиада Михайловна Тихонова
107684c1-bb56-4c32-a50e-5d7b1794871c,Зиновьев Инк,"д. Находка, ул. Чапаева, д. 1 стр. 2/6, 255598",+72975214341,Никодим Ерофеевич Королев
dacc6ee5-60b8-469a-963e-e6a96fb9f13d,ООО «Моисеев-Носова»,"п. Верхний Тагил, пр. Леваневского, д. 163 стр. 51, 463099",+7 (323) 718-57-91,Анастасия Альбертовна Кудряшова
76f3fd33-7874-4125-8b83-9fffbba5b5f7,Самсунг Электроникс Рус Калуга (Samsung),"д. Буденновск, бул. Средний, д. 72 к. 70, 023183",8 499 037 6491,Смирнова Пелагея Робертовна
37edcc9f-0cf7-4ebe-a896-3bacef7ead8b,Банк Ак Барс,"д. Зеленогорск (Ленин.), пр. Тукая, д. 317 к. 98, 512686",+73462660443,Милица Владимировна Брагина
9bf51a46-7ae1-4581-bb37-4a1bc3bb8d7b,ИП «Пестова-Калашников»,"к. Серов, бул. Тихий, д. 3/5, 275705",8 358 743 2208,Голубева Наталья Михайловна
b9d1b0b6-6a6b-4b55-b7ed-5cdc834c9d23,ООО «Щукина»,"д. Муравленко, ш. Добролюбова, д. 3 к. 9/2, 451090",+7 (580) 656-9063,Воронов Мечислав Георгиевич
08873426-a9fd-4297-a570-adb4c34dce90,ОАО «Абрамов»,"с. Суздаль, ш. 8 Марта, д. 6/6 к. 9, 423515",8 (079) 511-63-99,Татьяна Вениаминовна Дьячкова
508d7115-5bcd-4b56-9704-8c0974b21058,Русал,"д. Далматово, бул. Панфилова, д. 7/1 к. 3/9, 239711",8 207 497 65 52,Данилова Полина Натановна
0d81db1e-bc34-4aed-ac25-d5bcd300570d,АО «Крылов»,"клх Мостовской, бул. Плеханова, д. 142 к. 6/3, 616609",89623010800,Дорофеева Раиса Феликсовна
61fd9073-54d1-435f-868c-c7aaf8452fde,ООО «Лукина Артемьев»,"ст. Зеленоград, пер. Речной, д. 9/1, 188104",+77566384462,Эрнст Изотович Костин
0c6fafd8-9a1c-4cf7-9683-5b40f5c6a3eb,"АО «Юдин, Казаков и Титова»","клх Дмитров, пер. Гражданский, д. 1/1 к. 939, 213532",+74951071793,Данилова Лора Борисовна
7f47a66b-48c4-4963-a30f-b11d02ee8ecf,ЗАО «Муравьев»,"д. Александровск-Сахалинский, пр. Пролетарский, д. 19 к. 917, 742271",+7 (262) 540-9383,Муравьева Евпраксия Никифоровна
06d58dc8-3b2e-4b5f-87ca-06b9ba5a97d2,ИП «Субботина»,"к. Адлер, наб. Весенняя, д. 3 к. 3, 597326",+7 (396) 684-61-74,Лукин Всеволод Жанович
7cc5a820-3793-43bb-9eed-5ce9008f0a88,"АО «Исакова, Панфилова и Пестов»","п. Усмань, алл. Кузнечная, д. 8/7 к. 6/3, 736571",8 831 247 16 19,Лукия Макаровна Голубева
4d34bf02-f539-4be6-b10c-8381618304e8,Фирма Агрокомплекс им. Ткачева,"ст. Верхний Тагил, ул. 8-е Марта, д. 249, 636864",+7 120 082 44 48,Крюкова Анна Александровна
d423b214-67ba-450a-8a92-96f63b7dfec2,"ЗАО «Фомичев, Мишина и Баранова»","к. Калач-на-Дону, пр. Циолковского, д. 311, 148172",+7 998 170 80 54,Лаврентьева Юлия Васильевна
e79c5af5-2f64-4539-90b2-8e57199ded1b,"РАО «Исаков, Шашкова и Трофимов»","д. Шумиха, алл. Ушакова, д. 9 стр. 702, 533973",+7 503 448 48 86,Синклитикия Ильинична Логинова
278091d3-d800-4e46-a30a-a889748cd7da,АО «Колобов»,"п. Кандалакша, ул. Поселковая, д. 4 стр. 48, 502143",8 (175) 909-8197,Агафонова Алина Архиповна
5b1927e9-fc8e-49a3-b65a-7da9781c652f,САМ-МБ,"п. Благовещенск (Амур.), ш. Снежное, д. 294 стр. 4, 540944",+7 (457) 556-1983,Октябрина Ниловна Агафонова
c00a240f-088e-46ea-a5a5-cad8ff87c63f,Энергосбытовая компания Восток,"клх Хужир, алл. Краснознаменная, д. 725, 230435",+7 (601) 434-7373,Прасковья Яковлевна Соболева
c5293478-251b-4a70-b934-aea4fefbe502,"ООО «Белоусова, Емельянов и Панфилов»","д. Арзамас, алл. Свободная, д. 5, 107559",+7 (437) 515-78-85,Субботин Гордей Ефремович
115a1548-efaf-4b39-90fa-be4646d5ddf0,НПО «Никифоров»,"д. Владивосток, ул. Карьерная, д. 224 к. 880, 445843",+7 (457) 957-58-76,Надежда Дмитриевна Давыдова
834647b1-c789-4e09-a121-46ac704dd479,"ИП «Максимова, Молчанова и Русакова»","ст. Наро-Фоминск, алл. Моховая, д. 9 стр. 419, 639805",8 (420) 420-2294,Нина Яковлевна Гущина
f68cc2b7-84b8-47a2-995e-059dcfb06b75,Транскапиталбанк,"ст. Ижевск, пр. Невского, д. 196 к. 867, 428215",8 (536) 666-58-74,Евгения Тимофеевна Юдина
7b092f37-5c46-4144-8327-4a3b6f7c68cd,"РАО «Молчанов, Маркова и Моисеев»","к. Троицко-Печорск, бул. Сурикова, д. 784 к. 3, 797294",+70169881668,Ефим Чеславович Васильев
47f604b2-8a5d-4dec-a0a4-b2d3de780071,ЗАО «Соловьев-Князева»,"с. Пушкино (Моск.), пер. Высотный, д. 528 к. 7/8, 921013",+7 (840) 186-8518,Тимофеева Полина Александровна
fc46b542-cabc-46c4-a808-c9dc6b076c1c,АО «Зимина Мишин»,"с. Неплюевка, пер. Никитина, д. 2, 294171",8 931 063 54 47,Жуков Феоктист Устинович
075ea3bc-8ec0-445c-80d6-5066962e5118,ЗАО «Копылова»,"г. Дубна, бул. Азина, д. 157, 916137",+7 488 968 1858,Галкина Эмилия Дмитриевна
18a88c35-825c-418e-ab69-6c1cba8a0b72,РАО «Миронова-Блохина»,"п. Бузулук, пер. Карбышева, д. 438 стр. 1, 804464",8 623 023 9123,Венедикт Бориславович Исаев
0b55e32b-965d-4561-aa9c-d8f8d7708ed1,АО «Носкова-Сафонова»,"клх Невинномысск, ул. Дружба, д. 529 к. 288, 003968",8 711 537 19 83,Филиппов Ерофей Абрамович
ed125ea6-09c0-4f2b-a086-3b6249138652,МАКС,"п. Сунтар, пер. Кольцова, д. 7 стр. 89, 795219",+7 (053) 595-6003,Виктория Константиновна Александрова
7db8ce1d-b515-4592-a42d-a3db705e194e,ЗАО «Комарова Назарова»,"г. Невьянск, бул. Бульварный, д. 5/9 к. 445, 057987",+7 (467) 516-3378,Варлаам Феодосьевич Молчанов
431499f5-e2d4-4098-a928-61a697a940b4,РАО «Журавлева Одинцов»,"клх Кунгур, наб. Пирогова, д. 5 к. 8/3, 972385",81054731964,Воробьев Христофор Гавриилович
640065f0-c1ff-4f64-9816-57c4e37f5f4a,ИП «Якушев Кудрявцева»,"п. Дно, пер. Зои Космодемьянской, д. 36 к. 245, 206563",86797736198,Дарья Мироновна Родионова
56b715ff-d148-4c3f-9956-22808d04a2e7,Сибур Холдинг,"к. Тамбов, пер. Новый, д. 1 к. 177, 342121",8 763 933 9784,тов. Сафонова Ангелина Геннадиевна
b02fc34e-db8d-4fa9-9015-4bd7e63898c5,НПО «Боброва»,"г. Кашира, ш. Тракторное, д. 831 к. 82, 450399",+7 (030) 860-01-35,Изот Юльевич Маслов
1a3cb8ef-a7e9-481d-ad12-2518cd520fb2,АО «Князева»,"к. Одинцово, пер. Свободный, д. 3/7 стр. 2, 228933",+7 (586) 984-0046,Елена Леонидовна Рыбакова
a807bd73-0517-4099-8cee-1bd0d339c4be,Ланит,"клх Данков, ул. Путейская, д. 584 к. 2/1, 619493",+7 013 234 35 37,Колобов Спартак Яковлевич
2b018a76-c0d0-4385-a18a-5ebac80cc464,Гаврилов и партнеры,"ст. Рязань, ш. Южное, д. 8/4, 784652",+71762460475,Зоя Сергеевна Мишина
cfe3429d-7120-4224-9bd6-2b84c24f607a,ИП «Герасимова»,"п. Омск, наб. Макарова, д. 997 к. 2/7, 046135",87196449817,Доронин Ферапонт Зиновьевич
c800f57c-9905-4156-9f05-b25d61cabd69,ЗАО «Дорофеев-Лыткин»,"с. Шелехов, наб. Красногвардейская, д. 2, 949706",8 (987) 840-65-13,Радован Ермилович Носов
42f08b6c-b095-4377-8f54-301464ba3c74,Арконик СМЗ,"к. Томари, ш. Гайдара, д. 1 к. 66, 222744",+77004925420,Регина Натановна Морозова
090e2455-5c1c-4838-8d0f-02147889fd9c,ИП «Петрова-Никифоров»,"с. Тимашевск, ул. Киевская, д. 5/9, 206348",+76712062105,Селиверстов Никон Витальевич
0a76a800-aabc-4737-ae42-5e539161d326,Компания Трасса,"клх Мостовской, бул. Крупской, д. 3, 087459",+7 039 458 6680,Красильников Антип Дорофеевич
254adbef-3170-4e4d-b8ec-92ef46f24b2d,Merlion,"г. Приморско-Ахтарск, ул. Геологов, д. 10, 721558",8 214 878 72 28,Мария Константиновна Крылова
794230b5-2b57-4159-89b7-46e996b8ad0f,Козлов Инкорпорэйтед,"к. Тихвин, наб. Ягодная, д. 81, 383264",+7 (514) 652-4954,Лаврентий Гурьевич Евдокимов
fa84e933-963a-4206-847b-03fa7955a37c,НПО «Афанасьева Комиссарова»,"д. Саянск, наб. Линейная, д. 4 к. 3/4, 400027",+7 (408) 079-4880,Милован Тарасович Фадеев
af182f1e-7094-404f-b702-7658322b172d,ООО «Поляков-Давыдова»,"клх Губкинский, пр. Лунный, д. 53 к. 374, 625767",89309381300,Соловьев Клавдий Давыдович
e8138ed6-f90b-4c45-a515-4e1127d46e72,ОАО «Лукина»,"ст. Красноярск, алл. Ломоносова, д. 84, 572720",+7 (341) 526-0387,Устин Иосифович Зиновьев
ec81cb1e-4eb5-4d8d-8cf3-b5418e1d3d1d,ИП «Горбунова-Носова»,"к. Сухиничи, алл. Деповская, д. 7/1 к. 4, 852091",8 (518) 415-76-99,Васильева Синклитикия Михайловна
3e920861-4dc6-47af-a0fc-7cb6f1ed1b6e,НПО «Дроздова Ефимов»,"к. Нязепетровск, наб. Почтовая, д. 82, 366529",+7 032 387 0035,Мартынова Маргарита Викторовна
e9d43d2d-b02c-4342-a609-f2db8609ab03,"РАО «Федосеева, Наумова и Капустин»","ст. Тамбей, алл. Сибирская, д. 8/7 к. 4, 146041",8 (414) 363-83-81,Панов Кузьма Харлампьевич
ece7103a-300d-42fa-90d3-d0c7255776f3,АО «Аксенова-Ермакова»,"г. Краснотурьинск, алл. Мая 1, д. 4 стр. 11, 276686",+72155305027,Юдина Таисия Никифоровна
3628a3dc-db70-43cf-94f2-dd2cc8242b53,Доронина и партнеры,"клх Ступино, ш. Лесхозное, д. 1 стр. 681, 062645",8 382 809 6223,Ермаков Юлиан Ярославович
5e8d678d-04c5-4817-8313-92abad3a3683,САМ-МБ,"д. Диксон, алл. Степная, д. 51, 400559",8 431 788 35 80,Турова Василиса Максимовна
43c4a0e3-866e-4bc1-a5f2-0036bbf7d601,Нефтиса,"клх Орел, ул. Свободная, д. 9 к. 2, 740638",8 (480) 437-6306,Ширяев Нифонт Венедиктович
653effa0-e753-4726-8b5b-30debbdecee0,Панов Лтд,"к. Хоста, бул. Сплавный, д. 9/4, 151029",+7 (400) 069-89-54,Семенов Устин Давидович
1124fd99-6b3f-491d-8429-e749ad609697,"РАО «Большакова, Мельникова и Турова»","г. Нязепетровск, наб. Гагарина, д. 722 стр. 2, 632905",+7 702 118 81 22,Эрнст Федосеевич Анисимов
6b90838f-8294-4823-8735-26d0605bb1b4,ООО «Никитин»,"с. Шадринск, бул. Лунный, д. 5/1 к. 1, 980027",+7 (268) 058-55-20,Анна Ждановна Захарова
74398e04-6076-4b0f-989d-845ccd5fb6b1,Мосгортранс,"к. Ачинск, алл. Черноморская, д. 93 к. 212, 103996",8 (656) 031-82-21,Лариса Оскаровна Костина
9a833490-1326-4109-9749-6bf62f7f927a,Шестаков Групп,"г. Объячево, наб. Олега Кошевого, д. 63, 189551",86356773747,Лаврентьева Пелагея Юрьевна
98521be2-bf65-4c37-8082-82231dcaf3e4,Силовые машины,"клх Северодвинск, пр. Целинный, д. 3 к. 5, 185305",8 644 135 33 63,Лихачев Богдан Адамович
406740ad-bb87-4d54-90b5-e90c0bea4f36,ИП «Белякова-Гришин»,"д. Амдерма, алл. Мостовая, д. 7/1 к. 75, 844855",8 755 144 6578,Гришин Всемил Борисович
bfe1b4b6-79c5-4b66-bda0-3765f55513f7,ОАО «Бирюков Соболев»,"клх Агата, ш. Волжское, д. 53, 368121",8 237 061 8337,Зайцев Эдуард Ефимьевич
05394f2d-e2b9-433c-ae7a-3e44f8ee0efe,Доронин Лимитед,"с. Соловки, ул. Менделеева, д. 6/8, 300458",8 (272) 623-77-30,Валентина Павловна Федорова
a99de298-aa0a-4c70-8ce7-6b90e80e5c4d,"ЗАО «Назарова, Константинов и Елисеев»","с. Радужный, алл. Казанская, д. 3 к. 516, 668807",+7 848 182 63 57,Борисова Мария Богдановна
d2521bf0-33df-4640-9448-8e288374bb93,Федотов и партнеры,"г. Южноуральск, алл. Колхозная, д. 75 стр. 6/9, 087512",8 (986) 918-4526,Ефремова Глафира Вячеславовна
4f843347-ef06-4138-adb4-4ccafdd42c36,Минудобрения,"с. Токсово, ул. Кирова, д. 239, 709486",+7 962 321 5416,Сорокин Владислав Яковлевич
f909b79c-af03-4cd5-b048-89860919e7e0,Селиверстова Групп,"ст. Якша, пер. Кузнечный, д. 4, 704489",83107891145,Таисия Архиповна Кулакова
cff93fec-e363-41d0-8c30-c02305e9c2c9,"ООО «Воробьева, Фомичев и Большакова»","г. Анива, бул. Каштановый, д. 4/8 стр. 3, 877036",+7 430 140 1562,Евсеев Евстафий Витальевич
2e8fc52c-31c0-4639-b055-4327028cb81e,ИП «Белоусов Нестерова»,"д. Жигулевск, пер. Шахтерский, д. 3 стр. 566, 783936",80716659973,Колесников Савелий Жоресович
7e053647-6ac9-440e-9f5f-9d45e92f3fc7,ЗАО «Устинов-Суворова»,"п. Воскресенск, ш. Комарова, д. 5/7, 105313",8 815 188 9346,Дьячков Самуил Фокич
b0bc6e83-179d-454e-a59b-30e106612961,НПО «Никитина Князева»,"ст. Россошь, ул. Садовая, д. 5 стр. 31, 066804",8 (912) 191-10-84,Афанасий Федотович Лебедев
e767a4ea-155a-4bc8-a74f-0f2c69e34031,"ИП «Дементьева, Наумов и Баранова»","с. Плес, бул. Иванова, д. 9, 183314",+7 (779) 596-1389,Горшков Аникита Яковлевич
1689475d-512f-4906-9504-3a44f55fbaef,Сазонов Инк,"д. Амурск, пр. Гончарова, д. 6/1, 936823",8 (869) 189-4146,Титова Юлия Степановна
6923e233-206a-4cc6-9b24-927653565886,ООО «Тимофеев-Федотова»,"ст. Брянск, ул. Полевая, д. 29 стр. 1, 595203",+7 (060) 917-51-91,Жуков Лукьян Владиславович
d1aa9130-b72a-47ba-b444-08799915fae7,"ИП «Морозов, Чернов и Орлов»","г. Талдом, бул. Больничный, д. 265 к. 4, 269521",+7 (513) 302-5812,Никонов Галактион Бенедиктович
