id,title,address,phone_number,fio_representative
42873ca1-d0f2-4a5c-9036-b01b6e8589f6,Агросила Групп,"п. Приморско-Ахтарск, пер. Калинина, д. 7, 681430",+7 038 627 66 57,Аксенова Валерия Игоревна
1ec33c37-5653-4d34-8a88-7a1c9a9af8a0,"ОАО «Зайцев, Доронина и Юдин»","ст. Избербаш, ш. Энергетическое, д. 1/4 стр. 5, 439446",+7 (808) 234-8796,Эмилия Тарасовна Тимофеева
e0d9bd8a-e8e6-4350-8217-6d0d817235f9,ОАО «Анисимова Воронов»,"клх Истра, наб. Красных Партизан, д. 2/1 к. 242, 862375",+7 (676) 699-30-31,Октябрина Леоновна Анисимова
312aa933-7a29-4267-8ec9-5d20b78c15fd,ИП «Титова-Рябова»,"клх Старый Оскол, алл. Вахитова, д. 924, 589695",8 111 951 7311,Захарова Фёкла Рудольфовна
b9192f61-5d7a-401a-b97b-5b76098ee340,Втормет,"ст. Оха, наб. Васильковая, д. 832, 690341",8 (321) 444-1061,Семенова Елизавета Кузьминична
a9623eb1-f8a0-4b6f-819d-23aede88d068,ООО «Мухин»,"ст. Колпашево, пр. Таежный, д. 7/3 стр. 944, 125956",+7 (105) 180-98-99,Валентина Вячеславовна Фомичева
fdbaebd5-1e72-49d0-bb08-9676fd52b380,АО «Соколов»,"клх Усть-Баргузин, ул. Баумана, д. 558 к. 1, 343291",8 926 792 43 68,Ситникова Марфа Юльевна
c1abf404-6f9c-4b62-a958-35bb342ba54d,ЗАО «Макаров-Филиппова»,"п. Моршанск, пр. Боровой, д. 4, 770728",8 (366) 286-9553,Рогов Гордей Викентьевич
728aacad-e9b5-4a5f-b6eb-f49c4362f11d,Нефтехимсервис,"ст. Переславль-Залесский, ш. Серова, д. 2/1 стр. 905, 600754",8 (711) 549-70-18,Анжелика Александровна Пестова
0f87a4f9-42bf-404a-b850-b6e79b8f7601,Великолукский мясокомбинат,"п. Ведено, наб. Труда, д. 80, 549864",8 (814) 181-31-62,Виктория Кузьминична Шестакова
c8ad0359-3806-4d32-ba85-56e061206bc4,ООО «Самсонова»,"к. Химки, ш. Свободное, д. 73 к. 475, 127073",+7 533 418 2895,Октябрина Сергеевна Доронина
cbef0f29-a4c8-4d42-9c41-3c0450343f99,ПТК Уголь,"д. Томпа, пр. Цветочный, д. 59, 946946",+7 556 179 1173,Брагина Нонна Павловна
8938739f-ab26-4328-b00b-11a23558c9c0,Третьякова Инк,"п. Златоуст, бул. Тепличный, д. 6 стр. 3/6, 086860",8 (715) 984-8164,г-жа Трофимова Прасковья Наумовна
737ee81a-847b-4abd-aa3c-0bd5d97e068d,ИП «Пестов-Мясников»,"д. Павловский Посад, ш. Островского, д. 4, 149636",82424048314,Борисова Алла Георгиевна
71613546-fe67-4f34-b001-871ecfb51fec,ОАО «Степанова Трофимова»,"п. Чусовой, наб. Белорусская, д. 9 к. 7, 111097",83567051627,Самойлова Эмилия Николаевна
51ff96e0-a21a-4f94-b51e-0cceca6e9a43,НПО «Голубев Зимин»,"с. Кировск (Мурм.), бул. Королева, д. 65, 081830",+7 548 779 42 47,Тарасов Ладислав Валерьевич
b4e0a387-9c48-4fee-be2c-1e1fc917bf12,САП СНГ (SAP),"п. Новороссийск, пер. Никитина, д. 8/9, 266760",8 369 444 6501,Нифонт Фокич Блинов
36d5c2fa-20e9-4a76-aee8-2584eff46fe3,АО «Исакова-Шарапова»,"п. Усинск, алл. Приморская, д. 2 стр. 42, 510504",+7 543 683 05 14,Зыков Сильвестр Исидорович
0f244c88-0d16-4341-b962-d8bb58a2418b,ОАО «Хохлов-Капустина»,"к. Черский, пер. Герцена, д. 34 к. 1/6, 003523",89951481770,Исаева Наина Константиновна
66751ed9-f31d-4644-acdd-909e6520cef9,НПО «Горшков Дементьев»,"г. Рославль, бул. Вокзальный, д. 5/3, 032389",8 (916) 729-5775,Лаврентьев Устин Августович
34dff4ac-80c9-40a3-9986-a2d5e60087db,Нокиан Шина (Nokian),"к. Буйнакск, ш. Войкова, д. 2 к. 9, 623870",+7 849 508 46 47,Рубен Захарьевич Герасимов
64f45be8-04f8-4aa0-be55-fd742c0ef97e,РАО «Рябов-Евсеев»,"д. Усть-Камчатск, алл. Пирогова, д. 72, 948381",+7 (892) 512-3748,Элеонора Константиновна Фомичева
137b4012-e1ef-474a-ae4e-a7e43472533c,ИП «Якушев Лихачев»,"к. Ханты-Мансийск, алл. Докучаева, д. 373 стр. 2/4, 515763",+7 (508) 985-6909,Абрамова Клавдия Руслановна
c957795a-31e4-4ad3-90c6-f99a91ed0273,АО «Прохоров Морозова»,"д. Мокшан, алл. Ягодная, д. 48 стр. 4, 341524",+7 (062) 768-3369,Григорьев Феликс Ефремович
ad2b5374-fc21-48ec-a429-6c45d947c6d0,РАО «Абрамова Блохина»,"п. Макушино, бул. Фабричный, д. 11 к. 83, 616229",8 (684) 333-7052,Марк Антонович Казаков
38c2c9eb-8ef4-4a28-a911-c0222862907f,"ООО «Гусева, Савин и Туров»","ст. Партизанск, пер. Жукова, д. 80 стр. 15, 158565",8 690 973 6908,Пелагея Тарасовна Пестова
cfd452a0-f662-4c71-aa4d-7d0ec2491b0b,Тетерина Инкорпорэйтед,"д. Вытегра, ул. Базарная, д. 77, 289122",+7 562 806 1641,Новиков Пров Федосеевич
cf999045-57ec-4e4f-b6be-7083e964d871,Бургер Рус (Burger King),"с. Макушино, бул. Фурманова, д. 78, 060218",8 135 504 83 38,Нонна Валериевна Блинова
20399ae7-da37-43a7-978a-83e328041a66,"ЗАО «Ермаков, Матвеев и Гуляев»","г. Сладково, наб. Энергетическая, д. 6, 645654",+7 278 139 9945,Зоя Романовна Юдина
229eefd6-8e2d-40f9-a38b-e6f3cef33e24,"НПО «Фролов, Тимофеева и Максимов»","г. Углич, пер. Лермонтова, д. 66 к. 2/2, 040018",8 569 106 47 71,Бобылева Зоя Тимуровна
4f80afa2-3cfc-4bf0-b331-8b0083f57c58,РАО «Казакова»,"клх Качканар, ул. Донская, д. 3, 962737",8 488 921 6002,Лыткина Ульяна Захаровна
84d882d0-7989-4374-be8d-edd9025cce49,Проктер Энд Гэмбл. Дистрибьюторская компания (Procter & Gamble),"ст. Кетченеры, алл. Спартака, д. 908 к. 832, 352291",+7 742 328 61 07,Ферапонт Викторович Ефремов
3116a9c0-736d-41d2-b26d-5a5e491160db,ОАО «Пономарева Игнатьева»,"клх Дмитров, ул. Коммунистическая, д. 1/2 к. 1/3, 459827",8 (107) 654-1189,Лукия Эдуардовна Яковлева
907774d7-5c71-401d-926b-a5f7179de669,РусГидро,"г. Эльтон, наб. Щорса, д. 7 к. 8/9, 453178",8 (463) 167-4618,Дорофеева Светлана Харитоновна
60da47d2-45c3-4979-9265-8e601c904092,Дикси Групп,"п. Тымовское, пр. К.Маркса, д. 497, 115374",85262075733,Владимирова Октябрина Семеновна
a918d279-0c55-463b-a87a-55b4a515ee2d,Брагина Лимитед,"д. Тутаев, ул. 8-е Марта, д. 890, 952016",+7 (505) 344-73-20,Афанасий Тимурович Одинцов
85545fc3-ebf3-49fc-bf7e-9e32759ac795,РЕ Трэйдинг (LPP),"п. Минусинск, бул. Трактовый, д. 7/9, 148363",+7 (490) 259-3588,Ершова Нонна Тимофеевна
359380ca-b65a-43d4-acd5-885e28a8c0d8,ООО «Иванов»,"ст. Оренбург, наб. Энергетиков, д. 76 стр. 2/3, 230759",8 (241) 026-2815,Фортунат Иосифович Воронов
36fd9058-b54e-48ed-a346-07ca37393b40,Нефтехимремстрой,"г. Глазов, ул. Заозерная, д. 123 стр. 5/1, 990300",+7 350 643 3401,Людмила Семеновна Игнатьева
c7d1b386-8ea5-4efe-8dd6-b56cc91ab6b8,А Групп,"г. Серов, алл. Школьная, д. 8/5 стр. 7/2, 892250",8 (197) 958-88-74,Владимиров Матвей Антонович
a722d08a-1cbd-45a1-9a12-71b1ce9f3a8b,Ман Трак Энд Бас Рус (Volkswagen),"д. Бугуруслан, ш. Поселковое, д. 2 к. 108, 337403",8 (892) 294-1886,Творимир Якубович Пономарев
18eb0706-6474-4857-bc6b-31968bf0f005,РАО «Щукин»,"к. Малая Вишера, бул. Гвардейский, д. 789 стр. 634, 371508",8 (068) 529-71-40,Бобров Станислав Игоревич
222a7355-f3d7-4dca-936b-b77d4bc2f8d3,ООО «Ермаков Васильева»,"с. Вендинга, бул. 50 лет ВЛКСМ, д. 8/6, 162004",+7 (043) 173-40-97,Михеева Раиса Феликсовна
e72e11ad-3772-4383-9e5f-f7452cc89956,РАО «Никонова»,"с. Ставрополь, бул. Высоцкого, д. 9/1 стр. 56, 395430",+7 (003) 619-01-96,Аксенова Людмила Александровна
f8cec377-2370-40ed-9158-991422f492ca,ИП «Гришин Белов»,"п. Сургут (Хант.), ул. Угловая, д. 3/7 к. 7, 908906",8 286 642 3637,Доронина Анастасия Антоновна
5bbf0079-1725-4321-9106-63b5a69a3cca,ОАО «Киселева-Субботина»,"ст. Зеленогорск (Ленин.), наб. Есенина, д. 9 к. 1, 775314",8 686 542 06 27,Пелагея Болеславовна Журавлева
614097da-69f7-4fd9-9213-752c105f7559,Игнатьев Лимитед,"к. Краснодар, бул. Высотный, д. 1/7, 123476",+79412946289,Коновалов Фадей Герасимович
8537dc34-dc26-4904-87a3-a0d0c80a187f,Компания Адамас,"г. Брянск, алл. Ореховая, д. 429 стр. 102, 274449",8 734 196 74 34,Авдеев Семен Харламович
edbf8263-9d7b-429e-b635-f2142d121b91,Шарова Лимитед,"д. Гатчина, пр. Береговой, д. 68 к. 7, 088481",+7 053 708 35 82,Шаров Филарет Виленович
0223590e-7912-4c91-aa35-1e4769cc8f61,Борисхоф 1 (Inchcape),"г. Валдай, ш. 50 лет ВЛКСМ, д. 3 к. 980, 621198",+7 587 113 9128,Федоров Самсон Жанович
cb2c53d2-d224-48d7-9fd3-13a27920c8dd,ЛокоТех,"п. Москва, МГУ, ул. Горная, д. 488, 964099",+7 562 177 4181,Назарова Жанна Никифоровна
16a25157-19e3-4870-b97b-2757760f759f,ЗАО «Андреев»,"д. Пышма, пер. Энтузиастов, д. 9/7 к. 354, 129476",8 983 062 6251,Горбачева Вера Борисовна
24b2d61e-19ff-4bb4-84a9-679e27155dd5,"ООО «Лыткина, Устинов и Сергеев»","д. Троицк (Челяб.), ш. Славянское, д. 49, 557130",81113745506,Полина Михайловна Третьякова
83c807e4-b5f2-4e55-b2b6-5856065007bc,Ренейссанс Констракшн (Ronesans Holding Anonim Sirketi),"клх Сосьва (Хант.), алл. Космонавтов, д. 22, 220888",+7 (317) 422-40-99,Потапов Тит Гаврилович
76298d06-c385-4ad4-96a0-5e948c5e32d3,НПО «Никитин-Герасимова»,"п. Курчатов, алл. Герцена, д. 8/5, 338859",+7 (078) 608-2812,Валерия Антоновна Кудрявцева
3494ab2b-1f7b-4809-b5ad-5ffd26038fc6,"ИП «Колесников, Сысоева и Карпова»","г. Шенкурск, пр. Локомотивный, д. 75, 278645",+7 (912) 265-7319,Глеб Игоревич Щукин
fcf08558-3b00-4d88-ab5a-b0ad27c87cbf,НПО «Горшкова Наумова»,"к. Ростов-на-Дону, наб. Техническая, д. 755 стр. 37, 029353",8 031 380 78 10,Октябрина Кузьминична Тетерина
272bab5d-7de2-4bf0-b359-a9d6399d5c62,ОАО «Голубев-Русаков»,"г. Минеральные Воды, пер. Детский, д. 52, 676913",+7 772 987 7974,Овчинникова Екатерина Андреевна
488cb1e9-eca0-41a0-815a-902dac44bcc8,ОАО «Гордеева Горшков»,"д. Красноуральск, бул. Водников, д. 5 к. 4, 316552",8 (103) 123-96-80,Светлана Геннадиевна Воробьева
bccc82ef-41df-4f71-8851-494724d2d60d,ЗАО «Суханова Дорофеев»,"г. Пермь, алл. Юбилейная, д. 51 стр. 844, 984446",8 (904) 061-47-33,Логинов Фортунат Валерьевич
b441992c-267c-4c73-894f-32194206e7ef,"НПО «Артемьева, Егоров и Мясникова»","к. Орехово-Зуево, бул. Ломоносова, д. 253 к. 320, 610930",88719516188,Леонтий Владленович Белоусов
a6708e59-0c4d-4cc8-86b6-2b316309288d,Брагин Групп,"с. Ижевск, ш. Заливное, д. 540 стр. 6, 438711",88671541503,Смирнова Анжелика Олеговна
0df4fab1-fbc2-4472-850b-9a87a90c7891,АО «Дементьева»,"п. Семлячики, ул. Морозова, д. 6 к. 2, 728035",+70793046884,Зыков Конон Ефимьевич
a120d47d-2d7e-4008-9b42-2830da748068,Смирнова Лтд,"д. Кижи, ул. Раздольная, д. 220, 248717",8 706 144 1311,Владимиров Ратмир Вячеславович
853709ec-64d1-42d9-8e5a-79d1a5d9a950,ООО «Медведева»,"п. Плесецк, бул. Большевистский, д. 8/4, 168398",+7 (747) 208-25-30,Евстигней Александрович Селезнев
a275a663-c992-4973-9a45-413695fb3a3d,"ООО «Одинцова, Блинова и Тимофеева»","с. Лотошино, наб. Урожайная, д. 2/5 к. 3, 250376",8 (637) 075-1960,Антонина Кирилловна Гаврилова
dc03f2f3-fc21-472c-a13a-7af55c080f85,Сургутнефтегаз,"г. Осташков, бул. Озерный, д. 38 к. 947, 165994",81225707128,Ананий Федотович Лыткин
5ab62f36-6ad8-463f-882b-944b2c2085cb,Никонов Лтд,"к. Шерегеш, наб. Энтузиастов, д. 71 к. 878, 364993",8 (539) 572-8000,Агата Афанасьевна Федосеева
e690d789-3dfd-4514-852b-8397a615044c,ИП «Медведев-Михеева»,"ст. Юрьевец (Иван.), алл. Новгородская, д. 646 к. 82, 281471",83883735167,Гаврилова Лукия Захаровна
132336f8-8ef4-4f24-b19d-0fc6c87c7cb5,Азбука вкуса,"п. Прохладный, пер. Кооперативный, д. 2/2 стр. 79, 958822",+7 440 362 11 98,Абрамов Захар Владленович
c50e2048-c26b-4380-9e7b-6a61ddfa4fd2,Дмитриев Инкорпорэйтед,"д. Тура, алл. Мирная, д. 20 к. 410, 632359",+7 (504) 006-11-54,Симонова Нонна Борисовна
a2d39fd7-d5fe-42be-a235-a68a51367789,ИП «Сазонов-Панфилова»,"ст. Певек, пер. Вишневый, д. 9 к. 265, 518004",8 (275) 978-74-52,Прасковья Владимировна Денисова
95a6bd6b-b79a-440c-b609-04cf82528ab4,Северсталь,"ст. Черняховск, ш. Осипенко, д. 3/8 к. 896, 033042",8 (152) 296-9729,Максим Васильевич Волков
b7c0449b-9daa-4c14-b2f3-b72882380fbe,Шелл Нефть (Shell),"д. Чикола, наб. Кошевого, д. 636 к. 2, 494028",80038996733,Евграф Архипович Абрамов
f80aa311-ea21-4ec3-8f64-f30e60ed6694,"НПО «Шилова, Петрова и Суворов»","ст. Кулу, наб. Краснознаменная, д. 4/8 стр. 1/1, 526311",+7 975 881 8475,Белозерова Ксения Станиславовна
6b959692-66e9-4b24-a715-7b18bed22511,ООО «Гаврилова-Котова»,"п. Кажим, ш. Подгорное, д. 6/8, 820119",8 748 703 76 85,Алла Богдановна Анисимова
0be23bd2-9b5e-499d-a8bd-b3a9fd1a30e8,"ОАО «Новикова, Павлова и Дмитриева»","к. Сеймчан, бул. Никитина, д. 148 к. 61, 674599",81127068196,Оксана Геннадьевна Молчанова
92f0902b-e317-4a8b-af48-8e7b8c7e001e,Антонова Инк,"ст. Орел, ш. Мостовое, д. 275 к. 3, 587358",+7 (999) 591-26-62,Сергей Ярославович Ершов
17698d52-bc5a-4a5e-b52a-e3afd0f0a19f,ЗАО «Мухина Смирнов»,"с. Уэлен, наб. Тракторная, д. 588, 161951",8 (431) 546-82-27,Юлия Артемовна Брагина
b36b4ea1-6e6c-40f3-89a1-9520b645a1c5,НПО «Ефимова-Ларионов»,"клх Сеймчан, наб. Горького, д. 1/1 стр. 922, 664147",8 (822) 284-20-70,Иванова Оксана Аркадьевна
44405a2e-29a0-467b-8c5a-88e65389cd39,ВО Машиноимпорт,"д. Иваново, алл. Революционная, д. 4 к. 5, 070369",+7 (814) 443-82-01,Екатерина Вениаминовна Евсеева
615d3f02-55d4-4125-a8c7-f0dbef1595be,Дорофеева и партнеры,"ст. Дзержинск, наб. Высокая, д. 3, 245090",+7 (670) 629-4986,Емельян Ефстафьевич Фадеев
7b89f2ce-8f17-4e1c-a236-54a727e6f8fc,АО «Устинов-Муравьева»,"ст. Улан-Удэ, ул. Васильковая, д. 4/3 к. 428, 207197",89205528275,Кира Натановна Колобова
3063b169-5d94-4fc2-9371-fc1de5954c45,НПО «Мухина-Афанасьев»,"п. Катайск, пр. Народный, д. 921 стр. 30, 133837",86957594951,Белозеров Константин Юльевич
d387c718-e859-44f7-b048-f3c239e48346,Комос Групп,"с. Тымовское, ул. Дорожная, д. 6/7, 652285",89799350308,Зинаида Владиславовна Смирнова
92322ef7-4dc3-4bc5-8aae-6afa35210f7e,ИП «Борисов»,"с. Березники, бул. Юбилейный, д. 247 стр. 771, 728602",+7 713 584 4430,Валерий Матвеевич Галкин
686acf1b-f550-4331-b837-7f17a7153e40,Уралкалий,"к. Юрьев-Польский, пер. Курганный, д. 392, 856668",8 337 278 5238,Калашников Назар Тимурович
a3bec796-c1c1-481b-b39c-98bcc422c561,ЗАО «Ширяева-Комарова»,"к. Волгоград, пер. Проточный, д. 6/9, 338059",+7 744 793 25 37,Аверкий Теймуразович Блохин
da82e776-b390-4664-87fa-34a373bc220f,Савельева Инк,"д. Приозерск, ул. Саратовская, д. 97, 507839",+76100371780,Валентина Константиновна Титова
c5afa345-f396-41a0-ad26-6a284b3b63b9,Группа Эссен,"с. Камышлов, ш. Хуторское, д. 488 к. 7/1, 502754",88790190472,г-н Соболев Август Антипович
3d358f36-b38d-4b1c-86e7-de14a5ba81cf,Орлова Инкорпорэйтед,"с. Кежма, пр. Калинина, д. 7/1 к. 6/4, 845707",+7 (315) 945-44-64,Фрол Измаилович Никитин
b43fd261-92bb-441a-8de5-e5f301fd5f35,НПО «Григорьева»,"с. Малая Вишера, ул. Ворошилова, д. 9, 126013",+7 244 041 7036,Полякова Ангелина Кузьминична
3404ce32-c8ad-4463-ab7a-321eeb8fc8ca,ООО «Горбачев-Панфилов»,"с. Бологое, бул. Вахитова, д. 31 к. 2/6, 479461",+71094463560,Феофан Анатольевич Агафонов
70ed52a5-7804-400d-8ee5-7508e05d5ea4,РАО «Пахомова Самойлова»,"ст. Слюдянка, пр. Парковый, д. 1/5, 119115",8 (073) 639-8946,Хохлов Корнил Изотович
1291cb01-b087-42bf-9eaf-f47284007a6a,Беляев и партнеры,"г. Глазов, пер. Вольный, д. 95, 100949",+7 398 105 55 99,Мельникова Нинель Альбертовна
72073048-525d-4613-a418-6a694f14e9d8,АО «Тарасов Горбунова»,"п. Кизилюрт, пер. Российский, д. 1, 236660",8 156 499 4201,Данила Федосеевич Маслов
641487fa-d794-490d-9bdf-13ff2cb13f26,ИП «Мамонтова»,"к. Комсомольск-на-Амуре, наб. Гоголя, д. 6/9 к. 772, 169738",8 850 447 71 41,Игорь Авдеевич Зуев
adbae9a6-0196-4678-9e34-4178846bbd9f,Большаков и партнеры,"д. Аргаяш, бул. Малый, д. 178 стр. 16, 326619",+73251221539,Брагин Ипат Бориславович
a991c95a-1e76-4209-b68f-1e497758c5c0,НПО «Григорьева-Кононова»,"д. Омск, ул. Учительская, д. 33 стр. 7/7, 845731",8 (973) 896-8042,Носков Борис Фомич
9ea4dee8-e2e2-42c0-994f-079b68a74c5e,Антонов Инкорпорэйтед,"ст. Лабытнанги, алл. Сурикова, д. 11 стр. 3/1, 218102",8 (294) 998-9966,Владислав Иосифович Зиновьев
791f7eec-a38d-45e6-bdc3-089fcedc4bd3,"ЗАО «Юдин, Новикова и Селиверстова»","клх Щелково, пр. 40 лет Победы, д. 3/7 к. 5/3, 330882",8 897 053 31 93,Муравьева Варвара Рудольфовна
eff678d0-60fb-41ff-9586-cc467ed8072d,Комацу СНГ (Komatsu),"клх Салават, пер. Запрудный, д. 5/6 стр. 1, 968481",8 (836) 848-4994,Исаев Никон Тимурович
167027e5-9b4c-4735-8d5c-91d70a413e26,Овчинников Лимитед,"к. Набережные Челны, пр. Ольховый, д. 3/7, 071459",+7 021 281 0674,Анжела Ивановна Жданова
8f01901b-8eae-4924-8cc9-e48063799c69,АО «Попова Мартынова»,"клх Красноярск, ш. Королева, д. 3 стр. 5, 848871",8 646 852 9720,Элеонора Феликсовна Пестова
79aa0377-74aa-497d-b8b3-efe6e54308cf,Группа РЕСО,"п. Щельяюр, наб. Малиновая, д. 4, 201112",8 (228) 137-35-88,Нинель Андреевна Бурова
c85f686f-dae0-47d7-bcb7-8aaa56e1c073,АО «Гуляева»,"к. Приморско-Ахтарск, наб. З.Космодемьянской, д. 93 к. 36, 751626",+7 758 748 8240,Станислав Борисович Ефремов
803f1ead-a521-4b31-822f-1f798358ef6c,Филиппова Инкорпорэйтед,"д. Сортавала, алл. Февральская, д. 84 стр. 596, 174765",8 346 349 19 05,Цветков Куприян Харламович
1f6b5d0e-3e6a-4ad7-a494-14ad643d40d9,ОАО «Горшкова»,"клх Галич, алл. Троицкая, д. 15, 185345",+76232443166,Смирнов Ювеналий Трифонович
6d074c4b-9e06-4519-8c1c-edc5e3199922,ИП «Костина»,"д. Онега, алл. Луначарского, д. 95 стр. 9/7, 365121",+71627945988,Алла Борисовна Дроздова
ee9e91eb-e87a-4039-9916-ef1592d36576,ООО «Галкин Боброва»,"к. Катайск, наб. Карла Либкнехта, д. 43 стр. 273, 255624",84558263488,Анисимова Дарья Борисовна
3b7b8d4a-d526-4175-99e6-cefbc79bb64a,НПО «Симонов»,"с. Югорск, ш. Союзное, д. 183, 598825",8 (986) 733-32-51,Тихонова Вера Геннадьевна
c8bec8bb-66cc-42bb-948c-cb8e7fbd874b,АО «Елисеев»,"с. Ряжск, пер. Алтайский, д. 635, 386820",8 (167) 140-40-60,Светозар Аксёнович Емельянов
64abb4f4-995a-4bab-9fe8-5496dc597bcb,"НПО «Устинов, Кудрявцев и Афанасьев»","ст. Красноуральск, бул. Шоссейный, д. 270 к. 18, 549894",+7 516 699 27 43,Иванна Константиновна Григорьева
71233813-84bc-493e-abe5-2bb2bc1b440f,"ООО «Миронов, Фомин и Дорофеева»","ст. Славянск-на-Кубани, пр. Суворова, д. 9, 496725",8 809 197 0810,Бурова Тамара Натановна
cb00aed1-4891-4e45-9302-b6d0b5370601,Тетра Пак (Tetra Pak),"ст. Кунгур, наб. Новгородская, д. 5/3, 064990",81472754021,Анжела Натановна Куликова
053cd8eb-fb8f-4f29-b44e-d6e1e6cfda49,Филатова и партнеры,"п. Орел, пер. Курганный, д. 99, 827628",+7 010 264 20 65,Никитина Виктория Владимировна
6451a5d4-8814-470e-8c07-fea63838fa29,ЗАО «Романова-Бирюков»,"г. Курган, ул. Волочаевская, д. 982 к. 92, 470327",8 639 402 7400,Соболев Владислав Алексеевич
00d38230-0cab-448d-8c36-cdd5b596867d,НПО «Смирнов-Щукина»,"д. Красноуральск, пр. Высокий, д. 2 стр. 698, 422078",85008393126,Агафон Феоктистович Якушев
b8cf4cc2-1cc8-40fa-a397-7c046895ace4,ООО «Дементьев Копылов»,"д. Темрюк, ш. Балтийское, д. 2 стр. 563, 952913",8 (881) 946-72-29,Гришин Эрнст Харитонович
850b0ae6-c3b8-404a-998e-6f757389cc54,ОАО «Кузнецов-Третьяков»,"г. Александров Гай, наб. Кленовая, д. 685, 940784",8 571 227 16 51,Галина Аскольдовна Русакова
