id,title,address,phone_number,fio_representative
abd84eb2-04ac-4cf3-a1e8-201b128ecfea,ООО «Зиновьев»,"ст. Кущевская, пер. Гастелло, д. 19 стр. 299, 816253",+7 241 127 55 52,Дементьева Елена Кузьминична
2310535f-0005-41ae-982f-9d5b42ada787,ЗАО «Жукова Зимина»,"с. Нефтекамск, наб. Осипенко, д. 319 к. 962, 014656",8 222 193 63 46,Нинель Леоновна Гордеева
8848bcc7-89ed-4be5-b99f-93812103293b,"РАО «Цветкова, Елисеева и Суворов»","п. Яшкуль, ул. Весенняя, д. 8, 720851",8 (189) 568-23-80,Горбачева Эмилия Степановна
0dacbb36-1007-49f8-80ea-e2b26172a9ff,Группа Волга-Днепр,"ст. Ачинск, пер. Олега Кошевого, д. 7/4, 559030",81898273951,Казакова Надежда Ивановна
f4de5f8f-5800-44bd-8f3c-7758a250af21,ООО «Якушев»,"п. Астрахань, пер. Механизаторов, д. 4/9, 684207",8 (528) 128-42-87,Кононова Анастасия Дмитриевна
0a559b7c-aa53-4f6c-85ad-d2fd8a29237e,АО «Терентьев-Иванова»,"к. Лотошино, ш. Учительское, д. 793 к. 8/9, 589891",85647425714,Карп Афанасьевич Гришин
a84212fb-489f-4d01-a3ba-1d2596b4b71c,Российская электроника,"ст. Жуковский, алл. Линейная, д. 719 стр. 7, 342805",+7 (364) 902-8813,Вероника Георгиевна Красильникова
ea154789-0870-4e30-8b36-4368f3724e38,Зуев Инкорпорэйтед,"п. Красноярск, пр. Гончарова, д. 236 стр. 9, 019606",+7 (436) 450-38-41,Корнилова Ульяна Ивановна
e6070046-4f8c-46f4-b080-c21a19ec80d2,РАО «Бобров»,"п. Терскол, бул. Леонова, д. 56 стр. 58, 817958",+7 628 261 63 64,Агафья Станиславовна Морозова
df64e84e-9ad7-4b29-a0fa-fe6e3a9fabe2,ЗАО «Смирнова-Крылова»,"п. Мураши, ш. Гвардейское, д. 214 к. 377, 222809",8 (343) 404-5703,Осип Иларионович Блинов
501abcf7-87b4-4a28-bea7-3067f5a05e31,Сибирский антрацит,"ст. Суздаль, бул. Базарный, д. 3/9 к. 17, 959413",+7 (262) 945-8844,Макаров Любосмысл Всеволодович
eb561972-9e52-42f1-b3fd-69552c1c21c8,Савина Лтд,"с. Прохладный, ул. Пограничная, д. 67 стр. 594, 782637",8 573 137 1330,Гаврилов Иннокентий Адамович
5de69583-0a5e-4970-a737-a3baf53dd87f,НПО «Максимов-Авдеев»,"с. Кимры, наб. Кирпичная, д. 2/9 к. 8, 539091",+7 406 819 08 67,Прокофий Федосеевич Шестаков
cc0fabf9-e9a3-4737-87c1-aa7a635e3c33,ГСЛ,"п. Салават, пер. Майский, д. 4/8, 561478",86004521236,Станислав Викторович Иванов
8e4d01e6-c658-46a2-a26a-db2df3bd33bf,Холдинг Транспортные компоненты,"клх Мирный, пер. Микрорайон, д. 1, 590617",8 809 137 94 65,Шубина Синклитикия Васильевна
ce30a8e4-e00f-4a6c-b246-307aa98f2015,ЗАО «Шарапов-Ефремова»,"клх Тулун, бул. Нагорный, д. 5 стр. 88, 222893",8 (229) 890-8001,Фокин Сократ Трофимович
468b46ee-0e6b-4bad-a312-ff75c5656ae8,АО «Белов»,"с. Каргасок, бул. Красноярский, д. 62 стр. 27, 245819",+7 (930) 348-15-57,Фролов Потап Вячеславович
c89e5359-4d63-44a5-8658-0f3630e7c492,Крюков Инк,"клх Брянск, пр. Геологический, д. 2 стр. 216, 393890",+78908500437,Леонтий Фадеевич Дементьев
b6cf259d-2c77-478a-80b5-76fb0946617f,ООО «Артемьев Мишин»,"клх Усть-Камчатск, пер. Советский, д. 593, 316756",8 548 638 8945,Лавр Тихонович Антонов
a8d573f0-13a3-47c9-ad62-f91f69ad0848,Омега Групп,"клх Нарым, алл. Подстанция, д. 9 стр. 2, 100935",+7 (038) 932-77-48,Алевтина Владимировна Михайлова
a4d3b37e-5d75-449b-8b52-6f2c9a201379,ОАО «Туров Михеева»,"к. Бреды, наб. Добролюбова, д. 7/8 стр. 96, 403148",+75509451272,Харлампий Гавриилович Медведев
c169e435-e09c-46dd-b9a3-003bfd119612,"ОАО «Смирнов, Емельянова и Киселев»","к. Сунтар, пр. Ключевой, д. 46 стр. 8, 479845",84037511087,Николаева Зинаида Рудольфовна
c07124a8-07f3-44b6-99d5-a5703d138e9b,Воробьева Групп,"ст. Звенигород, пер. Приозерный, д. 5/6, 282493",8 085 796 79 47,Исаков Лонгин Анисимович
ab8042c7-05c8-431e-abad-f22b458d6d0b,"РАО «Мельникова, Савельева и Ковалев»","ст. Палана, пер. Свободы, д. 468 стр. 7, 736701",8 248 163 5444,Жанна Федоровна Колесникова
2c8197e7-cbe8-4e0c-9122-7413df96d517,"ЗАО «Кононова, Афанасьева и Макарова»","п. Чокурдах, пер. Вокзальный, д. 7, 057215",+7 (683) 867-41-15,Максимильян Ефстафьевич Антонов
2d9ca39f-f078-4cec-ad90-ea5c1ab4efba,РАО «Терентьева»,"с. Ачхой Мартан, ш. Украинское, д. 648, 416890",+7 683 688 86 41,Родион Валерианович Исаев
d994e1ec-6bad-4aa8-bfd1-b0429d885c5b,ЗАО «Дроздов»,"клх Тимашевск, алл. Слободская, д. 1/2, 335631",8 (218) 737-1391,Шашкова Варвара Константиновна
a289d3b7-e229-4dd1-b25b-2815f064907a,АО «Щукина»,"к. Соль-Илецк, алл. Приозерная, д. 55 стр. 5/5, 313351",8 (569) 099-36-76,София Львовна Бобылева
401fcf26-fc05-4be1-bc80-cf0c3e5f9af4,РАО «Дьячкова-Дементьева»,"п. Верхний Уфалей, наб. Надежды, д. 3 стр. 3, 629462",+7 284 465 54 52,Платон Алексеевич Новиков
a3adce71-6152-4229-b048-463fabf2b6d0,"ЗАО «Лукина, Юдин и Борисов»","клх Тымовское, бул. Достоевского, д. 3/9 стр. 6/9, 082684",8 413 461 37 86,Панфил Антипович Костин
54a761b5-5e9c-45aa-a7a0-33cb097eebb4,"ООО «Никифорова, Щукин и Ефремова»","г. Яр-Сале, бул. Толбухина, д. 19 стр. 73, 352053",8 684 886 4891,Валентин Герасимович Артемьев
f6207a9f-d91a-4163-9b0a-324f1900d532,РАО «Якушев Павлов»,"клх Пермь, бул. 40 лет Октября, д. 7/8 стр. 9, 571894",+75176681861,Захар Афанасьевич Большаков
8a397a5d-1285-41f1-9dcd-f609617bc61c,РАО «Журавлева Емельянов»,"к. Оймякон, пр. Революции, д. 1 к. 7/5, 192524",+7 (194) 595-0957,Нестерова Алла Кузьминична
cdfea637-acb2-4a63-9098-3e38547c29a4,Гордеев Групп,"ст. Мценск, пр. Чапаева, д. 28, 312908",+7 967 930 87 02,Чернова Кира Федоровна
e1e96a44-da93-4143-9b33-2f51859bac0d,Таграс (ТНГ-Групп),"с. Радужный, наб. Луговая, д. 1, 197770",+7 359 470 5755,Жданов Селиван Чеславович
65c1fee0-4551-4e83-8b8d-37d3cbfd6f32,Неофарм,"г. Партизанск, бул. Ясный, д. 75, 314157",8 411 303 5682,Сысоева Татьяна Анатольевна
68e76b18-3a13-4a32-b5d5-258a65495bbd,ООО «Зыкова Никифоров»,"с. Прохладный, алл. Морская, д. 5 к. 45, 003271",+74126792340,Молчанова Синклитикия Николаевна
b5e184d4-c486-472f-bce4-6b0044f3cbe5,Голубева Лимитед,"г. Пинега, ш. Мелиораторов, д. 8/8, 870512",8 087 078 3469,Зоя Яковлевна Макарова
e188d379-17a2-4cbc-bf94-426a8d1d9632,ОАО «Панфилова-Кошелев»,"д. Усть-Ордынский, алл. Свободная, д. 24 стр. 316, 160603",8 (103) 305-60-12,Екатерина Афанасьевна Котова
e4b8f1ac-07cc-4a8d-8ba9-b3a5ee642b4f,"ОАО «Ширяева, Потапова и Осипов»","ст. Воркута, пр. Дальневосточный, д. 155 к. 6/7, 465538",8 (066) 317-62-25,Аксенов Мина Бориславович
84edeb9f-cf83-46bb-af1f-1759f283a9b0,ЗАО «Уварова Матвеева»,"п. Лесной (Сверд.), бул. Юности, д. 4 к. 3, 323070",+7 612 342 58 30,Туров Митофан Ефремович
fc02d1d4-d905-4eab-a65c-b311f38e34d9,АО «Исаева»,"ст. Пушкино (Моск.), пр. Чернышевского, д. 5 стр. 2, 652694",+7 (252) 015-92-11,Изот Матвеевич Мишин
9d41e6a0-f12b-420d-b6a7-3db65052b055,Блохин Лимитед,"клх Салехард, наб. Ключевая, д. 76, 942238",+74715184619,Моисеева Елена Алексеевна
344018e9-0457-4c41-a9e2-868b184a0fd0,АО «Рябов»,"клх Лабинск, алл. Песочная, д. 7 к. 4, 082593",+7 598 821 3711,Кошелев Семен Архипович
28f50e96-2027-46ef-b585-63c03dd46bbb,ИКЕА Дом (INGKA),"п. Петрозаводск, пер. Мичурина, д. 7 к. 8/3, 346464",+7 055 861 72 03,Панов Сергей Феоктистович
46d8f78e-bc7e-4503-be47-cad907fec317,ЗАО «Галкина»,"г. Калач, ш. Волжское, д. 7, 080382",8 (451) 429-4478,Миронов Еремей Терентьевич
c1645756-f72a-41c9-886c-971862f408e7,Коновалов Лимитед,"д. Тосно, наб. Новоселов, д. 6/1, 057726",8 (514) 404-40-77,Шашкова Ольга Юрьевна
fd6ea836-2cd7-4526-b32b-ab0070e8eeaa,ГК ЕКС,"п. Ульяновск, алл. Кирпичная, д. 9 к. 85, 751278",8 856 752 9911,Конон Аверьянович Назаров
7e381a41-6eda-480d-b9aa-2bed1b94a647,Куликов Лимитед,"к. Вологда, бул. Кузнечный, д. 5/6, 115723",8 665 595 67 23,Селезнева Нонна Наумовна
32e7d37e-d87f-47d5-a857-128837d98da8,Сургутнефтегаз,"к. Славгород, ш. Попова, д. 1/1, 410530",8 993 960 5462,Гордеева Анна Матвеевна
843bf50c-7659-4c25-b04a-d559f9724042,ОАО «Захарова-Блинова»,"к. Петрозаводск, пр. Путейский, д. 9 стр. 3/4, 429699",8 520 749 77 85,Касьян Жанович Дьячков
e026df9f-326d-4a75-8a9a-ea248c8790fd,Котов и партнеры,"г. Кириши, наб. Кольцова, д. 208, 887617",8 (833) 487-9070,Поликарп Терентьевич Кудрявцев
9cc058f5-97f7-4a4e-ac2a-edcefd03ee37,РАО «Горшкова-Рогова»,"с. Ишим, пер. Дружба, д. 896, 853551",8 (787) 010-53-44,Федосеева Элеонора Геннадьевна
0f2049a2-f067-40d9-9c4e-90199a1d6d22,ООО «Фомичев-Лобанова»,"клх Иваново, наб. Шоссейная, д. 6, 883942",+7 174 733 64 66,Глафира Кузьминична Галкина
8fa9f903-a08f-46fd-8de0-178f0b14812e,ООО «Молчанов»,"д. Кулунда, ул. Волжская, д. 292 стр. 1/3, 397768",+7 (122) 853-97-69,Трофимов Матвей Вячеславович
f9b15f2c-1dc8-4e41-b1c8-4797e484d20c,"НПО «Князев, Горбунов и Зимин»","п. Курильск, пр. Базарный, д. 2/8 стр. 8, 534438",+7 (297) 198-84-85,Аполлон Августович Шилов
efaf9247-7a6b-4c32-8b0a-5a8b1e22e2e8,Гордеев Лимитед,"ст. Коломна, наб. Таманская, д. 3, 647898",8 961 395 28 88,Киселева Юлия Кузьминична
58016887-11ab-4f3c-ab84-db8b631e179a,АО «Носова»,"к. Усть-Кулом, ул. Новостройка, д. 1 к. 919, 568927",8 930 864 05 23,Зайцев Пров Марсович
527f24ce-fd7f-4943-b3d7-9974de934156,Сименс (Siemens),"д. Бузулук, пер. Кочубея, д. 32, 811239",+7 029 765 9902,Юлий Дмитриевич Зайцев
946a45df-a684-4dd0-be29-906782e93661,РАО «Петухова-Кондратьева»,"д. Жуковский, ул. Краснодарская, д. 2/7 к. 99, 490649",8 (198) 865-01-67,Новиков Артемий Измаилович
eaa9b341-5897-4e27-8ea1-a0feac6ae1d9,Красцветмет,"с. Киренск, ш. Ульянова, д. 56 к. 65, 351663",8 857 408 10 89,Веселова Александра Ниловна
1208d168-3cb5-4fe0-abce-4607eceb7940,"ОАО «Туров, Никитина и Рябов»","ст. Энгельс, ш. Титова, д. 4 к. 5, 389523",8 (633) 507-65-70,Фадеев Карп Трифонович
a8149f0b-920e-42fc-876e-d5fdbf2bdf06,Еврохим,"д. Александров Гай, наб. Огородная, д. 3/8 к. 5, 029536",8 805 369 27 09,Майя Степановна Соколова
eaeddbfd-35eb-494b-ad19-a90f14a4c9cd,Самсонова Лтд,"д. Черский, пр. Вишневый, д. 778 стр. 9, 207081",83731976297,Савельев Радован Захарьевич
1692fede-9831-4550-abe4-ef15dd1adaa0,РАО «Пестова»,"д. Смоленск, ул. 60 лет Октября, д. 424, 736713",8 (508) 435-75-41,Маргарита Феликсовна Афанасьева
14ff6510-3276-4892-83b9-0379d4dbf5c9,Авторусь,"ст. Нижнеудинск, пер. Береговой, д. 502 стр. 87, 866725",82023525678,Вероника Аскольдовна Щукина
c7023569-f8fc-4819-b7bb-c37648afdd30,Лапина Лимитед,"д. Мыс Шмидта, ул. Короленко, д. 965, 273051",+7 (625) 471-0718,Алевтина Григорьевна Назарова
4b1d3e38-b1f5-4aba-bd1a-90ced1a0a5e7,АО «Артемьева-Соколова»,"г. Стрежевой, алл. Репина, д. 200 к. 8/3, 653269",8 (217) 698-0231,Мамонтов Родион Вячеславович
186324d3-57f0-41d6-8e51-b4572173e3e1,"ИП «Архипов, Емельянова и Сорокин»","клх Кизел, ш. Шевченко, д. 63 к. 9, 784025",8 (824) 766-8291,Орлов Сергей Артурович
44692704-3fa5-479c-ba97-a6f204c9be9c,Мессояханефтегаз,"п. Черкесск, наб. Литейная, д. 3 к. 731, 028574",+77384999586,Архипова Полина Александровна
7e85cd1a-9d44-4592-9cef-d90c0fe4a73c,АО «Муравьева»,"с. Томск, пр. Свободный, д. 6 к. 8, 696515",85790070663,Дарья Львовна Пестова
b15a1983-38ab-457d-81c5-293007490d8a,АНГК,"к. Иваново, пр. Розы Люксембург, д. 9/6 стр. 975, 591611",8 527 983 7081,Борисова Эмилия Аскольдовна
99e9f506-3547-49e5-9090-7d0b2e780bed,"ИП «Боброва, Шарапова и Сысоева»","к. Кетченеры, пр. Харьковский, д. 4 к. 771, 634185",+7 (344) 737-2841,Дмитриев Радислав Феодосьевич
c468420b-6733-44ba-860e-4a507ea4298e,Аргос,"к. Саров (Морд.), ш. Флотское, д. 778 к. 2, 621516",8 543 200 3692,Радислав Антипович Агафонов
762b62c1-4dda-47ff-a6c2-0114bfd6f5a3,АО «Антонов Мухина»,"ст. Горно-Алтайск, наб. Петровская, д. 583, 763224",8 553 783 3779,Пестова Оксана Владимировна
d2af3090-7625-4a9a-bad0-cefaa5ac8b25,"ИП «Жукова, Воронов и Некрасова»","г. Новокузнецк, ш. Родниковое, д. 5/7 стр. 303, 491750",8 (630) 631-2305,Фадеева Нина Максимовна
63b5dc7f-df08-46c8-88e7-8ce6cffad0c5,ООО «Некрасова-Уваров»,"к. Амурск, алл. Славянская, д. 17, 864428",+7 792 683 95 85,Маркова Елизавета Наумовна
50b44e1c-6cb2-494f-9c7f-c4797f7234dd,Первый канал,"д. Бугуруслан, бул. Инженерный, д. 6 стр. 227, 366853",8 663 828 17 53,Пантелеймон Якубович Блохин
c4025dd0-9e5a-4b7d-b8f5-f13c5f89fe56,АО «Фадеев Савельева»,"ст. Серов, ул. Суворова, д. 4, 490001",8 399 607 6084,Пахомова Кира Дмитриевна
d1e678f0-68db-4fc4-bcf8-082212821648,БСХ Бытовые приборы  (BSH Hausgerate),"п. Ржев, ул. Курская, д. 4 стр. 552, 448958",8 (306) 829-6281,Борислав Феофанович Петухов
bb549eae-a71f-4f63-8978-7777b308569f,АО «Герасимов»,"клх Усть-Калманка, ул. Курганная, д. 388, 625943",+7 (300) 727-93-29,Любовь Романовна Шарова
a6a9c83e-b9b6-4f17-b734-575185a82bf9,Селезнева Групп,"п. Агата, алл. Привокзальная, д. 33, 044856",8 989 907 00 40,Александр Жоресович Филиппов
429342fc-b306-4372-a4f2-0cd7c1c99ad5,Журавлева и партнеры,"п. Невельск, ш. Станционное, д. 6, 833726",8 (035) 396-83-58,Тамара Львовна Иванова
2526f62e-6874-4ccf-9df0-d85f0d6c1037,"ЗАО «Карпов, Веселов и Николаева»","с. Коломна, наб. Широкая, д. 523 к. 524, 797423",85024812802,Галкин Максимильян Филимонович
eac4c8d6-5a74-4f3b-a0f1-e00b03b79e44,РАО «Воробьева-Маслов»,"д. Зарайск, пер. Толстого, д. 537 стр. 6/3, 190706",+74508289931,Марина Геннадьевна Соколова
08004cad-4dbe-44cf-9276-a51a180681c2,АО «Шарова»,"ст. Соловки, алл. Суворова, д. 789, 369034",87641259128,Жданова Ирина Робертовна
dd018ab6-8500-4f18-85ea-3fe27aca3666,ООО «Евдокимова Иванов»,"п. Ачинск, ул. Титова, д. 44 к. 11, 755063",+7 445 515 76 71,Алла Романовна Белозерова
0a001fa2-ae1a-49bf-9c33-bab403464af1,АО «Веселов-Веселова»,"п. Гремячинск (Бурят.), ул. Смоленская, д. 7 стр. 4, 991115",+7 (971) 491-04-54,Агафья Руслановна Зыкова
4aedd483-47a5-4b74-896c-6af53168ebc3,ООО «Лазарева-Беляева»,"с. Корсаков, наб. Пархоменко, д. 226 стр. 581, 691603",+7 279 042 78 94,Глафира Константиновна Федотова
28ca18b2-32d3-47d7-92e5-f526bda35061,"АО «Пахомов, Веселова и Воронова»","с. Александров Гай, пр. Крупской, д. 7, 573631",8 (123) 649-85-20,Платон Арсеньевич Мамонтов
b48bc4a3-6650-4b2d-98ca-4805a76ffa74,Артис-Агро Экспорт,"п. Тарко-Сале, пер. Социалистический, д. 47, 124371",+7 273 647 8272,Лавр Власович Воронов
cd6caacf-8ec5-4c00-a378-c37b303a22be,ИП «Блинов-Яковлев»,"д. Березники, бул. Котовского, д. 6, 038437",+7 462 606 91 32,Ермакова Ираида Вениаминовна
9e86f6b3-eaca-46a9-9dfd-0c239874d38e,ОАО «Гришина»,"ст. Воркута, ш. Фестивальное, д. 6/3 к. 5, 206770",+7 (607) 223-0127,Богданов Варфоломей Фокич
febc5822-b1ac-4b81-bacb-7c799daccae0,ОАО «Лазарев-Дмитриева»,"клх Сызрань, пер. Королева, д. 70 стр. 5, 613063",8 088 582 40 44,Наркис Юлианович Пономарев
9bef23da-8d32-46ec-8c8e-54bb1a6e13b9,Воронцова Инк,"г. Красновишерск, бул. Астраханский, д. 42, 734105",8 (474) 337-75-80,Ян Фролович Константинов
e7a0bde1-4c0c-431b-877b-3ba79359e7ad,РАО «Воробьева Комиссарова»,"д. Партизанск, ул. Моховая, д. 39, 931269",+7 (998) 546-6648,Наталья Федоровна Матвеева
4d4b82e1-d357-463e-a335-cd6763ab1a2c,Большакова Лтд,"д. Алагир, пер. Клары Цеткин, д. 569 стр. 82, 465505",+7 (063) 907-4551,Лора Вениаминовна Артемьева
2dc3d087-fea8-4129-9f91-3e8d4c4bed5f,Субботина и партнеры,"к. Игнашино, ш. О.Кошевого, д. 300 стр. 764, 449734",8 (240) 162-5981,Носкова Дарья Владимировна
f2444a70-f974-4b58-9a9f-7ef853987b28,"ОАО «Шубин, Самойлова и Лукина»","клх Щелково, наб. Пугачева, д. 64, 749540",+7 785 030 77 75,Константинова Людмила Григорьевна
40c1e629-f38c-4581-a8ab-fdb95be99c9a,НПО «Меркушева-Шестаков»,"п. Малгобек, пер. Сельский, д. 5, 912959",+7 911 143 3882,Комаров Мариан Валерианович
eed56cc4-1371-4223-a7fb-a91c590c6259,Тихонова Групп,"п. Кашхатау, ш. Волочаевское, д. 742 к. 5/1, 867679",+71287548097,Маслов Ярослав Харитонович
6b9a9197-a7d4-4af7-b838-8e320cb8f7f7,"РАО «Филатова, Цветков и Казакова»","ст. Дербент, алл. Таманская, д. 2 стр. 786, 824805",+7 857 351 92 88,Титова Юлия Вячеславовна
24937210-f2ca-4879-a24e-b2d903eeb65e,ИП «Фомина»,"клх Устюжна, алл. Ермака, д. 523, 245562",8 (159) 640-8902,тов. Соколова Валентина Рубеновна
b7f7fd93-8f7c-43b8-9aca-eaed2581b650,Рожков и партнеры,"д. Чита, пр. Студенческий, д. 6/9 к. 76, 000760",84810957684,Афанасьев Радован Игнатьевич
a4c258f2-c87f-486a-9aa8-be5d221d8de0,ЗАО «Ковалева-Морозова»,"с. Юрьевец (Иван.), ш. Овражное, д. 814 стр. 157, 129743",+7 416 569 48 77,Фёкла Дмитриевна Савина
312b9da7-1834-4bc9-9728-92e17f730029,"ООО «Горбачев, Поляков и Владимиров»","г. Змеиногорск, ул. Энгельса, д. 7 стр. 5/7, 852068",+76175174237,Киселева Людмила Захаровна
f7410ecb-deb7-4d22-bc53-a7af604efbc9,РАО «Аксенова»,"ст. Ясный (Оренб.), алл. Поперечная, д. 2/7, 062094",8 621 648 94 06,Варлаам Борисович Михеев
33386119-a332-469c-8d7b-de4d869cbe6d,"ОАО «Сафонова, Меркушев и Миронова»","п. Кудымкар, алл. Театральная, д. 14 к. 5, 271659",8 (203) 270-19-55,Котов Флорентин Алексеевич
c44de649-ad82-4317-b0e7-e6e5ac197d12,ЗАО «Никонова Ефимова»,"г. Приозерск, наб. Карьерная, д. 52 к. 1, 039677",8 (968) 957-57-91,Селезнева Глафира Матвеевна
fd377067-cdda-4a26-a4fd-7b1357258c0f,Великолукский мясокомбинат,"ст. Кириши, алл. Юбилейная, д. 199, 287408",+7 620 723 3141,Князева Антонина Юльевна
4bd90989-f51b-4629-af34-d68ba7d2fc92,Славнефть,"г. Уэлен, бул. Механизаторов, д. 5/6 стр. 4/4, 428274",81390624111,Васильева Людмила Владиславовна
a0154354-dcbe-4301-8713-717b00ac5b7e,ОАО «Суворова Алексеева»,"д. Кулу, наб. Заливная, д. 438 стр. 668, 823210",+7 344 910 4788,Фотий Тарасович Гущин
0826fee0-544d-42fa-a749-51b181ade39c,ЗАО «Баранова-Юдина»,"к. Подольск, алл. Радужная, д. 32, 356352",86874941614,Людмила Рубеновна Гаврилова
6903faa8-2398-4815-a00d-b6deb0b5cca7,ИП «Александров Федосеева»,"д. Юрьев-Польский, алл. Шмидта, д. 5/8, 028546",+7 602 539 4414,Емельянов Венедикт Жоресович
e82d1470-f4fc-4792-8011-a29e55a3c5dc,ВТБ,"п. Мценск, алл. Красных Партизан, д. 4/1 стр. 35, 014343",89059942763,Зиновьев Емельян Германович
508dec46-06d0-4a6b-be42-2faec8a81340,Нижнекамскнефтехим,"к. Елабуга, алл. Радужная, д. 96, 796054",+7 (971) 268-16-91,Кудрявцев Терентий Трифонович
ed7d0d38-9238-4c8d-983c-e774977a2bd4,Григорьев Лимитед,"к. Ярославль, ш. Болотное, д. 400, 376662",8 057 999 5452,Ладислав Харламович Орлов
031af48f-24b7-4e02-b5d6-31950039fc2e,Ефимов Лтд,"клх Беслан, бул. Станционный, д. 6/6, 823724",8 426 655 66 20,Кузьмина Раиса Викторовна
f6cd96ea-b1db-4c25-a265-ed38e093e7c9,Дементьева Лимитед,"с. Звенигород, ш. Труда, д. 5 стр. 1, 616686",8 631 109 19 43,Дарья Ниловна Морозова
a1ef4938-f2eb-49ea-a209-00161d7d07cf,ИП «Никитин»,"д. Киренск, ул. Чайкиной, д. 157, 058556",8 (901) 429-8709,г-жа Андреева Евфросиния Николаевна
